Item Title,Item Price,Item ID,Number Sold,Brand,Manufacturer Part Number,Reference OE/OEM Number,MPN,Reference
Catalytic Converter fits BMW 328 E46 2.8 98 to 00 BM 11627503673 Quality New,183.01,233651575416,N/A,BM Cats,2472551RMP,"AS: 45221, BMW: 11627503673, EEC: BM6059, EuroFlo: ECBM1108, WALKER: 28181, BM91626",2472551RMP,https://www.ebay.co.uk/sch/carpartsinmotion/m.html?_nkw&_armrs=1&_ipg&_from&_clu=2&_fcid=3&_localstpos&_stpos&gbr=1&_udlo=183.24000000000743&_udhi=183.29000000000744&_sop=2&_ipg=200
Timing Chain Kit fits PEUGEOT 2008 CU 1.6 2013 on 5FS(EP6C) BGA 0805K1 0805K2,183.34,233655391785,N/A,BGA,1188547RMP,"BMW: 11217588996, 11311439853, 11317533879, 11317577301, BMW: 11317577631, 11317593309, CITROËN: 0513.C8, 0805.K1, CITROËN: 0805.K2, 0816.J2, 0818.33, 0818.40, 0818.41, 0829.G3, CITROËN: 818.33, 818.4, 818.41, V861831880, DS: V861831880, FAI AutoParts: TCK129VVT, MINI: 11317534768, 11317534771, MINI: 11367536085, 11367545862, PEUGEOT: 0513.C8, 0816.J2, PEUGEOT: 0818.33, 0818.40, 0818.41, 0829.G3, 818.33, 818.4, PEUGEOT: 818.41, V861831880, TC1030VFK",1188547RMP,https://www.ebay.co.uk/sch/carpartsinmotion/m.html?_nkw&_armrs=1&_ipg&_from&_clu=2&_fcid=3&_localstpos&_stpos&gbr=1&_udlo=183.29000000000744&_udhi=183.34000000000745&_sop=2&_ipg=200
Wheel Bearing Kit FBK1298 First Line 31206852091 31206877562 31206789508 Quality,190.74,333714104110,N/A,First Line,FBK1298,"BENDIX: 051548B, BMW: 31206852091, 31206877562, 31206789508, BMW: 3126789508, BRT Bearings: PWK1888, FAG: 713649470, MOOG: BM-WB-12754, NK: 751522, RUVILLE: 6256, TRISCAN: 853011128",FBK1298,https://www.ebay.co.uk/sch/carpartsinmotion/m.html?_nkw&_armrs=1&_ipg&_from&_clu=2&_fcid=3&_localstpos&_stpos&gbr=1&_udlo=190.74000000000913&_udhi=190.79000000000914&_sop=2&_ipg=200
Timing Chain Kit fits AUDI A3 8P 1.4 07 to 13 BGA 03C103714B 03C105209AC Quality,190.79,233651576490,N/A,BGA,1967038RMP,"AUDI: 03C103714B, 03C105159H, 03C105209AC, 03C109088B, 03C109158A, AUDI: 03C109287F, 03C109469K, 03C109507AE, 03C109507AH, AUDI: 03C109509P, 03C109571F, 03C115121N, 03C115230C, 03E109511, AUDI: N90256202, N90365901, N91048601, N91097201, FAI AutoParts: TCK87VVT, SEAT: 03C103714B, 03C105159H, SEAT: 03C105209AC, 03C109088B, 03C109158A, 03C109287F, 03C109469K, SEAT: 03C109507AE, 03C109507AH, 03C109509P, 03C109571F, SEAT: 03C115121N, 03C115230C, 03E109511, N90256202, N90365901, SEAT: N91048601, N91097201, SKODA: 03C103714B, 03C105159H, SKODA: 03C105209AC, 03C109088B, 03C109158A, 03C109287F, SKODA: 03C109469K, 03C109507AE, 03C109507AH, 03C109509P, SKODA: 03C109571F, 03C115121N, 03C115230C, 03E109511, N90256202, SKODA: N90365901, N91048601, N91097201, VW: 03C103714B, VW: 03C105159H, 03C105209AC, 03C109088B, 03C109158A, 03C109287F, VW: 03C109469K, 03C109507AE, 03C109507AH, 03C109509P, 03C109571F, VW: 03C115121N, 03C115230C, 03E109511, N90256202, N90365901, VW: N91048601, N91097201, TC2005VFK",1967038RMP,https://www.ebay.co.uk/sch/carpartsinmotion/m.html?_nkw&_armrs=1&_ipg&_from&_clu=2&_fcid=3&_localstpos&_stpos&gbr=1&_udlo=190.79000000000914&_udhi=190.84000000000916&_sop=2&_ipg=200
Fuel Pump fits MG MGZS 120 1.8 In tank 18K4F Lemark Genuine Quality Guaranteed,190.84,333715618874,N/A,Lemark,4896344RMP,"BOSCH: 0986580179, CAMBIARE: VE523001, ERA: 770016, FIRST LINE: FFP1408, FUELPARTS: FP5251, INTERMOTOR: 39173, LUCAS CAV: FDB1094, MAGNETI MARELLI: SUA422, MEAT & DORIA: 76571, ROVER: WFX100630, WFX100631, VALEO: 347011, VEMO: V49-09-0002, VXPRO: EF4051, XEVO: XFP8079, LFP270",4896344RMP,https://www.ebay.co.uk/sch/carpartsinmotion/m.html?_nkw&_armrs=1&_ipg&_from&_clu=2&_fcid=3&_localstpos&_stpos&gbr=1&_udlo=190.84000000000916&_udhi=190.89000000000917&_sop=2&_ipg=200
Alternator DRA0079 Remy 3730022600 DA1189 Genuine Top Quality Guaranteed,190.89,233705445380,N/A,Remy,DRA0079,"AMK: LRA02136, Auto Electro: AEA2230, AUTOELECTRO: AEB1789, BOSCH: 0986080790, CASCO: CAL32102, CAL32102GS, CEVAM: 9034, DRI: 226159802, EDR: 930079, EFEL: EF39700, ELSTOCK: 28-4582, ELSTOCK: 284582, EUROTEC: 12060763, HC-Cargo: 111309, HELLA: 8EL738207-001, 8EL738207001, HOLGER CRISTIANSEN: JA1788IR, HYUNDAI: 3730022600, LETRIKA: IAJ0102, Lucas: LRA02136, LUCAS ELECTRICAL: LRA2136, MANDO: AB180128, Motaquip: MQ30079, Quinton Hazell: 9060510, ROLLING COMPONENTS: ALT269, Sovereign: SA848, VALEO: 440104, 600044, 600713, 608381, TG9S018, WAI: 13839N",DRA0079,https://www.ebay.co.uk/sch/carpartsinmotion/m.html?_nkw&_armrs=1&_ipg&_from&_clu=2&_fcid=3&_localstpos&_stpos&gbr=1&_udlo=190.89000000000917&_udhi=190.94000000000918&_sop=2&_ipg=200
Alternator fits VOLKSWAGEN BEETLE 5C 1.6D 2.0D 11 to 16 Bosch 03L903023F 304183,190.94,333710494065,N/A,Bosch,2422844RMP,"AUDI: 03L903023F, 06F903023A, 06F903023C, 06F903023J, BOSCH: 0124525039, 0124525050, 0124525066, 0124525067, BOSCH: 0124525091, 0124525092, 0124525525, 0124525539, BOSCH: 0986048180, DELCO REMY: DRB5340, HC-PARTS: CA1782IR, HELLA: 8EL738192-001, KARMANN: 304183, LUCAS ELECTRICAL: LRA2291, LUCAS ELECTRICAL: LRA3156, LRA02291, LRA03156, MERCEDES-BENZ: HVW0001540102, SEAT: 03L903023F, 06F903023A, SEAT: 06F903023J, 06F903023A, 06F903023F, 06F903023J, SKODA: 03L903023F, 06F903023A, 06F903023C, 06F903023F, 06F903023A, SKODA: 06F903023F, VALEO: 2542596, 2542695, 2542695A, 2542695C, VALEO: 2542695D, 2542898, 2543282, 2607703A, 437454, 437526, VALEO: 439489, TG14C011, TG14C015, TG14C016, TG14C026, VW: 03L903023F, 06F903023A, 06F903023C, 06F903023F, 06F903023J, VW: 06F903023A, 06F903023AX, 06F903023C, 06F903023CX, 06F903023F, VW: 06F903023FX, 06F903023H, 06F903023HX, 06F903023J, 0986045340",2422844RMP,https://www.ebay.co.uk/sch/carpartsinmotion/m.html?_nkw&_armrs=1&_ipg&_from&_clu=2&_fcid=3&_localstpos&_stpos&gbr=1&_udlo=190.94000000000918&_udhi=190.9900000000092&_sop=2&_ipg=200
Starter Motor fits BMW Remy 7788680 12412344232 12417788680 12412155827 Quality,191,333718703260,N/A,Remy,191489RMP,"AMK: LRS01964, ATL Autotechnik: A22880, A77850, Auto Electro: AEY1964, BMW: 12412155827, 12412344232, 12417788680, BMW: 12417788682, 7788680, Bosch: 0986022880, 2288, CASCO: CST30157, CST30157GS, CEVAM: 3187, 3861, DENSO: 428000-0660, Denso: 4280000660, DSN959, DRI: 315138112, EAI: 12043, EDR: 910115, EFEL: EF15110, ELSTOCK: 26-3326, 263326, HC-Cargo: 112533, 114072, HOLGER CRISTIANSEN: CS1473, Lucas: LRS01964, LUCAS ELECTRICAL: LRA445, MAGNETI MARELLI: 063280071010, MSN8071, Motaquip: MQ10115, Quinton Hazell: 8080174, Remy: X910115, Sovereign: SS453, Valeo: 455889, VALEO: 458880, WAI: 32964N, DRS0115",191489RMP,https://www.ebay.co.uk/sch/carpartsinmotion/m.html?_nkw&_armrs=1&_ipg&_from&_clu=2&_fcid=3&_localstpos&_stpos&gbr=1&_udlo=190.9900000000092&_udhi=191.0400000000092&_sop=2&_ipg=200
Alternator fits SKODA SUPERB 3T 1.6D 10 to 15 CAYC B&B 021903026L 03G903023 New,191.09,233672934570,N/A,Borg & Beck,5836593RMP,"ACL: ADA101116, AUTOELECTRO: AEK2931, BLUE PRINT: ADA101116, BOSCH: 0121715003, 0121715103, 0986081230, 8123, CARGOPARTS: CA1912IR, DELCO REMY: DRA0201, ELSTOCK: 28-5545, FRIESEN: 9045350, HOLGER CRISTIANSEN: CA1912IR, LUCAS: LRA02931, ROLLING COMPONENTS: ALT2050CP, VAG: 021903026L, 03G903023, VAG: 03G903023X, 03L903023E, VALEO: 2542783, 254783, 2605717A, VALEO: 437555, 439558, FG18T033, TG17C019, WAI: 11221N, BBA2511",5836593RMP,https://www.ebay.co.uk/sch/carpartsinmotion/m.html?_nkw&_armrs=1&_ipg&_from&_clu=2&_fcid=3&_localstpos&_stpos&gbr=1&_udlo=191.0900000000092&_udhi=191.14000000000922&_sop=2&_ipg=200
Lambda Sensor ADT370117 Blue Print Oxygen 8946720060 8946764020 Quality New,190.77,233710138843,N/A,Blue Print,ADT370117,"4X4 ESTANFI: EST-DOX-0247, EST-DOX-0264, CSV electronic parts: CSL2364, DENSO: DOX-0264, FAE: 75638, FISPA: 90364, HERTH+BUSS JAKOPARTS: J1472012, HOFFER: 7481764, MAGNETI MARELLI: 600000041490, MEAT & DORIA: 81764, METZGER: 0893324, MTE-THOMSON: 9816.40.072, NPS: DOX-0264, NTY: ESL-TY-022, PEMEBLA: JAPDOX-0264, SIDAT: 90364, TOYOTA: 89467-20060, 89467-64020, 8946720060, 8946764020, WALKER PRODUCTS: 800-94002, WE PARTS: 290960346, WILMINK GROUP: WG1014034, WG1028951",ADT370117,https://www.ebay.co.uk/sch/carpartsinmotion/m.html?_nkw&_armrs=1&_ipg&_from&_clu=2&_fcid=3&_localstpos&_stpos&gbr=1&_udlo=190.74000000000913&_udhi=190.79000000000914&_sop=2&_ipg=200
"Diesel Fuel Injector fits OPEL MOVANO FD, JD 2.5D Nozzle Valve Carwood Quality",190.49,333721206444,N/A,Carwood,103071RMP,"Bosch: 0445110087, 0986435079, EURO CAR PARTS: 432745041, FUELPARTS: DI308, Lucas: LDN050, UNIPART: GID10087, DFI0445110087",103071RMP,https://www.ebay.co.uk/sch/carpartsinmotion/m.html?_nkw&_armrs=1&_ipg&_from&_clu=2&_fcid=3&_localstpos&_stpos&gbr=1&_udlo=190.74000000000913&_udhi=190.79000000000914&_sop=2&_ipg=200
Diesel Fuel Injector fits NISSAN PRIMASTAR X83 2.5D Nozzle Valve Carwood Quality,190.49,233712068557,N/A,Carwood,68364RMP,"Bosch: 0445110087, 0986435079, EURO CAR PARTS: 432745041, FUELPARTS: DI308, Lucas: LDN050, UNIPART: GID10087, DFI0445110087",68364RMP,https://www.ebay.co.uk/sch/carpartsinmotion/m.html?_nkw&_armrs=1&_ipg&_from&_clu=2&_fcid=3&_localstpos&_stpos&gbr=1&_udlo=190.74000000000913&_udhi=190.79000000000914&_sop=2&_ipg=200
Head Gasket Set fits BMW 530 E60 3.0 04 to 09 N52B30A BGA 11127548921 Quality,190.49,233711332169,N/A,BGA,10177580RMP,"AJUSA: 52234500, BMW: 11127548921, ELRING: 537.85, 537.850, GOETZE: 21-30334-00/0, VICTOR REINZ: 02-37289-01, HK3730",10177580RMP,https://www.ebay.co.uk/sch/carpartsinmotion/m.html?_nkw&_armrs=1&_ipg&_from&_clu=2&_fcid=3&_localstpos&_stpos&gbr=1&_udlo=190.74000000000913&_udhi=190.79000000000914&_sop=2&_ipg=200
Diesel Fuel Injector fits VAUXHALL VIVARO X83 2.5D G9U730 Nozzle Valve Carwood,190.49,333681507569,N/A,Carwood,5938925RMP,"Bosch: 0445110087, 0986435079, EURO CAR PARTS: 432745041, FUELPARTS: DI308, Lucas: LDN050, UNIPART: GID10087, DFI0445110087",5938925RMP,https://www.ebay.co.uk/sch/carpartsinmotion/m.html?_nkw&_armrs=1&_ipg&_from&_clu=2&_fcid=3&_localstpos&_stpos&gbr=1&_udlo=190.74000000000913&_udhi=190.79000000000914&_sop=2&_ipg=200
Diesel Fuel Injector fits RENAULT MASTER Mk2 2.5D Nozzle Valve Carwood Quality,190.49,233674015174,N/A,Carwood,81558RMP,"Bosch: 0445110087, 0986435079, EURO CAR PARTS: 432745041, FUELPARTS: DI308, Lucas: LDN050, UNIPART: GID10087, DFI0445110087",81558RMP,https://www.ebay.co.uk/sch/carpartsinmotion/m.html?_nkw&_armrs=1&_ipg&_from&_clu=2&_fcid=3&_localstpos&_stpos&gbr=1&_udlo=190.74000000000913&_udhi=190.79000000000914&_sop=2&_ipg=200
Interior Blower Motor fits VAUXHALL ZAFIRA B 1.8 05 to 14 Heater NRF 13214733,190.48,233699518444,N/A,NRF,9084734RMP,"AVA QUALITY COOLING: OL8646, HELLA: 8EW351104421, NISSENS: 87083, OPEL: 13214733, 13333050, 1845106, 1845134, VAUXHALL: 13214733, VAUXHALL: 13333050, 34203",9084734RMP,https://www.ebay.co.uk/sch/carpartsinmotion/m.html?_nkw&_armrs=1&_ipg&_from&_clu=2&_fcid=3&_localstpos&_stpos&gbr=1&_udlo=190.74000000000913&_udhi=190.79000000000914&_sop=2&_ipg=200
Air Mass Sensor VE700195 Cambiare Flow Meter 60589472 8024221 836568 4239034 New,190.48,333706995089,N/A,Cambiare,VE700195,"ALFA ROMEO: 60589472, Beckermann: 803-0213, Bosch: 0280217503, CCL: 07-102, FUELPARTS: MAFS044, MAFS044-OE, GENERAL MOTORS: 90411537, 90510156, 98439687, Intermotor: 19419, IVECO: 8024221, Lemark: LMF043, Lucas: FDM765, Meat & Doria: 86259, NGK: 97353, OE: 836568, OPEL: 836568, OPEL/VAUXHALL: 836576, Quinton Hazell: QM786, SAAB: 4239034, STANDARD: KMF038, VAUXHALL: 836576",VE700195,https://www.ebay.co.uk/sch/carpartsinmotion/m.html?_nkw&_armrs=1&_ipg&_from&_clu=2&_fcid=3&_localstpos&_stpos&gbr=1&_udlo=190.74000000000913&_udhi=190.79000000000914&_sop=2&_ipg=200
Catalytic Converter BM92197H BM Cats 208025987R 4534901400 A4534901400 Quality,190.79,333672269538,N/A,BM Cats,BM92197H,"AS: 71282, RENAULT: 208025987R, SMART: 4534901400, A4534901400",BM92197H,https://www.ebay.co.uk/sch/carpartsinmotion/m.html?_nkw&_armrs=1&_ipg&_from&_clu=2&_fcid=3&_localstpos&_stpos&gbr=1&_udlo=190.74000000000913&_udhi=190.79000000000914&_sop=2&_ipg=200
Diesel Fuel Injector fits BMW 525 TDS E34 2.5D 91 to 96 Nozzle Valve Bosch New,191.07,233712148311,N/A,Bosch,1497660RMP,"BMW: 13532243410, 13532244402, 13532243410, 13532244402, OPEL: 9192374, 0432217236",1497660RMP,https://www.ebay.co.uk/sch/carpartsinmotion/m.html?_nkw&_armrs=1&_ipg&_from&_clu=2&_fcid=3&_localstpos&_stpos&gbr=1&_udlo=191.0400000000092&_udhi=191.0900000000092&_sop=2&_ipg=200
"Fuel Pump fits OPEL VECTRA A, B 1.8 2.0 2.5 88 to 00 QH 5815014 5815015 815019",191.07,333719778972,N/A,Quinton Hazell,2091332RMP,"ACI-AVESA: ABG-1054, AIRTEX: E10258*, BOSCH: 0580314079, BOSCH: 0580314097, 0580453966, 0580453976, 0580453985, DELPHI: FE0435-12B1, ERA: 770008, FIRST LINE: FFP1216, FISPA: 70966, 70966-2, GENERAL MOTORS: 5815014, 5815015, 815001, GENERAL MOTORS: 815013, 815019, 815031, 815036, 90348685, GENERAL MOTORS: 90411794, 90442231, 90442402, 90541593, 90571033, GENERAL MOTORS: 9119098, 93181358, 93181359, HELLA: 8TF358106-571, HITACHI: 133354, INTERMOTOR: 31543, JP GROUP: 1215200609, KAGER: 52-0084, MAGNETI MARELLI: 219031409997, MAPCO: 22714, MAXGEAR: 43-0031, MEAT & DORIA: 76387, 76387/1, METZGER: 2250009*, MOTAQUIP: VFI117, OPEL: 5815014, 5815015, 815019, 815036, 90411794, 90442231, OPEL: 90442402, 90541593, 90571033, 9119098, 93181359, SIDAT: 70966, 70966-2, STELLOX: 10-01029-SX, TOPRAN: 201614, VALEO: 347215*, VEMO: V40-09-0004, QFP646",2091332RMP,https://www.ebay.co.uk/sch/carpartsinmotion/m.html?_nkw&_armrs=1&_ipg&_from&_clu=2&_fcid=3&_localstpos&_stpos&gbr=1&_udlo=191.0400000000092&_udhi=191.0900000000092&_sop=2&_ipg=200
Timing Chain Kit fits AUDI A5 8F 3.2 09 to 12 CALA 06E109218T 06E109218TS1 Febi,191.07,233709273101,N/A,Febi,6615580RMP,"AUDI: 06E109218T, 06E109218TS1, 06E109465AS, 06E109465ASS1, AUDI (FAW): 06E109218TS1, 06E109465ASS1, AUTEX: 711507, 711508, BGA: TC0113FK, TC0113VFK, CPB: 506514, HEPU: 21-0502, 21-0503, INA: 558002710, 558003010, 558003110, IPD: 21-0502, 21-0503, OSSCA: 12920, SWAG: 30949846, TOPRAN: 117861, TRUCKTEC AUTOMOTIVE: 07.12.126, VAICO: V10-3390, WILMINK GROUP: WG1429183, WG1487745, WG1700342, WG1725135, WILMINK GROUP: WG1725286, WG1890307, WG1890308, WG1990637, WILMINK GROUP: WG1990638, WG1990639, WG1996209, 49846",6615580RMP,https://www.ebay.co.uk/sch/carpartsinmotion/m.html?_nkw&_armrs=1&_ipg&_from&_clu=2&_fcid=3&_localstpos&_stpos&gbr=1&_udlo=191.0400000000092&_udhi=191.0900000000092&_sop=2&_ipg=200
Fuel Pump fits OPEL ZAFIRA A 1.6 1.8 99 to 05 QH 5815014 5815015 815019 815036,191.07,233707993495,N/A,Quinton Hazell,2847636RMP,"ACI-AVESA: ABG-1054, AIRTEX: E10258*, BOSCH: 0580314079, BOSCH: 0580314097, 0580453966, 0580453976, 0580453985, DELPHI: FE0435-12B1, ERA: 770008, FIRST LINE: FFP1216, FISPA: 70966, 70966-2, GENERAL MOTORS: 5815014, 5815015, 815001, GENERAL MOTORS: 815013, 815019, 815031, 815036, 90348685, GENERAL MOTORS: 90411794, 90442231, 90442402, 90541593, 90571033, GENERAL MOTORS: 9119098, 93181358, 93181359, HELLA: 8TF358106-571, HITACHI: 133354, INTERMOTOR: 31543, JP GROUP: 1215200609, KAGER: 52-0084, MAGNETI MARELLI: 219031409997, MAPCO: 22714, MAXGEAR: 43-0031, MEAT & DORIA: 76387, 76387/1, METZGER: 2250009*, MOTAQUIP: VFI117, OPEL: 5815014, 5815015, 815019, 815036, 90411794, 90442231, OPEL: 90442402, 90541593, 90571033, 9119098, 93181359, SIDAT: 70966, 70966-2, STELLOX: 10-01029-SX, TOPRAN: 201614, VALEO: 347215*, VEMO: V40-09-0004, QFP646",2847636RMP,https://www.ebay.co.uk/sch/carpartsinmotion/m.html?_nkw&_armrs=1&_ipg&_from&_clu=2&_fcid=3&_localstpos&_stpos&gbr=1&_udlo=191.0400000000092&_udhi=191.0900000000092&_sop=2&_ipg=200
Alternator fits VOLKSWAGEN POLO 2.0 1.6D 09 to 14 Bosch 03L903023F 304183,191.07,233706987488,N/A,Bosch,1761939RMP,"AUDI: 03L903023F, 06F903023A, 06F903023C, 06F903023J, BOSCH: 0124525039, 0124525050, 0124525066, 0124525067, BOSCH: 0124525091, 0124525092, 0124525525, 0124525539, BOSCH: 0986048180, DELCO REMY: DRB5340, HC-PARTS: CA1782IR, HELLA: 8EL738192-001, KARMANN: 304183, LUCAS ELECTRICAL: LRA2291, LUCAS ELECTRICAL: LRA3156, LRA02291, LRA03156, MERCEDES-BENZ: HVW0001540102, SEAT: 03L903023F, 06F903023A, SEAT: 06F903023J, 06F903023A, 06F903023F, 06F903023J, SKODA: 03L903023F, 06F903023A, 06F903023C, 06F903023F, 06F903023A, SKODA: 06F903023F, VALEO: 2542596, 2542695, 2542695A, 2542695C, VALEO: 2542695D, 2542898, 2543282, 2607703A, 437454, 437526, VALEO: 439489, TG14C011, TG14C015, TG14C016, TG14C026, VW: 03L903023F, 06F903023A, 06F903023C, 06F903023F, 06F903023J, VW: 06F903023A, 06F903023AX, 06F903023C, 06F903023CX, 06F903023F, VW: 06F903023FX, 06F903023H, 06F903023HX, 06F903023J, 0986045340",1761939RMP,https://www.ebay.co.uk/sch/carpartsinmotion/m.html?_nkw&_armrs=1&_ipg&_from&_clu=2&_fcid=3&_localstpos&_stpos&gbr=1&_udlo=191.0400000000092&_udhi=191.0900000000092&_sop=2&_ipg=200
Catalytic Converter fits MINI CLUBMAN ONE R55 1.6 10 to 14 N16B16A EuroFlo New,191.07,233706072839,N/A,EuroFlo,7945015RMP,"AS: 45289, BM CATALYSTS: BM91990H, CITROËN/PEUGEOT: 0341N7, CITROËN/PEUGEOT: 0341P9, 18407599503, KLARIUS: 322678, 322720, WALKER: 28100, ECPG1142TA",7945015RMP,https://www.ebay.co.uk/sch/carpartsinmotion/m.html?_nkw&_armrs=1&_ipg&_from&_clu=2&_fcid=3&_localstpos&_stpos&gbr=1&_udlo=191.0400000000092&_udhi=191.0900000000092&_sop=2&_ipg=200
Dual to Solid Flywheel Clutch Conversion Kit fits CITROEN DISPATCH 140 2.0D Set,191.06,333707616754,N/A,Borg & Beck,6978521RMP,"COMLINE: ECK260F, MECARM: MK40029, MOTAQUIP: LVKF1142, NATIONAL: CK10040F, CK10046F, NK: 133719, VALEO: 835068, 835069, WESTLAKE: WCP048F, HKF1057",6978521RMP,https://www.ebay.co.uk/sch/carpartsinmotion/m.html?_nkw&_armrs=1&_ipg&_from&_clu=2&_fcid=3&_localstpos&_stpos&gbr=1&_udlo=191.0400000000092&_udhi=191.0900000000092&_sop=2&_ipg=200
Fuel Pump fits OPEL CALIBRA A 2.0 2.5 89 to 97 QH 5815014 5815015 815019 815036,191.08,333719778848,N/A,Quinton Hazell,159639RMP,"ACI-AVESA: ABG-1054, AIRTEX: E10258*, BOSCH: 0580314079, BOSCH: 0580314097, 0580453966, 0580453976, 0580453985, DELPHI: FE0435-12B1, ERA: 770008, FIRST LINE: FFP1216, FISPA: 70966, 70966-2, GENERAL MOTORS: 5815014, 5815015, 815001, GENERAL MOTORS: 815013, 815019, 815031, 815036, 90348685, GENERAL MOTORS: 90411794, 90442231, 90442402, 90541593, 90571033, GENERAL MOTORS: 9119098, 93181358, 93181359, HELLA: 8TF358106-571, HITACHI: 133354, INTERMOTOR: 31543, JP GROUP: 1215200609, KAGER: 52-0084, MAGNETI MARELLI: 219031409997, MAPCO: 22714, MAXGEAR: 43-0031, MEAT & DORIA: 76387, 76387/1, METZGER: 2250009*, MOTAQUIP: VFI117, OPEL: 5815014, 5815015, 815019, 815036, 90411794, 90442231, OPEL: 90442402, 90541593, 90571033, 9119098, 93181359, SIDAT: 70966, 70966-2, STELLOX: 10-01029-SX, TOPRAN: 201614, VALEO: 347215*, VEMO: V40-09-0004, QFP646",159639RMP,https://www.ebay.co.uk/sch/carpartsinmotion/m.html?_nkw&_armrs=1&_ipg&_from&_clu=2&_fcid=3&_localstpos&_stpos&gbr=1&_udlo=191.0400000000092&_udhi=191.0900000000092&_sop=2&_ipg=200
Fuel Pump fits VAUXHALL CAVALIER Mk3 2.0 88 to 95 QH 5815014 5815015 815019 New,191.09,333719778589,N/A,Quinton Hazell,1752888RMP,"ACI-AVESA: ABG-1054, AIRTEX: E10258*, BOSCH: 0580314079, BOSCH: 0580314097, 0580453966, 0580453976, 0580453985, DELPHI: FE0435-12B1, ERA: 770008, FIRST LINE: FFP1216, FISPA: 70966, 70966-2, GENERAL MOTORS: 5815014, 5815015, 815001, GENERAL MOTORS: 815013, 815019, 815031, 815036, 90348685, GENERAL MOTORS: 90411794, 90442231, 90442402, 90541593, 90571033, GENERAL MOTORS: 9119098, 93181358, 93181359, HELLA: 8TF358106-571, HITACHI: 133354, INTERMOTOR: 31543, JP GROUP: 1215200609, KAGER: 52-0084, MAGNETI MARELLI: 219031409997, MAPCO: 22714, MAXGEAR: 43-0031, MEAT & DORIA: 76387, 76387/1, METZGER: 2250009*, MOTAQUIP: VFI117, OPEL: 5815014, 5815015, 815019, 815036, 90411794, 90442231, OPEL: 90442402, 90541593, 90571033, 9119098, 93181359, SIDAT: 70966, 70966-2, STELLOX: 10-01029-SX, TOPRAN: 201614, VALEO: 347215*, VEMO: V40-09-0004, QFP646",1752888RMP,https://www.ebay.co.uk/sch/carpartsinmotion/m.html?_nkw&_armrs=1&_ipg&_from&_clu=2&_fcid=3&_localstpos&_stpos&gbr=1&_udlo=191.0400000000092&_udhi=191.0900000000092&_sop=2&_ipg=200
Fuel Pump fits OPEL TIGRA F07 1.4 1.6 94 to 00 QH 5815014 5815015 815019 815036,191.09,233709167415,N/A,Quinton Hazell,2408503RMP,"ACI-AVESA: ABG-1054, AIRTEX: E10258*, BOSCH: 0580314079, BOSCH: 0580314097, 0580453966, 0580453976, 0580453985, DELPHI: FE0435-12B1, ERA: 770008, FIRST LINE: FFP1216, FISPA: 70966, 70966-2, GENERAL MOTORS: 5815014, 5815015, 815001, GENERAL MOTORS: 815013, 815019, 815031, 815036, 90348685, GENERAL MOTORS: 90411794, 90442231, 90442402, 90541593, 90571033, GENERAL MOTORS: 9119098, 93181358, 93181359, HELLA: 8TF358106-571, HITACHI: 133354, INTERMOTOR: 31543, JP GROUP: 1215200609, KAGER: 52-0084, MAGNETI MARELLI: 219031409997, MAPCO: 22714, MAXGEAR: 43-0031, MEAT & DORIA: 76387, 76387/1, METZGER: 2250009*, MOTAQUIP: VFI117, OPEL: 5815014, 5815015, 815019, 815036, 90411794, 90442231, OPEL: 90442402, 90541593, 90571033, 9119098, 93181359, SIDAT: 70966, 70966-2, STELLOX: 10-01029-SX, TOPRAN: 201614, VALEO: 347215*, VEMO: V40-09-0004, QFP646",2408503RMP,https://www.ebay.co.uk/sch/carpartsinmotion/m.html?_nkw&_armrs=1&_ipg&_from&_clu=2&_fcid=3&_localstpos&_stpos&gbr=1&_udlo=191.0400000000092&_udhi=191.0900000000092&_sop=2&_ipg=200
Fuel Pump fits OPEL CORSA B 1.0 1.2 1.4 1.6 93 to 00 QH 5815014 5815015 815019,191.09,233707993259,N/A,Quinton Hazell,230084RMP,"ACI-AVESA: ABG-1054, AIRTEX: E10258*, BOSCH: 0580314079, BOSCH: 0580314097, 0580453966, 0580453976, 0580453985, DELPHI: FE0435-12B1, ERA: 770008, FIRST LINE: FFP1216, FISPA: 70966, 70966-2, GENERAL MOTORS: 5815014, 5815015, 815001, GENERAL MOTORS: 815013, 815019, 815031, 815036, 90348685, GENERAL MOTORS: 90411794, 90442231, 90442402, 90541593, 90571033, GENERAL MOTORS: 9119098, 93181358, 93181359, HELLA: 8TF358106-571, HITACHI: 133354, INTERMOTOR: 31543, JP GROUP: 1215200609, KAGER: 52-0084, MAGNETI MARELLI: 219031409997, MAPCO: 22714, MAXGEAR: 43-0031, MEAT & DORIA: 76387, 76387/1, METZGER: 2250009*, MOTAQUIP: VFI117, OPEL: 5815014, 5815015, 815019, 815036, 90411794, 90442231, OPEL: 90442402, 90541593, 90571033, 9119098, 93181359, SIDAT: 70966, 70966-2, STELLOX: 10-01029-SX, TOPRAN: 201614, VALEO: 347215*, VEMO: V40-09-0004, QFP646",230084RMP,https://www.ebay.co.uk/sch/carpartsinmotion/m.html?_nkw&_armrs=1&_ipg&_from&_clu=2&_fcid=3&_localstpos&_stpos&gbr=1&_udlo=191.0400000000092&_udhi=191.0900000000092&_sop=2&_ipg=200
Catalytic Converter fits CITROEN C4 B7 1.4 11 to 15 8FP(EP3C) EuroFlo 0341N7 New,191.09,333713416016,N/A,EuroFlo,7833252RMP,"AS: 45289, BM CATALYSTS: BM91990H, CITROËN/PEUGEOT: 0341N7, CITROËN/PEUGEOT: 0341P9, 18407599503, KLARIUS: 322678, 322720, WALKER: 28100, ECPG1142TA",7833252RMP,https://www.ebay.co.uk/sch/carpartsinmotion/m.html?_nkw&_armrs=1&_ipg&_from&_clu=2&_fcid=3&_localstpos&_stpos&gbr=1&_udlo=191.0400000000092&_udhi=191.0900000000092&_sop=2&_ipg=200
Alternator fits SKODA SUPERB 3T 1.6D 10 to 15 CAYC B&B 021903026L 03G903023 New,191.09,233672934570,N/A,Borg & Beck,5836593RMP,"ACL: ADA101116, AUTOELECTRO: AEK2931, BLUE PRINT: ADA101116, BOSCH: 0121715003, 0121715103, 0986081230, 8123, CARGOPARTS: CA1912IR, DELCO REMY: DRA0201, ELSTOCK: 28-5545, FRIESEN: 9045350, HOLGER CRISTIANSEN: CA1912IR, LUCAS: LRA02931, ROLLING COMPONENTS: ALT2050CP, VAG: 021903026L, 03G903023, VAG: 03G903023X, 03L903023E, VALEO: 2542783, 254783, 2605717A, VALEO: 437555, 439558, FG18T033, TG17C019, WAI: 11221N, BBA2511",5836593RMP,https://www.ebay.co.uk/sch/carpartsinmotion/m.html?_nkw&_armrs=1&_ipg&_from&_clu=2&_fcid=3&_localstpos&_stpos&gbr=1&_udlo=191.0400000000092&_udhi=191.0900000000092&_sop=2&_ipg=200
Fuel Pump fits OPEL SENATOR B 2.6 3.0 88 to 93 QH 5815014 5815015 815019 815036,191.09,333713103156,N/A,Quinton Hazell,20812RMP,"ACI-AVESA: ABG-1054, AIRTEX: E10258*, BOSCH: 0580314079, BOSCH: 0580314097, 0580453966, 0580453976, 0580453985, DELPHI: FE0435-12B1, ERA: 770008, FIRST LINE: FFP1216, FISPA: 70966, 70966-2, GENERAL MOTORS: 5815014, 5815015, 815001, GENERAL MOTORS: 815013, 815019, 815031, 815036, 90348685, GENERAL MOTORS: 90411794, 90442231, 90442402, 90541593, 90571033, GENERAL MOTORS: 9119098, 93181358, 93181359, HELLA: 8TF358106-571, HITACHI: 133354, INTERMOTOR: 31543, JP GROUP: 1215200609, KAGER: 52-0084, MAGNETI MARELLI: 219031409997, MAPCO: 22714, MAXGEAR: 43-0031, MEAT & DORIA: 76387, 76387/1, METZGER: 2250009*, MOTAQUIP: VFI117, OPEL: 5815014, 5815015, 815019, 815036, 90411794, 90442231, OPEL: 90442402, 90541593, 90571033, 9119098, 93181359, SIDAT: 70966, 70966-2, STELLOX: 10-01029-SX, TOPRAN: 201614, VALEO: 347215*, VEMO: V40-09-0004, QFP646",20812RMP,https://www.ebay.co.uk/sch/carpartsinmotion/m.html?_nkw&_armrs=1&_ipg&_from&_clu=2&_fcid=3&_localstpos&_stpos&gbr=1&_udlo=191.0400000000092&_udhi=191.0900000000092&_sop=2&_ipg=200
"Fuel Pump fits OPEL ASTRA F, G 1.4 1.6 1.8 2.0 91 to 09 QH 5815014 5815015 New",191.09,233704410617,N/A,Quinton Hazell,203413RMP,"ACI-AVESA: ABG-1054, AIRTEX: E10258*, BOSCH: 0580314079, BOSCH: 0580314097, 0580453966, 0580453976, 0580453985, DELPHI: FE0435-12B1, ERA: 770008, FIRST LINE: FFP1216, FISPA: 70966, 70966-2, GENERAL MOTORS: 5815014, 5815015, 815001, GENERAL MOTORS: 815013, 815019, 815031, 815036, 90348685, GENERAL MOTORS: 90411794, 90442231, 90442402, 90541593, 90571033, GENERAL MOTORS: 9119098, 93181358, 93181359, HELLA: 8TF358106-571, HITACHI: 133354, INTERMOTOR: 31543, JP GROUP: 1215200609, KAGER: 52-0084, MAGNETI MARELLI: 219031409997, MAPCO: 22714, MAXGEAR: 43-0031, MEAT & DORIA: 76387, 76387/1, METZGER: 2250009*, MOTAQUIP: VFI117, OPEL: 5815014, 5815015, 815019, 815036, 90411794, 90442231, OPEL: 90442402, 90541593, 90571033, 9119098, 93181359, SIDAT: 70966, 70966-2, STELLOX: 10-01029-SX, TOPRAN: 201614, VALEO: 347215*, VEMO: V40-09-0004, QFP646",203413RMP,https://www.ebay.co.uk/sch/carpartsinmotion/m.html?_nkw&_armrs=1&_ipg&_from&_clu=2&_fcid=3&_localstpos&_stpos&gbr=1&_udlo=191.0400000000092&_udhi=191.0900000000092&_sop=2&_ipg=200
