Item Title,Item Price,Item ID,Number Sold,Brand,Manufacturer Part Number,Reference OE/OEM Number,MPN,Reference
DPF Fuel Vapour Valve fits FORD S-MAX 2.0D 5th Injector Vapouriser FPUK 1890231,155.76,333708447835,N/A,Fuel Parts,7789559RMP,"FORD: 1890231, E1G1-9T540-AD, E1G19T540AD, FUELPARTS: FVV016, INTERMOTOR: 81015, LUCAS CAV: FDB5013, FDR5013, FVV016",7789559RMP,https://www.ebay.co.uk/sch/carpartsinmotion/m.html?_nkw&_armrs=1&_ipg&_from&_clu=2&_fcid=3&_localstpos&_stpos&gbr=1&_udlo=155.74000000000117&_udhi=155.79000000000119&_sop=2&_ipg=200
"Fuel Pump fits SEAT TOLEDO 1M, 5P 1.4 1.6 1.8 2.0 2.3 98 to 09 Pierburg Quality",155.52,333706981117,N/A,Pierburg,8691949RMP,"AUDI: 1J0919051C, 1J0919051D, 1J0919051H, 1J0919087C, AUDI: 1J0919087D, 1J0919087J, 8L0919051A, 8L0919051B, AUDI: 8L0919051E, 8L0919051F, 8L0919051H, 8L0919051J, AUDI: 8L0919051K, AUTOMEGA: 140035010, BBR Automotive: 002-40-10726, BOSCH: 0986580805, CSV electronic parts: CBA7014, CBA7019, CBA7062, CBA7162, CBA7259, CSV electronic parts: CBA7650, DELPHI: FG1070-12B1, DIPASPORT: GACC268N, ERA: 775048, ESEN SKV: 02SKV711, HELLA: 8TF358106-191, HITACHI: 133314, HOFFER: 7506441, HUECO: 133314, LUCAS ELECTRICAL: FDB1654, FDB2083, MAGNETI MARELLI: 313011313023, 519700000182, MAPCO: 22893, MEAT & DORIA: 76441, METZGER: 2250069, QUINTON HAZELL: QFP747, S.I.D.A.T: 72062, SKODA: 1J0919051C, 1J0919051D, 1J0919087C, SKODA: 1J0919087D, 1J0919087J, STANDARD: 39317, EFP631, FP5427, STANDARD: LFP407, TOPRAN: 110581, VEMO: 10-09-0809, V10-09-0809, VW: 1J0909051H, 1J0919051C, 1J0919051D, 1J0919087C, 1J0919087D, VW: 1J0919087H, 1J0919087J, 8L0919087A, WE PARTS: 320900033, WILMINK GROUP: WG1012725, WG1025639, WG1498694, WG1796710, WILMINK GROUP: WG1892754, 7.07795.35.0",8691949RMP,https://www.ebay.co.uk/sch/carpartsinmotion/m.html?_nkw&_armrs=1&_ipg&_from&_clu=2&_fcid=3&_localstpos&_stpos&gbr=1&_udlo=155.74000000000117&_udhi=155.79000000000119&_sop=2&_ipg=200
"Wishbone / Suspension Arm fits RANGE ROVER SPORT L320 4.4 Rear Lower, Left 448PN",155.77,233700091806,N/A,Borg & Beck,6466831RMP,"BGA: TRC2415, TRC4223, TRC4223K, COMLINE: CCA1258, FAI AutoParts: SS9222, LAND ROVER: LR019978, RGG500313, RGG500314, MOOG: LR-WP-15291, MOTAQUIP: LVSA1864, QUINTON HAZELL: QSA2735S, BCA7488",6466831RMP,https://www.ebay.co.uk/sch/carpartsinmotion/m.html?_nkw&_armrs=1&_ipg&_from&_clu=2&_fcid=3&_localstpos&_stpos&gbr=1&_udlo=155.74000000000117&_udhi=155.79000000000119&_sop=2&_ipg=200
Catalytic Converter Type Approved fits VOLKSWAGEN GOLF Mk3 1.9D 93 to 96 AAZ BM,155.53,233660862588,N/A,BM Cats,3777061RMP,"EuroFlo: LCSE0004TA, Klarius: 321385, SEAT: 6K0253058DX, VW: 6K0253058DX, Walker: 20262, BM80024H",3777061RMP,https://www.ebay.co.uk/sch/carpartsinmotion/m.html?_nkw&_armrs=1&_ipg&_from&_clu=2&_fcid=3&_localstpos&_stpos&gbr=1&_udlo=155.74000000000117&_udhi=155.79000000000119&_sop=2&_ipg=200
"Wishbone / Suspension Arm fits RANGE ROVER SPORT L320 4.2 Rear Lower, Right New",155.77,333689361414,N/A,First Line,6219895RMP,"BGA: TRC4224, TRC4224K, COMLINE: CCA2258, FAI AutoParts: SS9223, LAND ROVER: LR019977, RGG500303, RGG500304, MOOG: LR-WP-15292, MOTAQUIP: LVSA1865, FCA7489",6219895RMP,https://www.ebay.co.uk/sch/carpartsinmotion/m.html?_nkw&_armrs=1&_ipg&_from&_clu=2&_fcid=3&_localstpos&_stpos&gbr=1&_udlo=155.74000000000117&_udhi=155.79000000000119&_sop=2&_ipg=200
"Wishbone / Suspension Arm fits RANGE ROVER SPORT L320 3.6D Rear Lower, Right B&B",155.77,333722343211,N/A,Borg & Beck,7119807RMP,"BGA: TRC4224, TRC4224K, COMLINE: CCA2258, FAI AutoParts: SS9223, LAND ROVER: LR019977, RGG500303, RGG500304, MOOG: LR-WP-15292, MOTAQUIP: LVSA1865, QUINTON HAZELL: QSA2736S, BCA7489",7119807RMP,https://www.ebay.co.uk/sch/carpartsinmotion/m.html?_nkw&_armrs=1&_ipg&_from&_clu=2&_fcid=3&_localstpos&_stpos&gbr=1&_udlo=155.74000000000117&_udhi=155.79000000000119&_sop=2&_ipg=200
"Wishbone / Suspension Arm fits RANGE ROVER SPORT L320 3.0D Rear Lower, Right B&B",155.79,233701716815,N/A,Borg & Beck,6486373RMP,"BGA: TRC4224, TRC4224K, COMLINE: CCA2258, FAI AutoParts: SS9223, LAND ROVER: LR019977, RGG500303, RGG500304, MOOG: LR-WP-15292, MOTAQUIP: LVSA1865, QUINTON HAZELL: QSA2736S, BCA7489",6486373RMP,https://www.ebay.co.uk/sch/carpartsinmotion/m.html?_nkw&_armrs=1&_ipg&_from&_clu=2&_fcid=3&_localstpos&_stpos&gbr=1&_udlo=155.74000000000117&_udhi=155.79000000000119&_sop=2&_ipg=200
Brake Caliper fits CHRYSLER VOYAGER Mk3 2.8D Rear 04 to 08 ENR ADL 5019808AA,156.54,333718026437,N/A,Blue Print,241150RMP,"4X4 ESTANFI: PDF-17-009, PDF-17-010, A.B.S.: 423611, 423612, ACEMARK: 104488, 104489, ALLMAKES: 5019808, AMK: TCA3093, TCA3094, APEC braking: LCA351, LCA351, ASHUKI: PAL4-1556, PAL4-1557, ASHUKI: US104511, ATE: 24.3421-1711.5, AUTOFREN SEINSA: D42589C, AUTOFREN SEINSA: D4699, BENDIX: 591368, 591369, BOSCH: 0986134381, 0986135381, Brake Engineering: CA2276, BREMBO: F11008, F11009, Brembo: F11008, F11009, BUDWEG CALIPER: 343268, 343269, CHRYSLER: 05019808AA, 5019808AA, DA SILVA: ET2190, ET2193, Delphi: LC7711, DEPA: ET73268, ET73269, DRI: 4176800, 4276800, EAI: 2225247, 2225248, EDR: RAB84370, EDR: RAB84379, ELSTOCK: 86-0786, 87-0786, ERA Benelux: BC53268, ERA Benelux: BC53269, ERT: 400788, 402588, ESEN SKV: 34SKV293, ESEN SKV: 34SKV294, EUROBRAKE: 5301219309, 5301219310, FTE: RX429829A0, RX429830A0, GENERAL RICAMBI: CH6015, CH6016, GIRLING: 7107928, HELLA: 8AC355385-251, 8AC355385-261, HELLA PAGID: 8AC355385-251, 8AC355385-261, KAMOKA: JBC0153, KAMOKA: JBC0154, KAWE: 343268, 343269, LAUBER: 75.2610, 75.2611, LAUBER: 77.2610, 77.2611, MAXGEAR: 82-0247, 82-0248, METZGER: 6250729, 6250730, NK: 219309, 219310, NTY: HZT-CH-016, NTY: HZT-CH-017, OSSCA: 18955, PAGID: 76503, 76504, PATRON: PBRC152, PBRC155, PBRC156, PRK257, RE-EX: 506-02376, RE-EX: 506-02377, REMSA: 9022761, Remy: DC73268, DC73269, DC83140, Remy: DC83385, REMY: RAB84370, RAB84379, RIDEX: 78B0090, 78B0267, sbs: 1301219309, 1301219310, SERA: 3225247, 3225248, Shaftec: BC8834, BC8834R, SNRA: 1225247, 1225248, SPIDAN: 403268, SPIDAN: 403269, Stark: SKBC-0460089, SKBC-0460266, Technika: BC0115, BC0116, TEXTAR: 38174800, 38174900, TRISCAN: 8170343268, 8170343269, TRW: BHS928E, VEGE: 21514305, ADA104511",241150RMP,https://www.ebay.co.uk/sch/carpartsinmotion/m.html?_nkw&_armrs=1&_ipg&_from&_clu=2&_fcid=3&_localstpos&_stpos&gbr=1&_udlo=156.49000000000134&_udhi=156.54000000000136&_sop=2&_ipg=200
2x Shock Absorbers (Pair) fits KIA SORENTO Mk2 2.4 Rear 09 to 12 G4KE Damper KYB,156.53,233700159538,N/A,KYB,7025036RMP,"HYUNDAI: 553102B101, 553102B201, 553102B211, 553102B510, HYUNDAI: 553102B520, 553102P300, 553103J100, 553103J110, HYUNDAI: 553103J200, KIA: 553102B101, 553102B510, 553102B520, KIA: 553102P200, 553102P300, 553102P600, 553102P650, 553103J100, KIA: 553103J110, 3440028",7025036RMP,https://www.ebay.co.uk/sch/carpartsinmotion/m.html?_nkw&_armrs=1&_ipg&_from&_clu=2&_fcid=3&_localstpos&_stpos&gbr=1&_udlo=156.49000000000134&_udhi=156.54000000000136&_sop=2&_ipg=200
Air Mass Sensor fits FORD MONDEO Mk3 2.0D Flow Meter FPUK 1129009 XS7F12B579AA,156.29,233699516831,N/A,Fuel Parts,5590924RMP,"C.I.: QM865, CAMBIARE: VE700229, DELPHI: AF10372-12B1, ERA: MF041, FORD: 1129009, XS7F-12B579-AA, FUELPARTS: MAFS159, MAFS159-G, FUELPARTS: MAFS159-OE, HELLA: 8ET009142-281, HITACHI: 135070, HITACHI: AFH60M-16, INTERMOTOR: 19627, JAGUAR: C2S26978, LUCAS CAV: FDM627, MEAT & DORIA: 86052, METZGER: 0891019, MOBILETRON: MA-F037S, MOTAQUIP: LVMA151, NGK: 91111, NGK: EPBMWN4-A002D, PIERBURG: 7.22184.26.0, SIDAT: 38.613, SIEMENS: A2C59512898, VDO: A2C59512898, VEMO: V25-72-1006, VXPRO: EE4020, XEVO: XAM4019, MAFS159-OE",5590924RMP,https://www.ebay.co.uk/sch/carpartsinmotion/m.html?_nkw&_armrs=1&_ipg&_from&_clu=2&_fcid=3&_localstpos&_stpos&gbr=1&_udlo=156.49000000000134&_udhi=156.54000000000136&_sop=2&_ipg=200
Steering Column Switch fits CITROEN BERLINGO 1.6 05 to 07 Stalk Valeo 6239Q1 New,156.53,333705276813,N/A,Valeo,274500RMP,"CITROËN: 6239-QK, 6239Q1, 6239QK, 6242-F2, 6242-QG, 6242F2, CITROËN: 6242QG, 96446860XT, 96446860ZL, 96509715XT, CITROËN: 96530924XT, 96574405XT, 96605679XT, 96446860XT, CITROËN: 96446860ZL, 96509715XT, 96530924XT, 96574405XT, CITROËN: 96605679XT, CITROEN/PEUGEOT: 96605679XT, ERA: 440311, FEBI BILSTEIN: 34809, 38685, PEUGEOT: 6239Q1, 6239QK, 6242-F2, PEUGEOT: 6242-QG, 6242F2, 6242QG, 96446860XT, 96446860ZL, PEUGEOT: 96509715XT, 96530924XT, 96574405XT, 96605679XT, PEUGEOT: 96446860XT, 96446860ZL, 96509715XT, 96530924XT, PEUGEOT: 96574405XT, 96605679XT, SWAG: 62934809, 62938685, 251495",274500RMP,https://www.ebay.co.uk/sch/carpartsinmotion/m.html?_nkw&_armrs=1&_ipg&_from&_clu=2&_fcid=3&_localstpos&_stpos&gbr=1&_udlo=156.49000000000134&_udhi=156.54000000000136&_sop=2&_ipg=200
RPM / Crankshaft Sensor fits FERRARI 456 F116 5.5 150866 Cambiare Quality New,156.53,333701438808,N/A,Cambiare,9863247RMP,"Beckermann: 270-0042, Bosch: 0232103006, CHEVROLET: 93216451, FERRARI: 150866, FUELPARTS: CS1294, Intermotor: 17055, Lucas: SEB1236, Motaquip: LVCP234, STANDARD: EPS534, VE363498",9863247RMP,https://www.ebay.co.uk/sch/carpartsinmotion/m.html?_nkw&_armrs=1&_ipg&_from&_clu=2&_fcid=3&_localstpos&_stpos&gbr=1&_udlo=156.49000000000134&_udhi=156.54000000000136&_sop=2&_ipg=200
Alternator fits VOLKSWAGEN UP GTi 1.0 2016 on NAPA Genuine Quality Guaranteed,156.29,333733093032,N/A,NAPA,10015056RMP,"BOSCH: 0986084130, CEVAM: 4181, ELSTOCK: 28-6739, LAND ROVER: CH12-10300-BC, LR029981, LR065867, REMY: DRA1329, REMY: DRA1429, ROLLING COMPONENTS: ALT601, VALEO: 439835, WAI: 20706N, NAL1556",10015056RMP,https://www.ebay.co.uk/sch/carpartsinmotion/m.html?_nkw&_armrs=1&_ipg&_from&_clu=2&_fcid=3&_localstpos&_stpos&gbr=1&_udlo=156.49000000000134&_udhi=156.54000000000136&_sop=2&_ipg=200
Air Mass Sensor fits BMW 525D F10 3.0D N57D30A Flow Meter Lemark 13627804150 New,156.53,233750851375,N/A,Lemark,7826434RMP,"BMW: 13627804150, 13627807020, 7804150, 7807020, ERA: 558248, ERA: 558250, EURO CAR PARTS: 434110851, FISPA: 38.921, 38.923, FUELPARTS: MAFS504-OE, HITACHI: 135015, 135018, 2505015, 2505018, HITACHI: AFH70M-81, AFH80-20, HOFFER: 7516324, INTERMOTOR: 19796, LUCAS CAV: FDM5012, MEAT & DORIA: 86324, 86325, METZGER: 0890313, METZGER: 0890314, PIERBURG: 7.22184.69.0, 7.22184.71.0, SIDAT: 38.921, 38.923, VDO: 2910000437500, VEMO: V20-72-5162, VEMO: V20-72-5179, LMF290",7826434RMP,https://www.ebay.co.uk/sch/carpartsinmotion/m.html?_nkw&_armrs=1&_ipg&_from&_clu=2&_fcid=3&_localstpos&_stpos&gbr=1&_udlo=156.49000000000134&_udhi=156.54000000000136&_sop=2&_ipg=200
Crankshaft Pulley (TVD) fits BMW 320D E46 2.0D Torsional Vibration Damper New,156.29,333724424995,N/A,Corteco,3243366RMP,"BMW: 11237787304, 11237790921, 11237793882, 11237801977, BMW: 11237805696, 11237787304, 11237790921, 11237793882, BMW: 11237801977, 11237805696, FEBI BILSTEIN: 33595, 80001996",3243366RMP,https://www.ebay.co.uk/sch/carpartsinmotion/m.html?_nkw&_armrs=1&_ipg&_from&_clu=2&_fcid=3&_localstpos&_stpos&gbr=1&_udlo=156.49000000000134&_udhi=156.54000000000136&_sop=2&_ipg=200
Clutch Kit 3pc (Cover+Plate+Releaser) fits TOYOTA AURIS ADE150 2.0D 06 to 09 New,158.97,333729680619,N/A,Sachs,5351092RMP,"LuK: 624356200, TOYOTA: 31001-0R030, 3000950742",5351092RMP,https://www.ebay.co.uk/sch/carpartsinmotion/m.html?_nkw&_armrs=1&_ipg&_from&_clu=2&_fcid=3&_localstpos&_stpos&gbr=1&_udlo=158.9400000000019&_udhi=158.9900000000019&_sop=2&_ipg=200
Catalytic Converter fits RENAULT MEGANE Mk3 1.9D 08 to 12 EuroFlo 200101362R New,158.94,233701296605,N/A,EuroFlo,7784218RMP,"AS: 30198D, BOSAL: 090-655, EEC: RE6104T, RENAULT: 200101362R, WALKER: 28340, ECRN1099TA",7784218RMP,https://www.ebay.co.uk/sch/carpartsinmotion/m.html?_nkw&_armrs=1&_ipg&_from&_clu=2&_fcid=3&_localstpos&_stpos&gbr=1&_udlo=158.8900000000019&_udhi=158.9400000000019&_sop=2&_ipg=200
Accelerator Throttle Position Sensor fits IVECO DAILY Mk4 2.3D Potentiometer New,158.94,233667372825,N/A,Fuel Parts,5229223RMP,"BOSCH: 0281002360, C.I.: XAPS120, FUELPARTS: APS013, HOFFER: 7513531, INTERMOTOR: 42020, IVECO: 500344803, LUCAS CAV: LSP6520, MEAT & DORIA: 83531, MOTAQUIP: LVAP10, SIDAT: 84.422, APS013",5229223RMP,https://www.ebay.co.uk/sch/carpartsinmotion/m.html?_nkw&_armrs=1&_ipg&_from&_clu=2&_fcid=3&_localstpos&_stpos&gbr=1&_udlo=158.8900000000019&_udhi=158.9400000000019&_sop=2&_ipg=200
Accelerator Throttle Position Sensor fits IVECO DAILY Mk4 2.3D 06 to 11 Quality,158.94,333672495668,N/A,Intermotor,1339453RMP,"BOSCH: 0281002360, C.I.: XAPS120, FUELPARTS: APS013, HOFFER: 7513531, INTERMOTOR: 42020, IVECO: 500344803, LUCAS CAV: LSP6520, MEAT & DORIA: 83531, MOTAQUIP: LVAP10, SIDAT: 84.422, 42020",1339453RMP,https://www.ebay.co.uk/sch/carpartsinmotion/m.html?_nkw&_armrs=1&_ipg&_from&_clu=2&_fcid=3&_localstpos&_stpos&gbr=1&_udlo=158.8900000000019&_udhi=158.9400000000019&_sop=2&_ipg=200
Clutch Kit 3pc (Cover+Plate+Releaser) fits BMW 525D E60 2.5D 2004 LuK Quality,158.98,333716853701,N/A,LuK,497083RMP,"BMW: 21207542522, 21207542523, 21217526517, 21217534182, BMW: 21517526105, 21207542522, 21207542523, 21217526517, BMW: 21217534182, 21517526105, 7526105, 7526517, 7534182, BMW: 7542522, 7542523, 7526105, 7526517, 7534182, 7542522, BMW: 7542523, SACHS: 3000951935, 3000951935, VALEO: 948230, 624334500",497083RMP,https://www.ebay.co.uk/sch/carpartsinmotion/m.html?_nkw&_armrs=1&_ipg&_from&_clu=2&_fcid=3&_localstpos&_stpos&gbr=1&_udlo=158.9400000000019&_udhi=158.9900000000019&_sop=2&_ipg=200
Catalytic Converter ECRN1099TA EuroFlo 200101362R Genuine Top Quality Guaranteed,158.97,233701284319,N/A,EuroFlo,ECRN1099TA,"AS: 30198D, BOSAL: 090-655, EEC: RE6104T, RENAULT: 200101362R, WALKER: 28340",ECRN1099TA,https://www.ebay.co.uk/sch/carpartsinmotion/m.html?_nkw&_armrs=1&_ipg&_from&_clu=2&_fcid=3&_localstpos&_stpos&gbr=1&_udlo=158.9400000000019&_udhi=158.9900000000019&_sop=2&_ipg=200
Alternator fits CITROEN C4 UD 1.6D 07 to 13 NAPA 56547528ON80 5702F4 5702G2 New,158.97,233725049606,N/A,NAPA,10041909RMP,"CITROËN: 56547528ON80, 5702-K8, 5702F4, 5702G2, 5705-AX, 5705-EE, CITROËN: 5705-JF, 9646065180, 9646388280, 96547528, 9654752880, CITROËN: 9661544880, 9688085380, FIAT: 9646065180, LANCIA: 9646065180, LUCAS ELECTRICAL: LRA02857, MITSUBISHI: A004TJ0081, A004TJ0081A, A004TJ0084*, A004TJ0084A, MITSUBISHI: A004TJ0084B, A004TJ0084C, A4TJ0081, A4TJ0081A, MITSUBISHI: A4TJ0084, A4TJ0084A, A4TJ0084B, A4TJ0084C, PEUGEOT: 9646388280, REMY: DRA0142, ROLLING COMPONENTS: ALT2142CP, NAL1707",10041909RMP,https://www.ebay.co.uk/sch/carpartsinmotion/m.html?_nkw&_armrs=1&_ipg&_from&_clu=2&_fcid=3&_localstpos&_stpos&gbr=1&_udlo=158.9400000000019&_udhi=158.9900000000019&_sop=2&_ipg=200
2x Brake Discs (Pair) Vented fits AUDI S8 4E 5.2 Front 06 to 10 BSM 360mm Set,158.97,233659164947,N/A,TRW,3800860RMP,"A.B.S.: 17530, AKEBONO: BN-0153, BN-0153E, APEC braking: DSK2474, ATE: 24013401001, 24113401001, AUDI: 4E0615301A, 4E0615301G, AUDI: 4E0615301P, 4E0615301A, 4E0615301G, 4E0615301P, BENDIX: 562517BC, Borg & Beck: BBD6009S, BOSCH: 0986479302, BOSCH: 0986479B97, 0986AB6110, Bosch: 0986479302, 0986479B97, Bosch: 0986AB6110, Brake Engineering: DI956258S, Brembo: 09991511, CAR: 1421043, HPD1043, Delphi: BG9957, FEBI BILSTEIN: 32520, Ferodo: DDF1572, DDF15721, First Line: FBD1662, FTE: BS7117, FTE: BS7117HB, Girling: 6042685, HELLA: 8DD355109-841, HELLA: 8DD355109-851, Hella: 8DD355109841, 8DD355109851, JURID: 562517JC, METELLI: 231102C, MEYLE: 1155211123/PD, Meyle: 1155211123PD, MEYLE: 1835211123PD, NATIONAL: NBD1260, NK: 2047125, 3147125, 3447125, PAGID: 54222, 54222PRO, PILENGA: V235, QH BENELUX: 58170, Quinton Hazell: 58170, BDC5688, Quinton Hazell: BSF5688, REMSA: 6115410, SWAG: 30932520, Textar: 92122200, 92122203, 92122205, TRISCAN: 812029189, TRISCAN: 812029189C, Trusting: DF1529, VW: 3D0615301F, 3D0615301F, VW: 4E0615301P, 4E0615301P, ZIMMERMANN: 100330500, 100330550, DF4268S",3800860RMP,https://www.ebay.co.uk/sch/carpartsinmotion/m.html?_nkw&_armrs=1&_ipg&_from&_clu=2&_fcid=3&_localstpos&_stpos&gbr=1&_udlo=158.9400000000019&_udhi=158.9900000000019&_sop=2&_ipg=200
Drive Shaft AU354R Shaftec Driveshaft 4F0407272G 4F0272452AX Quality Guaranteed,158.99,333707395810,N/A,Shaftec,AU354R,"AUDI: 4F0272452AX, 4F0407272G, GENERAL RICAMBI: AU3465, ODM-MULTIPARTS: 18-216060, SOREA EAI: T78306",AU354R,https://www.ebay.co.uk/sch/carpartsinmotion/m.html?_nkw&_armrs=1&_ipg&_from&_clu=2&_fcid=3&_localstpos&_stpos&gbr=1&_udlo=158.9400000000019&_udhi=158.9900000000019&_sop=2&_ipg=200
Head Gasket Set fits TOYOTA AVENSIS ADT250 2.0D 06 to 08 1AD-FTV ADL 041120R130,158.99,333706298520,N/A,Blue Print,441318RMP,"AJUSA: 53026000, ASHIKA: 48-02-267, ASHUKI: T790-60, BGA: HN4362, ELRING: 308.520, ELWIS ROYAL: 9852892, FAI AutoParts: HS2220NH, GLASER: D38291-00, GUARNITAUTO: 044462-1000, HERTH+BUSS JAKOPARTS: J1242220, IMEX: IMXUK53026000, IMEX: IMXUK53026100, JAPANPARTS: KG-267, JAPKO: 48267, MAGNETI MARELLI: 600000019940, NPS: T124A151, PEMEBLA: JAPKG-267, RED-LINE: 32TO032, TOYOTA: 04112-0R031, 04112-0R060, 04112-0R130, TOYOTA: 04112-0R140, 04112-0R180, 04112-0R190, 04112-0R200, TOYOTA: 041120R030, TRISCAN: 597-7598, VICTOR REINZ: 02-53930-01, WILMINK GROUP: WG1001994, WG1009438, WG1102923, WG1754294, WILMINK GROUP: WG1933280, ADT362141",441318RMP,https://www.ebay.co.uk/sch/carpartsinmotion/m.html?_nkw&_armrs=1&_ipg&_from&_clu=2&_fcid=3&_localstpos&_stpos&gbr=1&_udlo=158.9400000000019&_udhi=158.9900000000019&_sop=2&_ipg=200
Alternator fits CITROEN C4 UA 2.0D 06 to 13 NAPA 56547528ON80 5702F4 5702G2 New,158.99,233724896100,N/A,NAPA,9947791RMP,"CITROËN: 56547528ON80, 5702-K8, 5702F4, 5702G2, 5705-AX, 5705-EE, CITROËN: 5705-JF, 9646065180, 9646388280, 96547528, 9654752880, CITROËN: 9661544880, 9688085380, FIAT: 9646065180, LANCIA: 9646065180, LUCAS ELECTRICAL: LRA02857, MITSUBISHI: A004TJ0081, A004TJ0081A, A004TJ0084*, A004TJ0084A, MITSUBISHI: A004TJ0084B, A004TJ0084C, A4TJ0081, A4TJ0081A, MITSUBISHI: A4TJ0084, A4TJ0084A, A4TJ0084B, A4TJ0084C, PEUGEOT: 9646388280, REMY: DRA0142, ROLLING COMPONENTS: ALT2142CP, NAL1707",9947791RMP,https://www.ebay.co.uk/sch/carpartsinmotion/m.html?_nkw&_armrs=1&_ipg&_from&_clu=2&_fcid=3&_localstpos&_stpos&gbr=1&_udlo=158.9400000000019&_udhi=158.9900000000019&_sop=2&_ipg=200
2x Brake Discs (Pair) Vented fits VOLKSWAGEN PHAETON 3D 5.0D Front 02 to 06 AJS,158.99,233659164593,N/A,TRW,2704764RMP,"A.B.S.: 17530, AKEBONO: BN-0153, BN-0153E, APEC braking: DSK2474, ATE: 24013401001, 24113401001, AUDI: 4E0615301A, 4E0615301G, AUDI: 4E0615301P, 4E0615301A, 4E0615301G, 4E0615301P, BENDIX: 562517BC, Borg & Beck: BBD6009S, BOSCH: 0986479302, BOSCH: 0986479B97, 0986AB6110, Bosch: 0986479302, 0986479B97, Bosch: 0986AB6110, Brake Engineering: DI956258S, Brembo: 09991511, CAR: 1421043, HPD1043, Delphi: BG9957, FEBI BILSTEIN: 32520, Ferodo: DDF1572, DDF15721, First Line: FBD1662, FTE: BS7117, FTE: BS7117HB, Girling: 6042685, HELLA: 8DD355109-841, HELLA: 8DD355109-851, Hella: 8DD355109841, 8DD355109851, JURID: 562517JC, METELLI: 231102C, MEYLE: 1155211123/PD, Meyle: 1155211123PD, MEYLE: 1835211123PD, NATIONAL: NBD1260, NK: 2047125, 3147125, 3447125, PAGID: 54222, 54222PRO, PILENGA: V235, QH BENELUX: 58170, Quinton Hazell: 58170, BDC5688, Quinton Hazell: BSF5688, REMSA: 6115410, SWAG: 30932520, Textar: 92122200, 92122203, 92122205, TRISCAN: 812029189, TRISCAN: 812029189C, Trusting: DF1529, VW: 3D0615301F, 3D0615301F, VW: 4E0615301P, 4E0615301P, ZIMMERMANN: 100330500, 100330550, DF4268S",2704764RMP,https://www.ebay.co.uk/sch/carpartsinmotion/m.html?_nkw&_armrs=1&_ipg&_from&_clu=2&_fcid=3&_localstpos&_stpos&gbr=1&_udlo=158.9400000000019&_udhi=158.9900000000019&_sop=2&_ipg=200
Clutch Kit 3pc (Cover+Plate+Releaser) fits TOYOTA COROLLA AUR10 2.2D 05 to 09,158.99,333729680563,N/A,Sachs,7383140RMP,"LuK: 624356200, TOYOTA: 31001-0R030, 3000950742",7383140RMP,https://www.ebay.co.uk/sch/carpartsinmotion/m.html?_nkw&_armrs=1&_ipg&_from&_clu=2&_fcid=3&_localstpos&_stpos&gbr=1&_udlo=158.9400000000019&_udhi=158.9900000000019&_sop=2&_ipg=200
EGR Valve fits RENAULT ESPACE Mk5 1.6D FPUK 147100789R 147101478R 147109816R New,158.99,233751797733,N/A,Fuel Parts,8021610RMP,"ERA: 555352, EURO CAR PARTS: 424740540, FISPA: 83.1022, FUELPARTS: EGR394, EGR394K, GENERAL MOTORS: 95518010, 95518011, GENERAL MOTORS: 95518010, 95527051, 95528937, HOFFER: 7518281, INTERMOTOR: 18035, 18035K, LUCAS CAV: FDR562, MEAT & DORIA: 88281, MERCEDES-BENZ: 6220102200, 6261400060, 6261400260, 6261400700, MERCEDES-BENZ: A6220102200, MOTAQUIP: LVER274, NISSAN: 0112100Q5G, NISSAN: 14710-00Q0T, 14710-00Q0U, 14710-9816R, 1471000Q0X, NISSAN: 1471000Q1B, 1471000Q1C, 147105039R, OPEL: 4423192, OPEL: 4423192, RENAULT: 147100789R, 147101478R, 147109816R, RENAULT: H8201061904, SIDAT: 83.1022, VALEO: 700449, VEMO: V46-63-0013, EGR394",8021610RMP,https://www.ebay.co.uk/sch/carpartsinmotion/m.html?_nkw&_armrs=1&_ipg&_from&_clu=2&_fcid=3&_localstpos&_stpos&gbr=1&_udlo=158.9400000000019&_udhi=158.9900000000019&_sop=2&_ipg=200
Vacuum Pump fits BMW X3 E83 2.0 05 to 08 N46B20B Intermotor 11667502656 Quality,158.99,233747669843,N/A,Intermotor,6006471RMP,"BMW: 11667502656, 11667534236, 11667542498, ERA: 559056, ERA Benelux: 556056, FEBI BILSTEIN: 39552, FUELPARTS: VP031, HOFFER: 8091030, 8091030/1, INTERMOTOR: 89022, JP GROUP: 1417100100, LuK: 561003810, MEAT & DORIA: 91030, METZGER: 8010006, OSSCA: 11899, PIERBURG: 7.24807.22.0, QUINTON HAZELL: QVP1006, SWAG: 20939552, TRUCKTEC AUTOMOTIVE: 08.36.001, VAICO: V20-8173, 89022",6006471RMP,https://www.ebay.co.uk/sch/carpartsinmotion/m.html?_nkw&_armrs=1&_ipg&_from&_clu=2&_fcid=3&_localstpos&_stpos&gbr=1&_udlo=158.9400000000019&_udhi=158.9900000000019&_sop=2&_ipg=200
Clutch Kit 3pc (Cover+Plate+CSC) fits SEAT TOLEDO 1M 1.8 00 to 04 240mm Valeo,159.64,233692726989,N/A,Valeo,6872254RMP,"LuK: 624245033, 624303433, 624303434, 624304933, 624305033, LuK: 624305034, 624245033, 624303433, 624303434, 624304933, LuK: 624305034, SACHS: 3000990039, 3000990043, 3000990060, SACHS: 3000990086, 3000990232, 3000990332, 3000990039, 3000990043, SACHS: 3000990060, 3000990086, 3000990232, 3000990332, 834088",6872254RMP,https://www.ebay.co.uk/sch/carpartsinmotion/m.html?_nkw&_armrs=1&_ipg&_from&_clu=2&_fcid=3&_localstpos&_stpos&gbr=1&_udlo=159.59000000000205&_udhi=159.64000000000206&_sop=2&_ipg=200
Clutch Kit 3pc (Cover+Plate+CSC) fits SEAT ALHAMBRA 7V 2.0D 05 to 10 BRT Manual,159.69,233692726930,N/A,Valeo,6445252RMP,"LuK: 624245033, 624303433, 624303434, 624304933, 624305033, LuK: 624305034, 624245033, 624303433, 624303434, 624304933, LuK: 624305034, SACHS: 3000990039, 3000990043, 3000990060, SACHS: 3000990086, 3000990232, 3000990332, 3000990039, 3000990043, SACHS: 3000990060, 3000990086, 3000990232, 3000990332, 834088",6445252RMP,https://www.ebay.co.uk/sch/carpartsinmotion/m.html?_nkw&_armrs=1&_ipg&_from&_clu=2&_fcid=3&_localstpos&_stpos&gbr=1&_udlo=159.64000000000206&_udhi=159.69000000000207&_sop=2&_ipg=200
Diesel Particulate Filter DPF BM11029 BM Cats Soot 2E0131709B 2E0254700GX New,159.69,333523136244,4 sold,BM Cats,BM11029,"AS: FD7001, FD7001Q, BOSAL: 097-207, Bosal: 097207, Cats & Pipes: VWF047, VWF147, EEC: DPF028, ERNST: 920483, EuroFlo: EPVW7003, FuelParts: DPF1040, Klarius: 390271, 399189, VW: 2E0131709B, 2E0254700GX, WALKER: 73169",BM11029,https://www.ebay.co.uk/sch/carpartsinmotion/m.html?_nkw&_armrs=1&_ipg&_from&_clu=2&_fcid=3&_localstpos&_stpos&gbr=1&_udlo=159.64000000000206&_udhi=159.69000000000207&_sop=2&_ipg=200
2x Shock Absorbers (Pair) fits FORD TRANSIT 3.2D Front 07 to 14 Damper KYB New,159.44,233656209929,N/A,KYB,3380704RMP,"BILSTEIN: 22-170903, FORD: 1371324, 1371326, 1371327, 1371329, FORD: 1371331, 1371332, 1371334, 1371336, 1383496, 1383498, FORD: 1383499, 1383507, 1383511, 1383514, 1383515, 1383517, FORD: 1383521, 1383522, 1388245, 1388247, 1388249, 1388250, FORD: 1388258, 1388260, 1388261, 1388265, 1388266, 1388267, FORD: 1388268, 1388270, 1388306, 1388307, 1420276, 1420277, FORD: 1420278, 1420279, 1420283, 1420284, 1420285, 1420287, FORD: 1420290, 1420296, 1420298, 1420302, 1420303, 1420306, FORD: 1433917, 1433919, 1433921, 1433922, 1433925, 1433926, FORD: 1433927, 1433928, 1433932, 1433933, 1433934, 1433935, FORD: 1433939, 1434146, 1446284, 1466420, 1466422, 1466424, FORD: 1466425, 1466426, 1466427, 1466428, 1466429, 1466430, FORD: 1466432, 1466433, 1466434, 1466435, 1466436, 4866362, FORD: 4866364, 6C1118045AAC, 6C1118045AAD, 6C1118045AAE, FORD: 6C1118045AAF, 6C1118045BA, 6C1118045BB, 6C1118045BC, FORD: 6C1118045BD, 6C1118045BE, 6C1118045BF, 6C1118045DA, FORD: 6C1118045DB, 6C1118045DC, 6C1118045DD, 6C1118045DE, FORD: 6C1118045DF, 6C1118045EA, 6C1118045EB, 6C1118045EC, FORD: 6C1118045ED, 6C1118045EE, 6C1118045EF, 6C1118045GA, FORD: 6C1118045GB, 6C1118045GC, 6C1118045GD, 6C1118045GE, FORD: 6C1118045GF, 6C1118045JA, 6C1118045JB, 6C1118045JC, FORD: 6C1118045JD, 6C1118045JE, 6C1118045JF, 6C1118045KA, FORD: 6C1118045KB, 6C1118045KC, 6C1118045KD, 6C1118045KE, FORD: 6C1118045KF, 6C1118045LB, 6C1118045LC, 6C1118045LD, FORD: 6C1118045LE, 6C1118045LF, 6C1118045MB, 6C1118045MC, FORD: 6C1118045MD, 6C1118045ME, 6C1118045MF, 6C1118045SA, FORD: 6C1118045SB, 6C1118045SC, 6C1118045SD, 6C1118045SE, FORD: 6C1118045SF, 6C1118045TA, 6C1118045TB, 6C1118045TC, 335820",3380704RMP,https://www.ebay.co.uk/sch/carpartsinmotion/m.html?_nkw&_armrs=1&_ipg&_from&_clu=2&_fcid=3&_localstpos&_stpos&gbr=1&_udlo=159.64000000000206&_udhi=159.69000000000207&_sop=2&_ipg=200
Drive Shaft fits ALFA ROMEO MITO 955 1.4 Front Right 2008 on With ABS Manual,168.95,333663145582,N/A,Shaftec,328761RMP,"AMK: DS6895, CIFAM: 655-798, FIAT: 51754513, 51947021, 55700557, FIAT: 55700559, 55700562, 71791082, GENERAL RICAMBI: AR3130, GENERAL RICAMBI: FI3420, FI3444, GSP: 217111, IPD: 33-2032, LÖBRO: 304603, METELLI: 17-0798, ODM-MULTIPARTS: 18-352040, SNRA: F1195, SOREA EAI: T58390, SPIDAN: 24287, FI236R",328761RMP,https://www.ebay.co.uk/sch/carpartsinmotion/m.html?_nkw&_armrs=1&_ipg&_from&_clu=2&_fcid=3&_localstpos&_stpos&gbr=1&_udlo=168.94000000000418&_udhi=168.9900000000042&_sop=2&_ipg=200
