Item Title,Item Price,Item ID,Number Sold,Brand,Manufacturer Part Number,Reference OE/OEM Number,MPN,Reference
Timing Belt Vibration Damper 533002920 INA 059109479B H2 Top Quality Guaranteed,57.01,233712820056,N/A,INA,533002920,"AUDI: 059109479B, 059109479B, AUTEX: 631273, BREDA LORETT: CR3183, CONTINENTAL CTAM: V55498, DAYCO: ATB2286, FEBI BILSTEIN: 22340, GATES: 7720-43600-V2, 772043600V2, T43029, HK: H268, HUTCHINSON: HTG231, INA: F-125044, F125044, IPD: 13-0268, 130268, MS (Motor Service): 3213777, NTN: HAT045-1, HAT0451, QUINTON HAZELL: QTT1056, QTT1056H, RUVILLE: 55498, SKF: VKM11154, SKODA: 059109479B, 059109479B, SNR: GT357.40, GT35740, TRIPLE FIVE: 3213777, 3213777, TD20159, Y3540, VW: 059109479B, VW: 059109479B",533002920,https://www.ebay.co.uk/sch/m.html?_nkw=&_armrs=1&_from=&_clu=2&_fcid=3&_localstpos=&_stpos=&gbr=1&_udlo=56.9899999999989&_udhi=57.0399999999989&_sop=2&_ssn=carpartsinmotion&_pgn=2&_skc=200&rt=nc
Clutch Kit 3pc (Cover+Plate+Releaser) fits RENAULT 19 Mk2 1.8 92 to 96 LuK New,57.01,333753334164,N/A,LuK,211274RMP,"BORG & BECK: 52859250, 52859250, HK08467, HK09884, HK8467, BORG & BECK: HK08467, HK09884, HK8467, S00371D, S00371D, FERODO: CTK253, LAYCOCK: LCK159, MOTAQUIP: VCK404, NATIONAL: NCK164, NCK164, NK: 133917, 139933, QUINTON HAZELL: QKT260, QKT260AF, QKT633AF, RENAULT: 7700725237, 7700727965, 7700734176, 7700739633, RENAULT: 7700743120, 7700743123, 7700743124, 7700743230, RENAULT: 7700749879, 7700850865, 7700853961, 7700857480, RENAULT: 7700857482, 7700864886, 7700864887, 7700869415, RENAULT: 7701464045, 7701464122, 7701465180, 7704001430, RENAULT: 7711134063, 7700725237, 7700727965, 7700734176, RENAULT: 7700739633, 7700743120, 7700743123, 7700743124, RENAULT: 7700743230, 7700749879, 7700850865, 7700853961, RENAULT: 7700857480, 7700857482, 7700864886, 7700864887, RENAULT: 7700869415, 7701464045, 7701464122, 7701465180, RENAULT: 7704001430, 7711134063, SACHS: 3000962001, 3000962001, TRIPLE FIVE: KK-623, KK623, VCK404, TTV: TCK3164, UNIPART: GCK262AF, GCK645AF, VALEO: 006730, 616752, 624047, VALEO: 801069, 801228, 899025, VOLVO: 3344287, 3411119, 3436635, VOLVO: 3467124, 34671248, 620034200",211274RMP,https://www.ebay.co.uk/sch/m.html?_nkw=&_armrs=1&_from=&_clu=2&_fcid=3&_localstpos=&_stpos=&gbr=1&_udlo=56.9899999999989&_udhi=57.0399999999989&_sop=2&_ssn=carpartsinmotion&_pgn=2&_skc=200&rt=nc
Aux Belt Tensioner fits MERCEDES G320 W463 3.0D 06 to 07 OM642.970 Drive Gates,57.01,233745176766,N/A,Gates,31451RMP,"AUTEX: 654776, BREDA LORETT: CR3694, Gates: 37696, 534028810, Gates: APV3062, VKM38075, INA: 534028810, LUCAS ELECTRICAL: LA0376, MERCEDES-BENZ: 6422000470, 6422001470, MERCEDES-BENZ: A6422000470, A6422001470, OPTIMAL: 0-N2219, OPTIMAL: 0-N2219S, RUVILLE: 55195, SKF: VKM38075, SWAG: 10937696, TRISCAN: 8641233020, T39208",31451RMP,https://www.ebay.co.uk/sch/m.html?_nkw=&_armrs=1&_from=&_clu=2&_fcid=3&_localstpos=&_stpos=&gbr=1&_udlo=56.9899999999989&_udhi=57.0399999999989&_sop=2&_ssn=carpartsinmotion&_pgn=2&_skc=200&rt=nc
Clutch Kit 3pc (Cover+Plate+Releaser) fits OPEL AGILA A 1.2 04 to 07 Z12XEP B&B,57.01,333720772196,N/A,Borg & Beck,718322RMP,"ACDelco: AC191K, AC205K, AC207K, ATLANTIC PARTS: KT6432, KT9079, Automotive Bearings: KT6432, KT9079, BLUE PRINT: ADW193001, COMLINE: ECK016, ECK059, DELPHI: HK10531, HK10879, FORD: 5025883, FORD: 5025886, GENERAL MOTORS: 1606010, 1606684, 90421578, GENERAL MOTORS: 90421637, 90541812, 91132025, R1020025, R1020032, GENERAL MOTORS: R1020053, R91132005, R91132006, R91132025, GENERAL MOTORS: R91149401, R91149405, LuK: 620028400, 620028410, LuK: 620033400, 620139900, 620204200, 620226000, 620229200, LuK: 620309000, MECARM: MK9449, MOTAQUIP: VCK466, VCK874, NATIONAL: CK9058, CK9060, NK: 133613, 133617, 133635, 133669, NK: 133673, OPEL: 1606026, 1606724, 1606759, 1606026, 1606724, OPEL: 1606955, 1606010, 1606026, 1606684, 1606724, 1606759, OPEL: 1606955, 90486402, 90541815, 90421578, 90421637, 90486402, OPEL: 90541812, 90541815, 91132025, R1020025, R1020032, R1020053, OPEL: R91132005, R91132006, R91132025, R91149401, R91149405, QUINTON HAZELL: QKT1550AF, QKT375AF, RAICAM: KT90353, SACHS: 3000174001, 3000174004, 3000174006, 3000828001, TRISCAN: 8550620033400, 8550620204200, 8550620226000, TRISCAN: 8550620229200, UNIPART: GCK2395AF, GCK312AF, VALEO: 786004, 801170, 801170, 801171, 821113, 826037, 899056, VAUXHALL: 1606010, 1606684, 90421578, 90421637, 90541812, VAUXHALL: 91132025, R1020025, R1020032, R1020049, R1020053, VAUXHALL: R91132005, R91132006, R91132025, R91149401, R91149405, VECO: VCK3011, VCK3191, HK9079",718322RMP,https://www.ebay.co.uk/sch/m.html?_nkw=&_armrs=1&_from=&_clu=2&_fcid=3&_localstpos=&_stpos=&gbr=1&_udlo=56.9899999999989&_udhi=57.0399999999989&_sop=2&_ssn=carpartsinmotion&_pgn=2&_skc=200&rt=nc
Lambda Sensor fits PEUGEOT 207 1.6 Oxygen NTK 1628KY Genuine Quality Guaranteed,57.01,233712763107,N/A,NTK,1585050RMP,"BOSCH: 0258006185, LS6185, CITROËN: 1628KY, 1628KY, CONTINENTAL: A2C59513173Z, PEUGEOT: 1628KY, 1628KY, 0384",1585050RMP,https://www.ebay.co.uk/sch/m.html?_nkw=&_armrs=1&_from=&_clu=2&_fcid=3&_localstpos=&_stpos=&gbr=1&_udlo=56.9899999999989&_udhi=57.0399999999989&_sop=2&_ssn=carpartsinmotion&_pgn=2&_skc=200&rt=nc
Wishbone / Suspension Arm fits PEUGEOT J5 2.0 Front Right 83 to 94 Track Control,57.01,333752665803,N/A,First Line,1680275RMP,"A.B.S.: 210098, AEBI: 410296, 45913, 45915, ALFRED HEYD: PE05.82, BENDIX: 041655B, 041657B, BETTAPARTS: BSJ1281S, BOGE: BCA1121R, BORG & BECK: BCA5849, CITROËN: 352152, 3521.52, 3521.53, 352152, DELPHI: TC905, FEBI BILSTEIN: 11277, FIAT: 7567282, 7576731, FIAT: 7595190, 7695190, FLENNOR: FL450-F, FL452-F, FRAP: 1392, GENERAL MOTORS: 352128, LEMFÖRDER: 22785, 2278501, 26740, LEMFÖRDER: 299022785534, MAPCO: 19442, METZGER: 58049602, M-906, MGA: SB7055, MONROE: L10515, L10804, L10805, MOOG: PETC5035, MOOG: PETC5037, MOPROD: MBJ1281, NK: 5011928, OCAP: 0380406, OCAP: 380406, OPEL: 352128, OPTIMAL: G5-561, PEUGEOT: 3521.52, PEX: 12.03.068, QUINTON HAZELL: QSJ1279S, QSJ1281, QSJ1281S, QUINTON HAZELL: QSJ9099S, REDAELLI RICAMBI: M-906, RTS: 96-00186-1, 96-00196-1, RUVILLE: 935827, SACHS: CA1121R, SASIC: 5213523, 5213533, SIDEM: 8073, 819630, SPIDAN: 410296, SPIDAN: 45913, 45915, SWAG: 70730054, TRISCAN: 810028636, TRISCAN: 810028642, 850010804, 850010805, 850010515, 870010515, TRW: 09-TC-5037-F, JTC370, UNIPART: GSJ4295, GSJ970, UGCGSJ4295, VAUXHALL: 352128, VECO: VB5461, VB5463, VEMA: 16532, FCA5849",1680275RMP,https://www.ebay.co.uk/sch/m.html?_nkw=&_armrs=1&_from=&_clu=2&_fcid=3&_localstpos=&_stpos=&gbr=1&_udlo=56.9899999999989&_udhi=57.0399999999989&_sop=2&_ssn=carpartsinmotion&_pgn=2&_skc=200&rt=nc
Lambda Sensor ADT37061 Blue Print Oxygen 8946553130 8946544040 8946544080 New,105.59,333753665051,N/A,Blue Print,ADT37061,"4X4 ESTANFI: EST-43-H08, EST-DOX-0106, EST-DOX-0109, EST-DOX-0110, 4X4 ESTANFI: EST-DOX-0113, EST-DOX-0114, EST-DOX-0119, 4X4 ESTANFI: EST-DOX-0121, EST-DOX-0150, EST-DOX-0204, 4X4 ESTANFI: EST-DOX-0205, EST-DOX-0206, EST-DOX-0231, 4X4 ESTANFI: EST-DOX-0232, EST-DOX-0233, EST-DOX-0234, 4X4 ESTANFI: EST-DOX-0236, EST-DOX-0237, EST-DOX-0238, 4X4 ESTANFI: EST-DOX-0239, EST-DOX-0240, EST-DOX-0254, 4X4 ESTANFI: EST-DOX-0256, EST-DOX-0257, EST-DOX-0267, 4X4 ESTANFI: EST-DOX-0269, EST-DOX-0270, EST-DOX-0271, 4X4 ESTANFI: EST-DOX-0273, EST-DOX-0274, EST-DOX-0275, 4X4 ESTANFI: EST-DOX-0276, EST-DOX-0277, EST-DOX-0278, 4X4 ESTANFI: EST-DOX-0279, EST-DOX-0280, EST-DOX-0282, 4X4 ESTANFI: EST-DOX-0283, EST-DOX-0284, EST-DOX-0285, 4X4 ESTANFI: EST-DOX-0286, EST-DOX-0287, EST-DOX-0288, 4X4 ESTANFI: EST-DOX-0311, EST-DOX-0312, EST-DOX-0314, 4X4 ESTANFI: EST-DOX-0317, EST-DOX-0318, EST-DOX-0319, 4X4 ESTANFI: EST-DOX-0320, EST-DOX-0321, EST-DOX-0324, 4X4 ESTANFI: EST-DOX-0325, EST-DOX-0326, EST-DOX-0327, 4X4 ESTANFI: EST-DOX-0328, EST-DOX-0329, EST-DOX-0330, 4X4 ESTANFI: EST-DOX-0332, EST-DOX-0334, EST-DOX-0336, 4X4 ESTANFI: EST-DOX-0337, EST-DOX-0341, EST-DOX-0342, 4X4 ESTANFI: EST-DOX-0344, EST-DOX-0345, EST-DOX-0350, 4X4 ESTANFI: EST-DOX-0351, EST-DOX-0352, EST-DOX-0353, 4X4 ESTANFI: EST-DOX-0354, EST-DOX-0357, EST-DOX-0400, 4X4 ESTANFI: EST-DOX-0402, EST-DOX-0403, EST-DOX-0404, 4X4 ESTANFI: EST-DOX-0406, EST-DOX-0411, EST-DOX-0416, 4X4 ESTANFI: EST-DOX-0421, EST-DOX-1068, EST-DOX-1070, 4X4 ESTANFI: EST-DOX-1108, EST-DOX-1160, EST-DOX-1161, 4X4 ESTANFI: EST-DOX-1163, EST-DOX-1167, EST-DOX-1169",ADT37061,https://www.ebay.co.uk/sch/carpartsinmotion/m.html?_nkw&_armrs=1&_ipg&_from&_clu=2&_fcid=3&_localstpos&_stpos&gbr=1&_udlo=105.53999999999614&_udhi=105.58999999999614&_sop=2&_ipg=200
Air Suspension Spring fits RANGE ROVER Mk2 P38A 4.0 Front Left or Right 42D Bag,105.59,333654229079,N/A,Arnott,7458032RMP,"LAND ROVER: ANR4684, REB101740, A-2611",7458032RMP,https://www.ebay.co.uk/sch/carpartsinmotion/m.html?_nkw&_armrs=1&_ipg&_from&_clu=2&_fcid=3&_localstpos&_stpos&gbr=1&_udlo=105.53999999999614&_udhi=105.58999999999614&_sop=2&_ipg=200
Crankshaft Pulley fits PEUGEOT 106 Mk2 1.6 96 to 04 NFX(TU5J4) Belt 515K8S1 Febi,105.59,233716685815,N/A,Febi,24717RMP,"3RG: 10220, AKRON-MALÒ: 658073, AUTEX: 658358, AUTOKIT: 03.90116, AUTOMEGA: 3005150K8, AUTOTEAM: A08352, BBR Automotive: 027-30-10686, BGA: DP1039, BTA: E6C0008BTA, CALIBER: 88308, CAUTEX: 030941, CITROËN: 0515.K8, 0515.K8S1, CITROËN: 0515K8, 0515K8S1, 515.K8S1, 515K8S1, DA SILVA: PL8198, DAYCO: DPV1217, DÜRER: 82136, FARE SA: 4220, GOOM: CP-0053, HUTCHINSON: DP075, IJS GROUP: 17-1129, IPD: 15-7353, KM International: FI20880, MABYPARTS: ODP212066, PV79996O, Metalcaucho: 04439, MGA: DP164, ORIGINAL IMPERIUM: 10198, PEUGEOT: 0515.K8, 0515.K8S1, 0515K8, 0515K8S1, 515.K8S1, 515K8S1, QUINTON HAZELL: QCD68, REPKIT: RKT9116, SASIC: 2150009, SNR: DPF359.13, SONOVA: MPP00445, SPIDAN: 446652, STC: T404439, SWAG: 62933797, Technika: DAMP112, DAMP99, TREVI AUTOMOTIVE: PC1209, TRICLO: 421212, VAICO: V42-0547, WILMINK GROUP: WG1432874, WG1432901, WG1760845, 33797",24717RMP,https://www.ebay.co.uk/sch/carpartsinmotion/m.html?_nkw&_armrs=1&_ipg&_from&_clu=2&_fcid=3&_localstpos&_stpos&gbr=1&_udlo=105.53999999999614&_udhi=105.58999999999614&_sop=2&_ipg=200
Catalytic Converter Type Approved fits MERCEDES SPRINTER 903 2.3D 95 to 00 BM,105.59,233710814286,N/A,BM Cats,867496RMP,"BOSAL: 099-416, Bosal: 099416, EuroFlo: ECMZ1052TA, Klarius: 321540, MERCEDES-BENZ: 9014901019, 9014901919, Walker: 28202, BM80114H",867496RMP,https://www.ebay.co.uk/sch/carpartsinmotion/m.html?_nkw&_armrs=1&_ipg&_from&_clu=2&_fcid=3&_localstpos&_stpos&gbr=1&_udlo=105.53999999999614&_udhi=105.58999999999614&_sop=2&_ipg=200
Timing Belt Kit fits RENAULT LAGUNA DT 2.0 08 to 15 Set 7701477093 7701474021,105.59,333724350718,N/A,Febi,4115287RMP,"ACEMARK: 143312, 192607, AUTEX: 702355, AUTLOG: ZK1057, AUTOKIT: 04.5261, 04.5262, AUTOTEAM: KAT1322, BGA: TB7304CPK, BGA: TB7304K, BOSCH: 1987948216, BREDA LORETT: KCD0143, BRT Bearings: PBTK165, CALIBER: 0249KR, CONTINENTAL: CT1040K2, CONTINENTAL: CT1130K2, CONTINENTAL CTAM: CT1130K3, CT1130WP2, CONTINENTAL CTAM BR: CT1130K2, DAYCO: KTB362, KTB899, DELPHI: KDB362, DÜRER: 261114, EUROREPAR: 1611881280, FAI AutoParts: TBK349, FLENNOR: F914449V, F924449V, F934449V, GATES: K025550XS, K035550XS, K045550XS, GENERAL MOTORS: 093160243, GENERAL MOTORS: 093161481, 093198652, 93160243, 93161481, GENERAL MOTORS: 93198652, GK: K986955A, GRAF: KP822-3, HEPU: 20-1350, K62043, PK09550, HUTCHINSON: KH149, KH325, INA: 530036310, IPD: 20-1350, K62043, JC PREMIUM: EKX030PR, KLAXCAR FRANCE: 40032z, 40156z, KM International: KFI249, KWP: KW822-3, LUCAS: LDK0080, LDK0654, LUCAS ENGINE DRIVE: LDK0654, LYNXauto: PK-1194, MAPCO: 23136, METELLI: 30-0822-3, METZGER: WM-Z019, WM-Z899, MEYLE: 16-510490048, MGA: X546H2, MICHELIN EngineParts: SMATK0138, MOTAQUIP: VTT228, Omnicraft: 2328544, OPEL: 04410546, 04430895, OPEL: 04449586, 4410546, 4430895, 4449586, 4410546, 4410546, OPEL: 4430895, 4430895, 4449586, 4449586, OPEN PARTS: TBK5074.11, OPTIBELT: KT1409, OPTIMAL: SK-1624, PROCODIS FRANCE: KTD4044, QH Talbros: QBK677, QUINTON HAZELL: MBK677, QBK677, RENAULT: 7701474021, 7701474023, 7701477093, 7701474021, RENAULT: 7701474023, 7701477093, REPKIT: RKTK1072, RKTK1073, ROULUNDS RUBBER: RR1098K2, RUVILLE: 5555573, Saleri SIL: 4133770, Saleri SIL: 4133780, SASIC: 1754001, SKF: VKMA06106, SNR: KD455.52, SPIDAN: 447899, SWAG: 60926567, 26567",4115287RMP,https://www.ebay.co.uk/sch/carpartsinmotion/m.html?_nkw&_armrs=1&_ipg&_from&_clu=2&_fcid=3&_localstpos&_stpos&gbr=1&_udlo=105.53999999999614&_udhi=105.58999999999614&_sop=2&_ipg=200
2x Wheel Bearing Kits Front 713640400 FAG Genuine Top Quality Replacement New,105.59,233746274432,N/A,FAG,713640400-PK2,"CITROËN: 1606375180, 1606375180, 3326.63, 332663, FIAT: 1328054080, IPD: 30-4040, 304040, MS (Motor Service): 4759625, RUVILLE: 4038, SKF: VKBA3641, SKF: VKBA3641, SNR: R140.38, R14038, TRIPLE FIVE: 4759625, TRIPLE FIVE: 4759625",713640400-PK2,https://www.ebay.co.uk/sch/carpartsinmotion/m.html?_nkw&_armrs=1&_ipg&_from&_clu=2&_fcid=3&_localstpos&_stpos&gbr=1&_udlo=105.53999999999614&_udhi=105.58999999999614&_sop=2&_ipg=200
Catalytic Converter fits VOLVO V40 645 1.9D 00 to 01 D4192T4 BM 30616690 8602967,105.59,233745551974,N/A,BM Cats,4236953RMP,"EuroFlo: ECCL1000, MITSUBISHI: M616690, VOLVO: 30616690, 8602967, WALKER: 28157, BM80179",4236953RMP,https://www.ebay.co.uk/sch/carpartsinmotion/m.html?_nkw&_armrs=1&_ipg&_from&_clu=2&_fcid=3&_localstpos&_stpos&gbr=1&_udlo=105.53999999999614&_udhi=105.58999999999614&_sop=2&_ipg=200
Air Suspension Spring fits RANGE ROVER Mk2 P38A 4.0 Rear Left or Right 42D Bag,105.59,333684740406,N/A,Arnott,7069753RMP,"LAND ROVER: RKB101460, A-2612",7069753RMP,https://www.ebay.co.uk/sch/carpartsinmotion/m.html?_nkw&_armrs=1&_ipg&_from&_clu=2&_fcid=3&_localstpos&_stpos&gbr=1&_udlo=105.53999999999614&_udhi=105.58999999999614&_sop=2&_ipg=200
"Wishbone / Suspension Arm fits HYUNDAI ILOAD TQ 2.5D Front Lower, Right 2008 on",105.59,333717992988,N/A,Blue Print,215593RMP,"4X4 ESTANFI: EST-72-0H-H51R, EST-GOM-H66, EST-GOM-H67, A.B.S.: 211161, AKRON-MALÒ: 52443, 52444, APlus: 20682AP, ASHIKA: 72-0H-H51R, ASHUKI: Y862-04, Automotive RYME: 4413139, AYD: 9709571, AYD OE - Excellence: 97-09571, BIRTH: BR2249, BORG & BECK: BCA6962, BSG: BSG40-315-042, CORTECO: 49397643, CTR: CQKH-65R, DYS: 20-21194, ETS: 08.SB.434, FARE SA: 14063, FARE SA: 14064, FEBI BILSTEIN: 41747, FENOX: CA11305, CA11391, FENOX: CA11405, CA11491, CAB10090, CAB20081, FIRST LINE: FCA6962, GMB: 0210-0216, GSP: 530607, 531487, S061113, HERTH+BUSS JAKOPARTS: J4910527, Hi-Q: SQKH065R, HYUNDAI: 545014H000, IAP QUALITY PARTS: 503-07068G, JAPANPARTS: BS-H51R, JAPKO: 72H51R, KAVO PARTS: SCA-3143, KAWE: 850043567, 850043805, MAGNETI MARELLI: 600000154420, MANDO: CAH0056D, MAPCO: 52219, MASTER-SPORT GERMANY: 41747B-PCS-MS, MDR: MSA-8H51, Metalcaucho: 57980, MGA: SB7013, MILES: DB68069, DB68105, MONROE: L43567, L43805, MOOG: HY-WP-13784, Movelex: M16282, NIPPARTS: N4910529, NK: 5013434, NPS: H421I78, NTY: ZWD-HY-503, OCAP: 0785195, OSSCA: 40724, PARTS-MALL: CA-H065, PXCAA-033LR, PEMEBLA: JAPBS-H51R, QUINTON HAZELL: QSA2702S, RED-LINE: 40HY040, RIW: HY11038, HY11039, HY6063, HY6063J, sbs: 19025013434, SIDEM: 87477, 887629, 887630, SpeedMate: SM-ARH042, SPIDAN: 411946, 411947, 51143, SPIDAN CHASSIS PARTS: 411946, SPIDAN CHASSIS PARTS: 411947, 51143, STC: T406643, T457980, STELLOX: 57-04107-SX, 57-04107A-SX, SWAG: 90941747, TALOSA: 40-07511, TEDGUM: 00288848, TRISCAN: 850043567, TRISCAN: 850043805, WOLVER: SP317342, ZEKKERT: GM-5574, GM-6050, ADG086188",215593RMP,https://www.ebay.co.uk/sch/carpartsinmotion/m.html?_nkw&_armrs=1&_ipg&_from&_clu=2&_fcid=3&_localstpos&_stpos&gbr=1&_udlo=105.53999999999614&_udhi=105.58999999999614&_sop=2&_ipg=200
Clutch kit only for solid conversion fits AUDI A6 4A 1.8 95 to 97 ADR ADL New,105.59,333718257035,N/A,Blue Print,7671505RMP,"EXEDY: VWK2068, KM Germany: 0691552WOF, 691552WOF, ADV183070",7671505RMP,https://www.ebay.co.uk/sch/carpartsinmotion/m.html?_nkw&_armrs=1&_ipg&_from&_clu=2&_fcid=3&_localstpos&_stpos&gbr=1&_udlo=105.53999999999614&_udhi=105.58999999999614&_sop=2&_ipg=200
"Radiator Fan fits SKODA RAPID NH, NH1, NH3 1.2 2013 on Cooling 6Q0959455AE Febi",105.59,233707899841,N/A,Febi,6191931RMP,"ABAKUS: 048-014-0001, 048-014-0006, AHE: 302.082, 302.087, AHE: 302.088, 302.112, 302.123, AIC: 55368, AKS DASIS: 048096N, AKS DASIS: 048112N, 048117N, AUTO AIR GLOUCESTER: 05-1841, AUTOGAMMA: GA200424, GA200482, GA221012, GA221022, GA221309, AUTOMEGA: 160068710, 3095904556Q0AE, AVA QUALITY COOLING: VN7526, AVA QUALITY COOLING: VN7532, VW7526, BBR Automotive: 002-60-14422, BEHR HELLA SERVICE: 8EW351040-381, 8EW351042-551, 8EW351043-561, BERU by DRiV: LE044, LE587, BorgWarner (BERU): LE044, LE587, Borsehung: B11503, B17919, BRÜCK GERMANY: 6Q0959455AE, BSG: BSG90-510-004, CASCO: CEF73003AS, CEF73008AS, CEF73337AS, CASCO: CEF73342AS, DENSO: DER32014, DER32015, DIEDERICHS: 8220503, DIEDERICHS: 8220510, DCL1213, DIPASPORT: EVM020N, DOGA: EVW059, DOGA: EVW060, ELECTRO AUTO: 32VB022, 32Y0035, 33V77022, 33V77028, ERA: 352063, FRIGAIR: 0510.2026, 0510.2028, 0510.2036, 0510.2046, GAUSS: GE1067, HELLA: 8EW351040-381, 8EW351042-551, HELLA: 8EW351043-561, JDEUS: EV0250083, EV0250130, JP GROUP: 1199103500, KALE OTO RADYATÖR: 414900, 421100, KLOKKERHOLM: 95062605, 95062607, 95072601, LGK: LGK014081003, LGK: LGK014081008, LGK014081337, LGK014081342, OEM014081342, LUZAR: LFK1853, MAHLE: CFF273000P, CFF273000S, MAXGEAR: 57-0051, MAXGEAR: AC252858, MEYLE: 1002360000, NISSENS: 85690, 85797, NISSENS: 85798, NRF: 47374, 47375, OSSCA: 11933, 12524, PATRON: PFN126, PFN129, PRASCO: SK322F002, ST033F003, VN7526, PRASCO: VN7532, VW7526, REAL: 40276243BN, 40276300BN, 40276733BN, REAL: 40276800BN, RIDEX: 508R0087, 508R0097, SANDO: SEF73003.0, SANDO: SEF73008.0, SEF73337.0, SEF73342.0, SEAT: 6Q0959455AE, SEAT: 6Q0959455AE, 6R0959455E, SKODA: 6Q0959455AE, 6R0959455E, SONTIAN: ZD168223, ZD168528, Stark: SKRF-0300087, SKRF-0300097, 26860",6191931RMP,https://www.ebay.co.uk/sch/carpartsinmotion/m.html?_nkw&_armrs=1&_ipg&_from&_clu=2&_fcid=3&_localstpos&_stpos&gbr=1&_udlo=105.53999999999614&_udhi=105.58999999999614&_sop=2&_ipg=200
Radiator Fan fits BMW 540 E34 4.0 92 to 96 Cooling NRF 1374001 1382775 1392913,105.64,333731840727,N/A,NRF,7190290RMP,"4SEASONS: 150BM12001, 304011, AKS DASIS: 870490N, AVA QUALITY COOLING: BW7507, BMW: 1374001, 1382775, 1392913, BMW: 64541374001, 64541378205, 64541378206, 64541382775, BMW: 64541388558, 64541388559, 64541392913, 64548351577, 8351577, FRIGAIR: 05021003, 05022001, HELLA: 8EW009158721, MAHLE: CFF25000S, TYC: 803-0003, VALEO: 698058, VAN WEZEL: 0640752, 47028",7190290RMP,https://www.ebay.co.uk/sch/carpartsinmotion/m.html?_nkw&_armrs=1&_ipg&_from&_clu=2&_fcid=3&_localstpos&_stpos&gbr=1&_udlo=105.58999999999614&_udhi=105.63999999999614&_sop=2&_ipg=200
Air Suspension Spring Front Left or Right A-2611 Arnott Bag REB101740 ANR4684,105.64,233721586577,N/A,Arnott,A-2611,"LAND ROVER: ANR4684, REB101740",A-2611,https://www.ebay.co.uk/sch/carpartsinmotion/m.html?_nkw&_armrs=1&_ipg&_from&_clu=2&_fcid=3&_localstpos&_stpos&gbr=1&_udlo=105.58999999999614&_udhi=105.63999999999614&_sop=2&_ipg=200
Ignition Coil CU1257 Fuel Parts 4660528 4770210 90490427 90543830 Quality New,105.64,333759952125,N/A,Fuel Parts,CU1257,"BOSCH: 0221503016, 0221503021, C.I.: XIC8455, ERA: 880261, FUELPARTS: CU1257, GENERAL MOTORS: 90490427, 90543830, INTERMOTOR: 12472, LUCAS CAV: DMB1030, MEAT & DORIA: 10747, MOTAQUIP: LVCL1223, SAAB: 4660528, 4770210, XEVO: XIG5387",CU1257,https://www.ebay.co.uk/sch/carpartsinmotion/m.html?_nkw&_armrs=1&_ipg&_from&_clu=2&_fcid=3&_localstpos&_stpos&gbr=1&_udlo=105.58999999999614&_udhi=105.63999999999614&_sop=2&_ipg=200
Water Pump for Parking Heater fits SEAT INCA 6K9 1.6 1.7D 1.9D 95 to 03 Gates,105.64,233685739144,N/A,Gates,8243195RMP,"BOSCH: 0392020024, 0392020024, DT Spare Parts: 4.66404, 466404, FEBI BILSTEIN: 36770, FIRST LINE: FWP3005, GK: 998244, HEPU: AP8244, HERTH+BUSS JAKOPARTS: 65452002, MEYLE: 1008990024, PIERBURG: 7.06740.04.0, SALERI: PE1666, SEAT: 251965561B, SWAG: 30936770, TRISCAN: 860010082, VW: 251965561B, 41532E",8243195RMP,https://www.ebay.co.uk/sch/carpartsinmotion/m.html?_nkw&_armrs=1&_ipg&_from&_clu=2&_fcid=3&_localstpos&_stpos&gbr=1&_udlo=105.58999999999614&_udhi=105.63999999999614&_sop=2&_ipg=200
"Water Pump for Parking Heater fits AUDI 80 B2, B3, B4 1.6 1.8 2.0 1.9D 85 to 95",105.64,333693403975,N/A,Gates,8211939RMP,"BOSCH: 0392020024, 0392020024, DT Spare Parts: 4.66404, 466404, FEBI BILSTEIN: 36770, FIRST LINE: FWP3005, GK: 998244, HEPU: AP8244, HERTH+BUSS JAKOPARTS: 65452002, MEYLE: 1008990024, PIERBURG: 7.06740.04.0, SALERI: PE1666, SEAT: 251965561B, SWAG: 30936770, TRISCAN: 860010082, VW: 251965561B, 41532E",8211939RMP,https://www.ebay.co.uk/sch/carpartsinmotion/m.html?_nkw&_armrs=1&_ipg&_from&_clu=2&_fcid=3&_localstpos&_stpos&gbr=1&_udlo=105.58999999999614&_udhi=105.63999999999614&_sop=2&_ipg=200
Crankshaft Pulley (TVD) fits OPEL ASTRA G 2.0D 99 to 05 Y20DTH Gates 0614411 New,127.39,333712805254,N/A,Gates,3160273RMP,"AUTEX: 658075, BGA: DP0085K, BREDA LORETT: PS1036, CONTINENTAL: VD1031, FLENNOR: FL4528-J, FVD99534, Gates: 27215, Gates: 33620, 80000085, 80001992, ADZ96101C, DP0085, DPV1076, Gates: VKM93501, HUTCHINSON: DP031, IJS: 17-1030, INA: 544007210, IPD: 15-7070, KAGER: 27-0527, LUCAS ELECTRICAL: LPD0022, Metalcaucho: 04491, 4491, NTN: DPF353.01, OPEL: 0614411, 55351711, 5614415, 5614437, 614411, OPEL: 614444, 90528648, 9128177, 912817769, ORIGINAL IMPERIUM: 10271, QUINTON HAZELL: QCD23, RUVILLE: 515302, SAAB: 4772901, 55351711, 9544461, SKF: VKM93501, SNR: DPF353.01K1, SWAG: 40927215, 40933620, TRISCAN: 864324001, VAICO: V40-8115, VAUXHALL: 0614411, 55351711, 5614415, 5614437, 614411, 90528648, VAUXHALL: 9128177, 912817769, TVD1012A",3160273RMP,https://www.ebay.co.uk/sch/carpartsinmotion/m.html?_nkw&_armrs=1&_ipg&_from&_clu=2&_fcid=3&_localstpos&_stpos&gbr=1&_udlo=127.58999999999489&_udhi=127.63999999999488&_sop=2&_ipg=200
Diesel Particulate Filter DPF fits RENAULT MASTER Mk2 2.5D 06 to 10 Soot BM New,127.44,333714064084,N/A,BM Cats,1636662RMP,"AS: FD1026, BOSAL: 097-905, Cats & Pipes: RNF053, EEC: DPF038, EuroFlo: EPRN7003, KLARIUS: 390334, 390505, Klarius: 399071, NISSAN: 2001100Q0B, 2001100Q0G, 2001100Q1E, RENAULT: 8200746578, RENAULT: 8200890464, 93195746, 93196242, WALKER: 10561, Walker: 73060, WALKER: 93060, BM11106",1636662RMP,https://www.ebay.co.uk/sch/carpartsinmotion/m.html?_nkw&_armrs=1&_ipg&_from&_clu=2&_fcid=3&_localstpos&_stpos&gbr=1&_udlo=127.63999999999488&_udhi=127.68999999999488&_sop=2&_ipg=200
2x Shock Absorbers (Pair) Rear 349084 KYB Damper 55300A6000 55300A6050 Quality,124.39,233702002929,N/A,KYB,349084,"HYUNDAI: 55300A6000, 55300A6050, 55300A6070, 55300A6100, HYUNDAI: 55300A6200, 55300A6400, 55300A6440, 55300A6460, HYUNDAI: 553101H000, 553101H100, 553101H200, 553112L000, HYUNDAI: 553112L100, 553112L200, 553112L500, 553112L600, HYUNDAI: 553112R100, 553112R200, 553112R250, 553112R400, HYUNDAI: 553112R600, 553112R700, KIA: 55300A2000, 55300A2020, KIA: 55300A2050, 55300A2500, 55300A2510, 55300A2520, 55300A2890, KIA: 55300A2900, 55300A2950, 55300A2960, 55300A2970, 55300A6010, KIA: 55300A6100, 55300A6200, 55300A6400, 55300A6420, 55300A6430, KIA: 55300A6440, 55300A6450, 55300A6460, 55300A6470, 55300A6700, KIA: 55300A6900, 553101H000, 553101H001, 553101H002, 553101H003, KIA: 553101H100, 553101H101, 553101H102, 553101H200, 553101H201, KIA: 553101H202, 553111D400, 553111H000, 553111H100, 553111H200, KIA: 553111H500, 553111H600, 553112L000, 553112L100, 553112L200, KIA: 553112L600, 553112R200",349084,https://www.ebay.co.uk/sch/carpartsinmotion/m.html?_nkw&_armrs=1&_ipg&_from&_clu=2&_fcid=3&_localstpos&_stpos&gbr=1&_udlo=124.38999999999507&_udhi=124.43999999999507&_sop=2&_ipg=200
Camshaft CS9503 BGA 038109101AH 38109101AH Genuine Top Quality Guaranteed New,126.99,333709377199,N/A,BGA,CS9503,"AE: CAM904, AJUSA: 93175400, AMC: 666863, 666863K, AUDI: 038109101AH, 38109101AH, AUTLOG: NW5022, BTS Turbo: CP10255, CAMPRO: CP10255, CP60250, CP60292, ET ENGINETEAM: HV0164, HV0287, ET ENGINETEAM: HV0340, HV0342, FAI AutoParts: C312, FEBI BILSTEIN: 33194, FRECCIA: CM05-2127, KOLBENSCHMIDT: 50006342, RUVILLE: 215434, SEAT: 038109101AH, 38109101AH, SKODA: 038109101AH, 38109101AH, SWAG: 30929852, 30933194, VW: 038109101AH, 38109101AH, WILMINK GROUP: WG1011707, WG1017664, WILMINK GROUP: WG1093073, WG1155344, WG1307328, WG1428917, WILMINK GROUP: WG1428918, WG1440179, WG1440180",CS9503,https://www.ebay.co.uk/sch/carpartsinmotion/m.html?_nkw&_armrs=1&_ipg&_from&_clu=2&_fcid=3&_localstpos&_stpos&gbr=1&_udlo=126.98999999999492&_udhi=127.03999999999492&_sop=2&_ipg=200
Wishbone / Suspension Arm fits MERCEDES ML63 AMG W164 6.2 Front Left 06 to 11,126.49,233644044645,1 sold,Borg & Beck,6986336RMP,"AEBI: 46498, BENDIX: 043946B, BGA: TRC5661, DELPHI: TC2739, DELPHI: TD1818W, FAI AutoParts: SS10395, SS8884, FEBI BILSTEIN: 28366, FIRST LINE: FCA7151, FRAP: 3131, LEMFÖRDER: 3591901, MAPCO: 51883, MERCEDES-BENZ: 1643301707, MERCEDES-BENZ: 1643302907, 1643303407, 1643302507, METZGER: 58081301, MOTAQUIP: LVSA1414, NK: 5013375, OCAP: 0392669, OCAP: 1215833, 1215835, 392669, OPTIMAL: G6-1337, sbs: 5013375, SIDEM: 49572, SPIDAN: 46498, SWAG: 10928366, 10928366, TRUCKTEC AUTOMOTIVE: 02.31.166, 02.31.206, VAICO: V30-7632, VEMO: V30-7632, BCA7151",6986336RMP,https://www.ebay.co.uk/sch/carpartsinmotion/m.html?_nkw&_armrs=1&_ipg&_from&_clu=2&_fcid=3&_localstpos&_stpos&gbr=1&_udlo=126.48999999999495&_udhi=126.53999999999495&_sop=2&_ipg=200
