Item Title,Item Price,Item ID,Number Sold,Brand,Manufacturer Part Number,Reference OE/OEM Number,MPN,Reference
Valve Stem Seal 50-306122-50 Goetze 11490525 1470910 1474550 1486852 1486853 New,2.19,233702772515,N/A,Goetze,50-306122-50,"AJUSA: 12009000, 57008200, 57017300, ALFA ROMEO: 0605359490, ALFA ROMEO: 60535949, 605359490, BGA: VS5326, VS6389, CORTECO: 12012443, 12015511, ELRING: 206.954, 353.531, ELWIS ROYAL: 1626531, 1626533, 1626539, FAI AutoParts: VSK101, FAI AutoParts: VSK109, VSK435, FORD: 0490525, 11490525, 1470910, FORD: 1474550, 1486852, 1486853, 1490506, 1490525, 1525251, FORD: 1568834, 1596529, 1620378, 1644647, 1651532, 490525, FORD: 6535949, 6147047, 6535949, 702M6571A1A, 70HM6571A1B, FORD: 70HM6571A3B, 70HM6571B3A, 72HM6571A3A, 77BM6571AB, FORD: 81SM6571A1D, 81SM6571A2C, 833347, 86TM6571AA, 86TM6571AB, FORD: D2FZ6571B, E4AA6571AA, W81SM6571A2A, W81SM6571A2C, KHD: 04153728, 4153728, MERCEDES-BENZ: 9060530358, PAYEN: PB180, SWAG: 50903351, VICTOR REINZ: 70-24491-10, 70-25169-00",50-306122-50,https://www.ebay.co.uk/sch/carpartsinmotion/m.html?_nkw&_armrs=1&_ipg&_from&_clu=2&_fcid=3&_localstpos&_stpos&gbr=1&_udlo=2.1899999999999995&_udhi=2.2399999999999993&_sop=2&_ipg=200
Wheel Bolt / Stud / Nut fits FORD FOCUS Mk4 1.5D 2018 on 5114405 ACPA1012AXA New,1.94,333712775079,1 sold,Febi,5162793RMP,"AIC: 55617, AUTOMEGA: 10501140405, 110001810, BBR Automotive: 001-10-21139, EIBACH: S2-1-12-50-15-19-D, EIBACH: S2-1-12-50-15-19-O, FEBI BILSTEIN: 40247, FORD: 5114405, FORD USA: ACPA1012AXA, SWAG: 50940247, TOPRAN: 304596, VAICO: V25-0986, 46705",5162793RMP,https://www.ebay.co.uk/sch/carpartsinmotion/m.html?_nkw&_armrs=1&_ipg&_from&_clu=2&_fcid=3&_localstpos&_stpos&gbr=1&_udlo=1.9400000000000002&_udhi=1.9900000000000002&_sop=2&_ipg=200
Yellow Sponge Polish Applicator Pad Q9256 Kent Genuine Top Quality Product New,2.2,233731356514,N/A,Kent,Q9256,N/A,Q9256,https://www.ebay.co.uk/sch/carpartsinmotion/m.html?_nkw&_armrs=1&_ipg&_from&_clu=2&_fcid=3&_localstpos&_stpos&gbr=1&_udlo=2.1899999999999995&_udhi=2.2399999999999993&_sop=2&_ipg=200
Wheel Bolt / Stud / Nut fits FORD TRANSIT 1.6 1.6D 2013 on 5114405 ACPA1012AXA,1.96,333712774944,N/A,Febi,5608645RMP,"AIC: 55617, AUTOMEGA: 10501140405, 110001810, BBR Automotive: 001-10-21139, EIBACH: S2-1-12-50-15-19-D, EIBACH: S2-1-12-50-15-19-O, FEBI BILSTEIN: 40247, FORD: 5114405, FORD USA: ACPA1012AXA, SWAG: 50940247, TOPRAN: 304596, VAICO: V25-0986, 46705",5608645RMP,https://www.ebay.co.uk/sch/carpartsinmotion/m.html?_nkw&_armrs=1&_ipg&_from&_clu=2&_fcid=3&_localstpos&_stpos&gbr=1&_udlo=1.9400000000000002&_udhi=1.9900000000000002&_sop=2&_ipg=200
Sump Plug Washer / Seal fits SKODA Oil Drain ADL N0138492 Top Quality Guaranteed,1.95,233576559867,6 sold,Blue Print,3551132RMP,"AIC: 52648, AJUSA: 21012700, 21029500, 22007000, ASHUKI: M001-50, AUDI: N0138492, N0138492, AUGER: 71508, AUTOMEGA: 1020910046, AUTOMEGA: 10N0130849.2, 190021210, 30100050306, BBR Automotive: 001-80-11234, CHEVROLET: 11023582, 94525114, CHRYSLER: 05073946AA, 5073946AA, CORTECO: 005565S, DAEWOO: 11023582, 11023589, 94525114, DEUTZ: 1118693, 1301223, DODGE: 05073946AA, 5073946AA, DT Spare Parts: 9.01028, ELRING: 115.100, 243.205, ELWIS ROYAL: 5256009, FA1: 257.828.011, FA1: 259.150-U-25, 259.150-U-5, 259.150-U-50, 259.150.010, FA1: 259.150.100, FEBI BILSTEIN: 07215, 7215, FORD: 1005306, FORD: 99564-1400, GENERAL MOTORS: 011023582, 11023582, GLASER: W72119-02, GOETZE: 33-110870-00, IMEX: IMX001007603014106, IMX06561900706, JEEP: 05073946AA, JEEP: 5073946AA, JP GROUP: 8113850100, KIA: K9956-21-400, KRAFT AUTOMOTIVE: 1130980, KS TOOLS: 430.1505, 430.2505, MASSEY FERGUSON: 1440012X1, MAZDA: 9956-41-400, MERCEDES-BENZ: 007603014106, A007603014106, MITSUBISHI: MN960041, NPS: M129A04, OPEL: 02091046, 2091046, 2091046, PAYEN: KG5144, PAYEN: KG5366, KG5369, KG664, PA401, QUINTON HAZELL: QOC1012, QUINTON HAZELL: QOC1013, QOC1033, SAMPA: 200.217, SEAT: N0138492, N0138492, SKODA: N0138492, N0138492, SWAG: 99907215, Technika: 711393, TOPRAN: 104474, TRUCKTEC AUTOMOTIVE: 02.67.048, 07.67.001, UNIGOM: 162070, VAICO: V10-3327, V30-1007, VAUXHALL: 011023582, 11023582, VICTOR REINZ: 41-70089-00, VW: N0138492, N0138492, WILMINK GROUP: 21012700, 21029500, WG1084960, WG1085072, WILMINK GROUP: WG1103286, WG1163712, WG1182930, WG1184627, WILMINK GROUP: WG1219866, WG1432747, WG1452001, WG1452012, ADA100105",3551132RMP,https://www.ebay.co.uk/sch/carpartsinmotion/m.html?_nkw&_armrs=1&_ipg&_from&_clu=2&_fcid=3&_localstpos&_stpos&gbr=1&_udlo=1.9400000000000002&_udhi=1.9900000000000002&_sop=2&_ipg=200
Exhaust Clamp fits AUDI COUPE 8B 80 to 96 028253137 893253147F 191253409A Febi,1.95,333732947940,N/A,Febi,2882925RMP,"3RG: 70502, ACEMARK: 186131, AKRON-MALÒ: 17570, 23911, ASAM: 55481, ASSO: 99.1112, AUDI: 028253137, 191253409A, AUDI: 191253409H, 28253137, 321298001C, 861253147, 861253147, AUDI: 893253147F, 893253147F, AUTOGEM: CSM411, SR32, SR34EP, SR35, AUTOMEGA: 140001210, 302530147893F, BBR Automotive: 001-10-16795, BOSAL: 255-338, 255-568, CASALS: 6278, 7490, CAUTEX: 46.0022, EBERSPÄCHER: 12.355.912, 23.183.911, 23.261.911, ERNST: 498852, EUROREPAR: E128D16, E128D19, FA1: 003-728, 003-730, 003-731, FA1: 003-928, 003-930, 003-931, FARE SA: 0366, 0943, 0946, 0947, FAST: FT84504, Faurecia: AA93077, AA93080, AA96543, FS80095, FEBI BILSTEIN: 5075, FENNO: P7358, FONOS: 81217, 81278, FORMPART: 19251005/S, GOOM: SEP-0004, GSP: 510171, GT Exhausts: GVW339, HJS: 83111350, 831113500, IMASAF: 09.10.11, IMASAF: 09.11.08, JP GROUP: 1121603500, KLARIUS: 210390, 420163, KLARIUS: 420168, UNR10, UNR10AB, UNR4, UNR4AT, VW339L, KLOKKERHOLM: 255-338, KRAFT AUTOMOTIVE: 0541000, LEMFÖRDER: 1660302, MAXGEAR: 27-0100, MERCEDES-BENZ: 1104920082, 1104920082, 1124920082, 1124920282, MERCEDES-BENZ: 1124920282, 1164920182, 1164920182, A1104920082, MERCEDES-BENZ: A1124920082, A1124920282, A1164920182, Metalcaucho: 00366, MEYLE: 0140490008, ORIGINAL IMPERIUM: 28468, PATRON: PSE2186, PSE22167, QH Talbros: 420163, 420168, FTR28, QUINTON HAZELL: 99.1112, SASIC: 9003005, STC: T400366, STELLOX: 07-10519-SX, SWAG: 99905075, TEDGUM: 00720985, TOPRAN: 104293, TRICLO: 353003, TRUCKTEC AUTOMOTIVE: 02.39.004, TRUCKTEC AUTOMOTIVE: 02.39.007, 08.39.003, UCEL: 31428, UNIGOM: 165078, 166007, 166012, VAICO: V10-1016, V30-7306, VENEPORTE: AA93077, AA93080, AA96543, VW80095, VW: 028253137, VW: 191253409A, 191253409H, 28253137, 321298001C, 861253147",2882925RMP,https://www.ebay.co.uk/sch/carpartsinmotion/m.html?_nkw&_armrs=1&_ipg&_from&_clu=2&_fcid=3&_localstpos&_stpos&gbr=1&_udlo=1.9400000000000002&_udhi=1.9900000000000002&_sop=2&_ipg=200
Sump Plug Washer / Seal fits FORD Oil Drain ADL 995641400 1005306 Quality New,1.95,233748800110,N/A,Blue Print,1534186RMP,"AIC: 52648, AJUSA: 21012700, 21029500, 22007000, ASHUKI: M001-50, AUDI: N0138492, N0138492, AUGER: 71508, AUTOMEGA: 1020910046, AUTOMEGA: 10N0130849.2, 190021210, 30100050306, BBR Automotive: 001-80-11234, CHEVROLET: 11023582, 94525114, CHRYSLER: 05073946AA, 5073946AA, CORTECO: 005565S, DAEWOO: 11023582, 11023589, 94525114, DEUTZ: 1118693, 1301223, DODGE: 05073946AA, 5073946AA, DT Spare Parts: 9.01028, ELRING: 115.100, 243.205, ELWIS ROYAL: 5256009, FA1: 257.828.011, FA1: 259.150-U-25, 259.150-U-5, 259.150-U-50, 259.150.010, FA1: 259.150.100, FEBI BILSTEIN: 07215, 7215, FORD: 1005306, FORD: 99564-1400, GENERAL MOTORS: 011023582, 11023582, GLASER: W72119-02, GOETZE: 33-110870-00, IMEX: IMX001007603014106, IMX06561900706, JEEP: 05073946AA, JEEP: 5073946AA, JP GROUP: 8113850100, KIA: K9956-21-400, KRAFT AUTOMOTIVE: 1130980, KS TOOLS: 430.1505, 430.2505, MASSEY FERGUSON: 1440012X1, MAZDA: 9956-41-400, MERCEDES-BENZ: 007603014106, A007603014106, MITSUBISHI: MN960041, NPS: M129A04, OPEL: 02091046, 2091046, 2091046, PAYEN: KG5144, PAYEN: KG5366, KG5369, KG664, PA401, QUINTON HAZELL: QOC1012, QUINTON HAZELL: QOC1013, QOC1033, SAMPA: 200.217, SEAT: N0138492, N0138492, SKODA: N0138492, N0138492, SWAG: 99907215, Technika: 711393, TOPRAN: 104474, TRUCKTEC AUTOMOTIVE: 02.67.048, 07.67.001, UNIGOM: 162070, VAICO: V10-3327, V30-1007, VAUXHALL: 011023582, 11023582, VICTOR REINZ: 41-70089-00, VW: N0138492, N0138492, WILMINK GROUP: 21012700, 21029500, WG1084960, WG1085072, WILMINK GROUP: WG1103286, WG1163712, WG1182930, WG1184627, WILMINK GROUP: WG1219866, WG1432747, WG1452001, WG1452012, ADA100105",1534186RMP,https://www.ebay.co.uk/sch/carpartsinmotion/m.html?_nkw&_armrs=1&_ipg&_from&_clu=2&_fcid=3&_localstpos&_stpos&gbr=1&_udlo=1.9400000000000002&_udhi=1.9900000000000002&_sop=2&_ipg=200
Sump Plug Washer / Seal fits DODGE Oil Drain ADL 05073946AA 5073946AA Quality,1.97,333760249861,N/A,Blue Print,1582798RMP,"AIC: 52648, AJUSA: 21012700, 21029500, 22007000, ASHUKI: M001-50, AUDI: N0138492, N0138492, AUGER: 71508, AUTOMEGA: 1020910046, AUTOMEGA: 10N0130849.2, 190021210, 30100050306, BBR Automotive: 001-80-11234, CHEVROLET: 11023582, 94525114, CHRYSLER: 05073946AA, 5073946AA, CORTECO: 005565S, DAEWOO: 11023582, 11023589, 94525114, DEUTZ: 1118693, 1301223, DODGE: 05073946AA, 5073946AA, DT Spare Parts: 9.01028, ELRING: 115.100, 243.205, ELWIS ROYAL: 5256009, FA1: 257.828.011, FA1: 259.150-U-25, 259.150-U-5, 259.150-U-50, 259.150.010, FA1: 259.150.100, FEBI BILSTEIN: 07215, 7215, FORD: 1005306, FORD: 99564-1400, GENERAL MOTORS: 011023582, 11023582, GLASER: W72119-02, GOETZE: 33-110870-00, IMEX: IMX001007603014106, IMX06561900706, JEEP: 05073946AA, JEEP: 5073946AA, JP GROUP: 8113850100, KIA: K9956-21-400, KRAFT AUTOMOTIVE: 1130980, KS TOOLS: 430.1505, 430.2505, MASSEY FERGUSON: 1440012X1, MAZDA: 9956-41-400, MERCEDES-BENZ: 007603014106, A007603014106, MITSUBISHI: MN960041, NPS: M129A04, OPEL: 02091046, 2091046, 2091046, PAYEN: KG5144, PAYEN: KG5366, KG5369, KG664, PA401, QUINTON HAZELL: QOC1012, QUINTON HAZELL: QOC1013, QOC1033, SAMPA: 200.217, SEAT: N0138492, N0138492, SKODA: N0138492, N0138492, SWAG: 99907215, Technika: 711393, TOPRAN: 104474, TRUCKTEC AUTOMOTIVE: 02.67.048, 07.67.001, UNIGOM: 162070, VAICO: V10-3327, V30-1007, VAUXHALL: 011023582, 11023582, VICTOR REINZ: 41-70089-00, VW: N0138492, N0138492, WILMINK GROUP: 21012700, 21029500, WG1084960, WG1085072, WILMINK GROUP: WG1103286, WG1163712, WG1182930, WG1184627, WILMINK GROUP: WG1219866, WG1432747, WG1452001, WG1452012, ADA100105",1582798RMP,https://www.ebay.co.uk/sch/carpartsinmotion/m.html?_nkw&_armrs=1&_ipg&_from&_clu=2&_fcid=3&_localstpos&_stpos&gbr=1&_udlo=1.9400000000000002&_udhi=1.9900000000000002&_sop=2&_ipg=200
Sump Plug Washer / Seal fits CHEVROLET Oil Drain ADL 11023582 94525114 Quality,1.97,233748799932,N/A,Blue Print,1303547RMP,"AIC: 52648, AJUSA: 21012700, 21029500, 22007000, ASHUKI: M001-50, AUDI: N0138492, N0138492, AUGER: 71508, AUTOMEGA: 1020910046, AUTOMEGA: 10N0130849.2, 190021210, 30100050306, BBR Automotive: 001-80-11234, CHEVROLET: 11023582, 94525114, CHRYSLER: 05073946AA, 5073946AA, CORTECO: 005565S, DAEWOO: 11023582, 11023589, 94525114, DEUTZ: 1118693, 1301223, DODGE: 05073946AA, 5073946AA, DT Spare Parts: 9.01028, ELRING: 115.100, 243.205, ELWIS ROYAL: 5256009, FA1: 257.828.011, FA1: 259.150-U-25, 259.150-U-5, 259.150-U-50, 259.150.010, FA1: 259.150.100, FEBI BILSTEIN: 07215, 7215, FORD: 1005306, FORD: 99564-1400, GENERAL MOTORS: 011023582, 11023582, GLASER: W72119-02, GOETZE: 33-110870-00, IMEX: IMX001007603014106, IMX06561900706, JEEP: 05073946AA, JEEP: 5073946AA, JP GROUP: 8113850100, KIA: K9956-21-400, KRAFT AUTOMOTIVE: 1130980, KS TOOLS: 430.1505, 430.2505, MASSEY FERGUSON: 1440012X1, MAZDA: 9956-41-400, MERCEDES-BENZ: 007603014106, A007603014106, MITSUBISHI: MN960041, NPS: M129A04, OPEL: 02091046, 2091046, 2091046, PAYEN: KG5144, PAYEN: KG5366, KG5369, KG664, PA401, QUINTON HAZELL: QOC1012, QUINTON HAZELL: QOC1013, QOC1033, SAMPA: 200.217, SEAT: N0138492, N0138492, SKODA: N0138492, N0138492, SWAG: 99907215, Technika: 711393, TOPRAN: 104474, TRUCKTEC AUTOMOTIVE: 02.67.048, 07.67.001, UNIGOM: 162070, VAICO: V10-3327, V30-1007, VAUXHALL: 011023582, 11023582, VICTOR REINZ: 41-70089-00, VW: N0138492, N0138492, WILMINK GROUP: 21012700, 21029500, WG1084960, WG1085072, WILMINK GROUP: WG1103286, WG1163712, WG1182930, WG1184627, WILMINK GROUP: WG1219866, WG1432747, WG1452001, WG1452012, ADA100105",1303547RMP,https://www.ebay.co.uk/sch/carpartsinmotion/m.html?_nkw&_armrs=1&_ipg&_from&_clu=2&_fcid=3&_localstpos&_stpos&gbr=1&_udlo=1.9400000000000002&_udhi=1.9900000000000002&_sop=2&_ipg=200
Welsh Dragon Red On Clear 108x64mm V204 Castle Genuine Top Quality Product New,2.44,233734460256,N/A,Castle,V204,N/A,V204,https://www.ebay.co.uk/sch/carpartsinmotion/m.html?_nkw&_armrs=1&_ipg&_from&_clu=2&_fcid=3&_localstpos&_stpos&gbr=1&_udlo=2.4399999999999986&_udhi=2.4899999999999984&_sop=2&_ipg=200
Wheel Bolt / Stud / Nut fits FORD B-MAX 1.0 2012 on 5114405 ACPA1012AXA Febi New,1.99,333708344418,N/A,Febi,5231355RMP,"AIC: 55617, AUTOMEGA: 10501140405, 110001810, BBR Automotive: 001-10-21139, EIBACH: S2-1-12-50-15-19-D, EIBACH: S2-1-12-50-15-19-O, FEBI BILSTEIN: 40247, FORD: 5114405, FORD USA: ACPA1012AXA, SWAG: 50940247, TOPRAN: 304596, VAICO: V25-0986, 46705",5231355RMP,https://www.ebay.co.uk/sch/carpartsinmotion/m.html?_nkw&_armrs=1&_ipg&_from&_clu=2&_fcid=3&_localstpos&_stpos&gbr=1&_udlo=1.9400000000000002&_udhi=1.9900000000000002&_sop=2&_ipg=200
"Top Strut Mounting fits MERCEDES C220 S204, W204 2.1D Front 07 to 08 OM646.811",38.49,333718734500,N/A,Febi,3262303RMP,"AKRON-MALÒ: 242041, BBR Automotive: 001-10-28973, 001-10-29808, BILSTEIN: 12-225842, BOGE: 84-129-A, CPB: 504080, DYS: 73-26784, DYS: 73-26941, FAI AutoParts: SS10565, GABRIEL: GK353, GOLD: 9270115-36800060, GSP: 533655, HUTCHINSON: 590320, KS239, KAWE: 850023907, 850023908, KYB: SM1043, LEMFÖRDER: 3651001, MAPCO: 38856, MERCEDES-BENZ: 2043200573, 2043201173, 2043200573, MERCEDES-BENZ: 2043201173, A2043200573, A2043201173, MEYLE: 0146410011, ORIGINAL IMPERIUM: 32109, 32124, 32124/2, QUINTON HAZELL: EMA4983, EMR4983, SACHS: 802654, SKF: VKDA35878T, SNR: KB651.11, SWAG: 10928526, TALOSA: 63-12228, TALOSA: 63-12391, TOPRAN: 409472, TRISCAN: 850023907, 850023908, TRUCKTEC AUTOMOTIVE: 02.30.254, TRW: JSL305, VAICO: V30-1863, VAICO: V30-1864, WXQP: 180921, 28526",3262303RMP,https://www.ebay.co.uk/sch/carpartsinmotion/m.html?_nkw&_armrs=1&_ipg&_from&_clu=2&_fcid=3&_localstpos&_stpos&gbr=1&_udlo=38.53999999999995&_udhi=38.58999999999995&_sop=2&_ipg=200
2x Brake Discs (Pair) Vented fits FORD PROBE Mk2 Front 2.0 2.5 93 to 98 239mm,38.55,333718081267,N/A,Blue Print,3228097RMP,"4X4 ESTANFI: EST-60-00-002, EST-60-00-062, EST-60-00-095, 4X4 ESTANFI: EST-60-03-307, EST-60-03-363, EST-60-09-992, 4X4 ESTANFI: EST-61-09-906, A.B.S.: 09.6727.34, 15981, 15981OE, ABE: C3G010ABE, ACEMARK: 242731, AD JSAutomotive: VBD1160, AIC: 53628, AKEBONO: BN-0032, BN-0032E, AKRON-MALÒ: 1110198, AP: 24682E, X24682, AP XENERGY: X602032, APEC braking: DSK208, APEC braking: DSK253, SDK6009, ASAM: 71743, 74928, 74931, 74932, ASHIKA: 60-03-363, ASHUKI: M608-21, P330-019, ATE: 24.0120-0147.1, ATE: 24.0320-0147.1, AUTOMEGA: 120008610, BARUM: BAR20147, BELACO: BDI013, BENDIX: 521914, 561513B, 561513BC, Borg & Beck: BBD4025, BOSCH: 0986478502, 0986479874, BOSCH: 0986AB6172, 0986BB4144, 0986T16172, Brake Engineering: DI955024, DI955615, BRAKE FIT: DK6009, DK6067, BRAXIS: AE0017, BRECK: BR318VA100, BRECO: BS8277, Brembo: 08690314, BREMBO: 09.6727.34, 09.6727.77, Brembo: 09672714, 09672730, 09672734, 09672777, 6727.10, BREMBO: DP24003, DP24004, DP24005, DP24006, DP24008, Brembo: DP24003, DP24004, DP24005, DP24006, DP24008, FD056000, Brembo: FS.056.000, BREMSI: CD6766V, CD6887V, DBA766V, DBA887V, BSF: 11065V, BSG: BSG30-210-013, CAR: 142.266, 142266, HPD266, CHAMPION: 561513CH, 562078CH, CIFAM: 800-169, Comline: ADC0440V, COMLINE: AND6040, DACO Germany: 602550, DEEVO: BD10300, Delphi: BG2440, DELPHI: BG2440C, Delphi: BG3055, DELPHI: BG3088, DENCKERMANN: B130209, DIAMAX: N08154, DJ PARTS: BD1670, DON: PCD11872, DOYEN: RDV014, Dr!ve+: DP1010.11.0359, DYNAMATRIX: DBD766, DBD766C, DBD887, E.T.F.: 19-1064, EBC Brakes: D316, GD316, USR316, EDR: RAD1083C, EUROBRAKE: 5815202528, 5815312528, EUROREPAR: 1618866780, ADM54365",3228097RMP,https://www.ebay.co.uk/sch/carpartsinmotion/m.html?_nkw&_armrs=1&_ipg&_from&_clu=2&_fcid=3&_localstpos&_stpos&gbr=1&_udlo=38.53999999999995&_udhi=38.58999999999995&_sop=2&_ipg=200
Overrunning Alternator Pulley fits PEUGEOT PARTNER 5F 1.6D 1.9D 2.0D 1996 on INA,38.55,233744478251,N/A,INA,2845870RMP,"AS-PL: AFP0020, BOSCH: 0124525027, 0124525035, 0124615027, BOSCH: 0986044400, 0986046240, 0986047350, 0124525027, 0124525035, BOSCH: 0124615027, 0986044400, 0986046240, 0986047350, F00M147999, BOSCH: F00M991172, BREDA LORETT: CR3901, CR3901, CONTINENTAL: AP9042, GATES: 7789-10114, 778910114, OAP7140, HUTCHINSON: DB0263, INA: F-232369, F-232369.02, F-232369.03, INA: F-232369.09, F-232369.11, F-232369.2, F232369, F23236902, INA: F23236903, F23236909, F23236911, F2323692, LUCAS ELECTRICAL: LOPA0068, PEUGEOT: 5705AA, 5705AS, 5705ER, PEUGEOT: 5705EY, 5705NH, 5705AA, 5705AS, 5705ER, 5705EY, 5705NH, PEUGEOT: 96408787, 96408787, RUVILLE: 56657, SKF: VKM03306, SKF: VKM03306, TRIPLE FIVE: 234056, 354101, 354100, 354101, TRIPLE FIVE: GA759.05, GA75905, 535017910",2845870RMP,https://www.ebay.co.uk/sch/carpartsinmotion/m.html?_nkw&_armrs=1&_ipg&_from&_clu=2&_fcid=3&_localstpos&_stpos&gbr=1&_udlo=38.53999999999995&_udhi=38.58999999999995&_sop=2&_ipg=200
Aux Belt Tensioner fits HYUNDAI SONATA EF 2.5 98 to 01 G6BV Drive V-Ribbed Gates,38.55,333720009794,N/A,Gates,367139RMP,"BTA: E20501BTA, CONTINENTAL: V58417, FLENNOR: FS99278, Gates: 31256, 534024710, APV2485, VKM65014, HUTCHINSON: T0424, HYUNDAI: 2528137101, 2528137120, INA: 534024710, IPD: 15-3557, JAPANPARTS: TS-H02, KAVO PARTS: DTP-3014, KIA: 25281-37120, KIA: 2528137120, LUCAS ELECTRICAL: LA0546, NIPPARTS: J1140332, NIPPARTS: J1140523, OPTIMAL: 0-N1677, 0-N1677S, RUVILLE: 58417, SKF: VKM65014, SNR: GA384.00, SPIDAN: 69417, SWAG: 90931256, TRISCAN: 8641432006, UNIPART: UGCGBT8149, VAICO: V52-0370, T38149",367139RMP,https://www.ebay.co.uk/sch/carpartsinmotion/m.html?_nkw&_armrs=1&_ipg&_from&_clu=2&_fcid=3&_localstpos&_stpos&gbr=1&_udlo=38.53999999999995&_udhi=38.58999999999995&_sop=2&_ipg=200
Wheel Bearing Kit fits RENAULT LAGUNA Mk1 1.6 Rear 99 to 01 QH 7701206354 New,38.49,233710943026,N/A,Quinton Hazell,142864RMP,"BRT Bearings: PWK0480, FIRST LINE: FBK713, IPD: 30-3089, METZGER: WM1108, RENAULT: 7701206354, RUVILLE: 5568, SKF: VKBA3559, SPIDAN: 0.027186, QWB1108",142864RMP,https://www.ebay.co.uk/sch/carpartsinmotion/m.html?_nkw&_armrs=1&_ipg&_from&_clu=2&_fcid=3&_localstpos&_stpos&gbr=1&_udlo=38.53999999999995&_udhi=38.58999999999995&_sop=2&_ipg=200
Water Pump fits MAZDA 323 Mk3 1.5 87 to 89 Coolant ADL 8AB316010 8AB315010A New,38.55,333718651026,N/A,Blue Print,3361018RMP,"4X4 ESTANFI: EST-35-03-310, EST-35-03-311, ACEMARK: 103176, ACEMARK: 231760, ACKOJA: A32-50005, AIRTEX: 4049, AISIN: WPZ-001, AISIN: WPZ-029V, AISIN-AU: WPZ-001V, AKS DASIS: 784510N, AQUAPLUS: 85-2590, ASHIKA: 35-03-310, 35-03-311, ASHUKI: 0453-2203, I300-15O, M241-01, BEHR HELLA SERVICE: 8MP376801-231, 8MP376801-234, BGA: CP8098, BORG & BECK: BWP1447, BUGATTI: PA6703, CAR: 332019, CIFAM: 824-437A, DAYCO: DP378, DELPHI: WP1736, DENCKERMANN: A310078, A310078P, DOLZ: M460, EUROREPAR: 1637176680, EUROREPAR: E111617, FAI AutoParts: WP6355, WP6580, FEBI BILSTEIN: 15469, FENOX: HB3802, HB4307, FI.BA: WPF029, FIRST LINE: FWP1447, FWP1447, FORD: F4BZ8501B, FRECCIA: WP0560, GATES-AU: GWP42128, GGT: PA10910, GK: 981715, GMB: GWK-31A, GMB: GWMZ-31A, GMB-EA: GWMZ-31A, GNS: YH-K103, YH-MZ101, GNS: YH-MZ101-2, GRAF: PA437A, HELLA: 8MP376801-231, HELLA: 8MP376801-234, HEPU: P715, HERTH+BUSS JAKOPARTS: J1513010, Hi-Q: SWP1017, HUTCHINSON: WP252, IAP QUALITY PARTS: 150-11021, IAP QUALITY PARTS: 150-21030, 150-21030G, INA: 538057010, IPS Parts: IPW-7310, IPW-7326, IPW7331, JAPANPARTS: PQ-310, JAPANPARTS: PQ-311, JAPKO: 35310, 35311, JP GROUP: 3814100200, JP GROUP: 3814100209, KAGER: 33-0175, KAISHIN: WPK169, KAVO PARTS: KW-1621, MW-1501, KIA: 0K93015010, 0K93015010A, KIA: KB3C715010, KKY01-15-010B, KKY01-15-010C, KKY01-15-010D, KIA: oK930-15-010, oK930-15-010A, KOLBENSCHMIDT: 50005111, KOLBENSCHMIDT: 50015431, KRAFT AUTOMOTIVE: 1503530, KWP: 10437A, LPR: WP0103, LUCAS: LAWP0978, LUCAS ENGINE DRIVE: LAWP0978, LYNXauto: CW-0091, MAGNETI MARELLI: 352316170724, 600000044400, MAHLE: CP106000P, CP106000S, MANDO: EWPK0006, MWP1017, ADM59109",3361018RMP,https://www.ebay.co.uk/sch/carpartsinmotion/m.html?_nkw&_armrs=1&_ipg&_from&_clu=2&_fcid=3&_localstpos&_stpos&gbr=1&_udlo=38.53999999999995&_udhi=38.58999999999995&_sop=2&_ipg=200
Camshaft Adjuster Valve fits LEXUS IS300h Mk3 2.5 Intake side 2013 on 2AR-FSE,38.55,333684756963,N/A,Lucas,8037029RMP,"FISPA: 87.113, FUELPARTS: CAS1055, HOFFER: 8091529, INTERMOTOR: 17355, LUCAS CAV: SEB7829, MEAT & DORIA: 91529, OSSCA: 18832, SIDAT: 87.113, TOYOTA: 15330-0T010, 15330-0T030, TOYOTA: 15330-0T040, 15330-37010, VAICO: V70-0410, SEB7829",8037029RMP,https://www.ebay.co.uk/sch/carpartsinmotion/m.html?_nkw&_armrs=1&_ipg&_from&_clu=2&_fcid=3&_localstpos&_stpos&gbr=1&_udlo=38.53999999999995&_udhi=38.58999999999995&_sop=2&_ipg=200
Brake Drum fits MERCEDES 240GD W460 2.4D Rear 79 to 87 OM616.936 260mm TRW New,38.49,333719248527,N/A,TRW,1124181RMP,"A.B.S.: 4015S, APEC braking: DRM9703, ATE: 24022600011, BENDIX: 329142B, Borg & Beck: BBR7021, BOSCH: 0986477038, Bosch: 0986477038, 986477038, Brake Engineering: DR960670, Brembo: 14560310, Delphi: BF181, BT257, DT Spare Parts: 467241, FEBI BILSTEIN: 18493, First Line: FBR637, FTE: BT257, HELLA: 8DT355301-141, Hella: 8DT355301141, JURID: 329142J, MERCEDES-BENZ: 6014235001, 6014235001, A6014235001, METELLI: 180221, Mintex: MBD012, NK: 263302, OMC: 100662, PAGID: 62101, PE Automotive: 01643700A, PEX: 150107, PUCH: 6014235001, QH BENELUX: 66215, Quinton Hazell: 66215, Quinton Hazell: BDR257, BTF257, REMSA: 711400, SWAG: 10918493, Textar: 94002600, 98100002601, TRISCAN: 812023202, ZIMMERMANN: 400506900, DB4089",1124181RMP,https://www.ebay.co.uk/sch/carpartsinmotion/m.html?_nkw&_armrs=1&_ipg&_from&_clu=2&_fcid=3&_localstpos&_stpos&gbr=1&_udlo=38.53999999999995&_udhi=38.58999999999995&_sop=2&_ipg=200
2x Brake Discs (Pair) Vented fits NISSAN KUBISTAR X76 1.2 Front 2003 on 238mm,38.55,333718080646,N/A,Blue Print,1012930RMP,"4X4 ESTANFI: EST-60-01-142, A.B.S.: 09.3148.14, 15117, 15117OE, ABE: C3R003ABE, ACEMARK: 242724, AIC: 53656, AKEBONO: BN-0117, AKEBONO: BN-0117E, AKRON-MALÒ: 1110109, AP: 24156E, X24156, AP XENERGY: X602055, APEC braking: DSK199, SDK6102, ASAM: 71251, ASHIKA: 60-00-0708, ASHUKI: N013-76, P330-107, ATE: 24.0120-0125.1, AUTOMEGA: 120049510, 30770102040286, AUTOMOTOR France: ADC3578, PDC3578, BARUM: BAR20125, BELACO: BDI083, BENDIX: 521942, 561336B, 561336BC, BORG & BECK: BBD4877, BOSCH: 0986478276, 0986479850, BOSCH: 0986479R66, 0986AB6146, 0986BB4086, F026A05706, Brake Engineering: DI951880, BRAKE FIT: DK6102, BRAXIS: AE0015, BRECK: BR327VA100, BRECO: BS7877, BREMBO: 09.3148.14, 09.3148.75, Brembo: 09314814, 09314875, 3148.10, BREMBO: DP68005, DP68006, BREMBO: DP68011, DP68029, Brembo: DP68006, DP68029, FD027000, Brembo: FS.027.000, BREMSI: CD6158V, DBA158V, BSF: 11003V, CAR: 142.573, 142573, HPD573, CASALS: 55428, CHAMPION: 561336CH, CIFAM: 800-110, COGEFA France: 7.01.204.286N, Comline: ADC1505V, COMLINE: AND6290, DACO Germany: 600510, 603930, DEEVO: BD11260, Delphi: BG2282, DELPHI: BG2282C, DENCKERMANN: B130221, DIAMAX: N08004, N08004P, DITAS: DFD1004, DJ PARTS: BD1272, DODA: 1070100102, DON: PCD12082, DOYEN: RDV007, Dr!ve+: DP1010.11.0477, DYNAMATRIX: DBD158, E.T.F.: 19-6572, EBC Brakes: D163, GD163, EDR: RAD1081C, EUROBRAKE: 5815203909, EUROBRAKE: 5815313909, EUROREPAR: 1618866580, FARCOM: 230824, FAST: FT31514, FEBI BILSTEIN: 09072, 9072, FENOX: TB217147, Ferodo: DDF158, FERODO: DDF158-1, Ferodo: DDF1581, FERODO: DDF158C, DDF158C-1, Ferodo: DDF158C1, DRF158, FERRON: TOP00820015, FI.BA: FBD125, First Line: FBD300, ADN143113",1012930RMP,https://www.ebay.co.uk/sch/carpartsinmotion/m.html?_nkw&_armrs=1&_ipg&_from&_clu=2&_fcid=3&_localstpos&_stpos&gbr=1&_udlo=38.53999999999995&_udhi=38.58999999999995&_sop=2&_ipg=200
HT Leads Ignition Cables Set fits PROTON WIRA 1.6 94 to 02 4G92 ADL MD334026 New,38.55,233710265246,N/A,Blue Print,1985294RMP,"4X4 ESTANFI: EST-132-05-507, EST-132-05-519, EST-132-05-520, 4X4 ESTANFI: EST-132-05-525, ANGLI: 14290, ASHIKA: 132-05-519, ASHUKI: 1614-0070, 1614-7205, C782-01, BOSCH: 0986357147, BRECAV: 28.503, BREMI: 3A00/148, EPS: 1.501.278, FACET: 4.9278, HERTH+BUSS JAKOPARTS: J5380700, HITACHI: 134279, IPS Parts: ISP-8502, JAPANPARTS: IC-519, JAPKO: 132519, KW: 360278, MAGNETI MARELLI: 600000175080, MAXGEAR: 53-0121, MDR: EPS-1501278, MPC-9519, MITSUBISHI: MD310297, MD334026, NIPPARTS: J5380700, NPS: M580I01, OSSCA: 13467, PEMEBLA: JAPIC-519, PROFIT: 1801-0481, PROTON: MD334026, Stark: SKIC-0030122, STELLOX: 10-38161-SX, 10-38263-SX, TESLA: T502B, VALEO: 346451, WXQP: 150697, 30590, ADG01608",1985294RMP,https://www.ebay.co.uk/sch/carpartsinmotion/m.html?_nkw&_armrs=1&_ipg&_from&_clu=2&_fcid=3&_localstpos&_stpos&gbr=1&_udlo=38.53999999999995&_udhi=38.58999999999995&_sop=2&_ipg=200
