Item Title,Item Price,Item ID,Number Sold,Brand,Manufacturer Part Number,Reference OE/OEM Number,MPN,Reference
For BMW 3 SERIES E90 E91 M47N2 ENGINE AIR INTAKE HOSE PIPE 318d 13717795284 UK,19.55,154299152749,4 sold,NewStart,13717795284,"13717795284, 1371 7 795 284",N/A,https://www.ebay.co.uk/sch/2021newstart/m.html?_nkw=&_armrs=1&_ipg=&_from=&_udlo=19.440000000000147&_udhi=19.490000000000148&_sop=2&_ipg=200
For Ford Transit MK7 Mondeo S-MAX Volvo V70 S80 MAF Mass Air Flow Sensor Meter A,19.48,154309070083,5 sold,Newstart,1376235,1376235 6C1112B579AA,N/A,https://www.ebay.co.uk/sch/2021newstart/m.html?_nkw=&_armrs=1&_ipg=&_from=&_udlo=19.340000000000146&_udhi=19.390000000000146&_sop=2&_ipg=200
Dynamic Sequential Mirror Indicator Light Fit For Ford C-Max 2 S-Max Kuga NS,19.29,154291783769,15 sold,NewStart,Does Not Apply,"1405034, 1405067",N/A,https://www.ebay.co.uk/sch/2021newstart/m.html?_nkw=&_armrs=1&_ipg=&_from=&_udlo=19.190000000000143&_udhi=19.240000000000144&_sop=2&_ipg=200
Dynamic Sequential Mirror Indicator Light Fit For Ford C-Max 2 S-Max Kuga NS,19.29,154291783769,15 sold,NewStart,Does Not Apply,"1405034, 1405067",N/A,https://www.ebay.co.uk/sch/2021newstart/m.html?_nkw=&_armrs=1&_ipg=&_from=&_udlo=19.140000000000143&_udhi=19.190000000000143&_sop=2&_ipg=200
Horse Clipper Blades Horse For Wolseley Liscop Liveryman Clipping A2 Medium UK,19.08,154365976096,3 sold,Newstart,N/A,N/A,N/A,https://www.ebay.co.uk/sch/2021newstart/m.html?_nkw=&_armrs=1&_ipg=&_from=&_udlo=18.94000000000014&_udhi=18.99000000000014&_sop=2&_ipg=200
Bonnet Boot Release Switch For Porsche 997 987 911 Boxster Cayman NS 99761310502,18.99,154377064096,N/A,NewStart,99761310502A05,"99761310502A05, 997-613-105-02-A05, 99761310502",N/A,https://www.ebay.co.uk/sch/2021newstart/m.html?_nkw=&_armrs=1&_ipg=&_from=&_udlo=18.89000000000014&_udhi=18.94000000000014&_sop=2&_ipg=200
FOR FORD TRANSIT MK6 MK7 2000-14 REAR DOOR LATCH LOCK CABLE HANDLE LOWER LEFT NS,18.99,154364913942,N/A,NewStart,1494102,"YC15-V431A03-AM, 1494102",1494102,https://www.ebay.co.uk/sch/2021newstart/m.html?_nkw=&_armrs=1&_ipg=&_from=&_udlo=18.89000000000014&_udhi=18.94000000000014&_sop=2&_ipg=200
5PCS Chrome Window Headlight Mirror Switch For VW Golf MK5/ 6 Passat For Jetta A,19.08,154321872856,N/A,NewStart,5K3959857 5ND959855 5ND959565A 5ND941431B,"5K3959857 5ND959855 5ND959565A 5ND941431B, Golf MK5 Headlight switch",Does not apply,https://www.ebay.co.uk/sch/2021newstart/m.html?_nkw=&_armrs=1&_ipg=&_from=&_udlo=18.94000000000014&_udhi=18.99000000000014&_sop=2&_ipg=200
For Driver Passenger Left Right Mitsubishi L200 05-15 Front Fog Light Lamp UK,18.99,154317045692,7 sold,Newstart,"Fog Light  Focus, 26150EB500","C2S1740,NE01-51-680A, PZ457-90510-LD, UC2T51680, XR837532",N/A,https://www.ebay.co.uk/sch/2021newstart/m.html?_nkw=&_armrs=1&_ipg=&_from=&_udlo=18.89000000000014&_udhi=18.94000000000014&_sop=2&_ipg=200
Car Door Handle Cover Pair For MINI Cooper S R50 R53 R56 R57 R58 R59 Gloss Black,18.59,154352324247,24 sold,NewStart,Does Not Apply,N/A,N/A,https://www.ebay.co.uk/sch/2021newstart/m.html?_nkw=&_armrs=1&_ipg=&_from=&_udlo=18.590000000000135&_udhi=18.640000000000136&_sop=2&_ipg=200
For Ford Fiesta MK7 B-Max Dynamic Side Door Wing Mirror Indicators LED Light NS,18.59,154221431908,33 sold,NewStart,Does not apply,"8A61-13B381-AD,8A61-13B381-AC,8A61-13B381-AB",N/A,https://www.ebay.co.uk/sch/2021newstart/m.html?_nkw=&_armrs=1&_ipg=&_from=&_udlo=18.490000000000133&_udhi=18.540000000000134&_sop=2&_ipg=200
For Mercedes-Benz 2000+ BGA NEC Chip Blade 433MHz  Smart Remote Key Fob 3 Button,18.48,154322026569,5 sold,NewStart,Key  Mercedes-Benz MHZ,N/A,Does Not Apply,https://www.ebay.co.uk/sch/2021newstart/m.html?_nkw=&_armrs=1&_ipg=&_from=&_udlo=18.34000000000013&_udhi=18.390000000000132&_sop=2&_ipg=200
Car Door Handle Cover Pair For MINI Cooper S R50 R53 R56 R57 R58 R59 Gloss Black,18.59,154352324247,24 sold,NewStart,Does Not Apply,N/A,N/A,https://www.ebay.co.uk/sch/2021newstart/m.html?_nkw=&_armrs=1&_ipg=&_from=&_udlo=18.490000000000133&_udhi=18.540000000000134&_sop=2&_ipg=200
For Mercedes-Benz 2000+ BGA NEC Chip Blade 433MHz  Smart Remote Key Fob 3 Button,18.48,154322026569,5 sold,NewStart,Key  Mercedes-Benz MHZ,N/A,Does Not Apply,https://www.ebay.co.uk/sch/2021newstart/m.html?_nkw=&_armrs=1&_ipg=&_from=&_udlo=18.390000000000132&_udhi=18.440000000000133&_sop=2&_ipg=200
Tailgate Opening Switch with Bulb For Vauxhall Opel Astra H Zafira B 13223919 NS,18.29,154264058752,12 sold,NewStart,Pnt5274847,N/A,N/A,https://www.ebay.co.uk/sch/2021newstart/m.html?_nkw=&_armrs=1&_ipg=&_from=&_udlo=18.19000000000013&_udhi=18.24000000000013&_sop=2&_ipg=200
Mass Air Flow Meter MAF Sensor Fit For Opel Vauxhall Chevrolet Volt #0280218254,18.32,154340775376,1 sold,NewStart,0280218254,0280218254 0280218268,N/A,https://www.ebay.co.uk/sch/2021newstart/m.html?_nkw=&_armrs=1&_ipg=&_from=&_udlo=18.19000000000013&_udhi=18.24000000000013&_sop=2&_ipg=200
55593033 For Mahle Vauxhall Thermostat and Seal Corsa D E Astra J  1.2 1.4 UK,17.99,154310595261,24 sold,NewStart,"55593033,55561629,55579011","55593033, 55561629, 55579011, 1338261, 1338029",N/A,https://www.ebay.co.uk/sch/2021newstart/m.html?_nkw=&_armrs=1&_ipg=&_from=&_udlo=17.890000000000125&_udhi=17.940000000000126&_sop=2&_ipg=200
Outer Chrome Door Handle Right Offside Driver Side for Fiat 500 & 500C 735592012,17.99,154259945800,13 sold,Unbranded,735592012,735592012,N/A,https://www.ebay.co.uk/sch/2021newstart/m.html?_nkw=&_armrs=1&_ipg=&_from=&_udlo=17.890000000000125&_udhi=17.940000000000126&_sop=2&_ipg=200
Front LH Wiper Arm For BMW 5 6 Series E60 E61 E63 E64 7185366 61617185366 NS,17.99,154373790296,1 sold,NewStart,Does Not Apply,61617185366 7185366,N/A,https://www.ebay.co.uk/sch/2021newstart/m.html?_nkw=&_armrs=1&_ipg=&_from=&_udlo=17.890000000000125&_udhi=17.940000000000126&_sop=2&_ipg=200
FOR PEUGEOT FORD Citroën TURBO CHARGER ACTUATOR POSITION SENSOR 0375K1 0375K8 NS,17.99,154382444959,5 sold,NewStart,0375P0,"9658673480, 9662301280, 96456919580, 9682778680, 1231955, 1327582, 1406472, 3M5Q-6K682-BA, 0375P0, 0375J1, 0375K1, 0375K8, 0375K9",N/A,https://www.ebay.co.uk/sch/2021newstart/m.html?_nkw=&_armrs=1&_ipg=&_from=&_udlo=17.890000000000125&_udhi=17.940000000000126&_sop=2&_ipg=200
Rear Tailgate Boot Lid Handle w I-KEY & Camera For Nissan Qashqai J10 2007-14 NS,17.99,154354111161,N/A,NewStart,"90812JD20H, 90812 JD20H, 90812-JD20H, 90810 JD40H","90812JD20H, 90812 JD20H, 90812-JD20H, 90812-JD00H, 90812JD00H, 90812 JD00H, 90812-JD40H, 90812JD40H, 90812 JD40H, Rear Back Boot Panel Lid Trim Tailgate Handle, J10 JJ10",N/A,https://www.ebay.co.uk/sch/2021newstart/m.html?_nkw=&_armrs=1&_ipg=&_from=&_udlo=17.890000000000125&_udhi=17.940000000000126&_sop=2&_ipg=200
For Airsoft Rail Pistol Tactical LED Flashlight Light Laser Sight Torch  Red Dot,17.69,154317170970,17 sold,NewStart,N/A,N/A,Does Not Apply,https://www.ebay.co.uk/sch/2021newstart/m.html?_nkw=&_armrs=1&_ipg=&_from=&_udlo=17.59000000000012&_udhi=17.64000000000012&_sop=2&_ipg=200
For Jaguar XKR style ABS bonnet vents Carbon Look finish For Ford BMW VW audi UK,17.88,154297949710,5 sold,NewStart,Does Not Apply,N/A,N/A,https://www.ebay.co.uk/sch/2021newstart/m.html?_nkw=&_armrs=1&_ipg=&_from=&_udlo=17.740000000000123&_udhi=17.790000000000123&_sop=2&_ipg=200
NEW MERCEDES BENZ W176 W117 X156 W205 W213 DIESEL FUEL FILLER SCREW CAP NS,17.88,154357354610,N/A,NewStart,A2224700105,A2224700105,N/A,https://www.ebay.co.uk/sch/2021newstart/m.html?_nkw=&_armrs=1&_ipg=&_from=&_udlo=17.740000000000123&_udhi=17.790000000000123&_sop=2&_ipg=200
For Audi A3 A4 A5 Q5 Q7 TT 2x Gear Shifter Steering Wheel Shift Extension Paddle,17.48,154317065137,3 sold,NewStart,Gear Shifter  Paddle Audi,N/A,N/A,https://www.ebay.co.uk/sch/2021newstart/m.html?_nkw=&_armrs=1&_ipg=&_from=&_udlo=17.390000000000118&_udhi=17.44000000000012&_sop=2&_ipg=200
Thermostat Housing For Vauxhall Signum Astra G H 1.6 1.8 Meriva Vectra Zafira B,17.59,154308068104,20 sold,NewStart,96984104,"96984104, 96414627, 55578419, 25189205, 55564891",N/A,https://www.ebay.co.uk/sch/2021newstart/m.html?_nkw=&_armrs=1&_ipg=&_from=&_udlo=17.49000000000012&_udhi=17.54000000000012&_sop=2&_ipg=200
1774992 Handbrake Handle Pad Stop Lever Kit For Ford Galaxy S MAX 2006 2007-2015,17.59,154322127491,4 sold,NewStart,1774992,1774992,N/A,https://www.ebay.co.uk/sch/2021newstart/m.html?_nkw=&_armrs=1&_ipg=&_from=&_udlo=17.49000000000012&_udhi=17.54000000000012&_sop=2&_ipg=200
2X NEW BRAKE DRUM SHOES ADJUSTER FORD TRANSIT CONNECT FIESTA PUMA 5039060 NS,17.59,154300388990,4 sold,NewStart,"2T14-2K286-AB , 5039060 , 2T14-2K286-AA , 4387352","4387352, 2T14-2K286-AA, 5039060, 2T14-2K286-AB, 1522225, 2S61-2K286-AB, 2T142K286AA, 2T142K286AB, 2S612K286AB",N/A,https://www.ebay.co.uk/sch/2021newstart/m.html?_nkw=&_armrs=1&_ipg=&_from=&_udlo=17.49000000000012&_udhi=17.54000000000012&_sop=2&_ipg=200
2x Fits Land Rover Freelander Mk1 2.0 TD4 Windscreen Wiper Link Bars Rods Front,17.66,154355829528,3 sold,Newstart,CPLK10/1860,N/A,N/A,https://www.ebay.co.uk/sch/2021newstart/m.html?_nkw=&_armrs=1&_ipg=&_from=&_udlo=17.54000000000012&_udhi=17.59000000000012&_sop=2&_ipg=200
2x Wired Game Controller Gamepad Joypad for Sony PS2 & Playstation UK FAST SHIP,17.25,154299088578,8 sold,Newstart,N/A,N/A,Does not apply,https://www.ebay.co.uk/sch/2021newstart/m.html?_nkw=&_armrs=1&_ipg=&_from=&_udlo=17.140000000000114&_udhi=17.190000000000115&_sop=2&_ipg=200
Replacement Audio Technica AT3600L Cartridge + Black Headshell + Diamond Stylus,17.08,154368645898,4 sold,Universal,N/A,N/A,Turntable headshell,https://www.ebay.co.uk/sch/2021newstart/m.html?_nkw=&_armrs=1&_ipg=&_from=&_udlo=16.990000000000112&_udhi=17.040000000000113&_sop=2&_ipg=200
INJECTOR WIRING LOOM FOR AUDI VW SEAT SKODA FORD 1.9 TDI / PD DIESEL 038971600,16.99,154354235013,11 sold,NewStart,038971600,038971600,N/A,https://www.ebay.co.uk/sch/2021newstart/m.html?_nkw=&_armrs=1&_ipg=&_from=&_udlo=16.89000000000011&_udhi=16.94000000000011&_sop=2&_ipg=200
INJECTOR WIRING LOOM FOR AUDI VW SEAT SKODA FORD 1.9 TDI / PD DIESEL 038971600,16.99,154354235013,11 sold,NewStart,038971600,038971600,N/A,https://www.ebay.co.uk/sch/2021newstart/m.html?_nkw=&_armrs=1&_ipg=&_from=&_udlo=16.94000000000011&_udhi=16.990000000000112&_sop=2&_ipg=200
For BMW Mini Cooper 2007-2014 Smart Remote Key Keyless Entry Fob 868MHz 3 Button,16.99,154385241830,N/A,Feierc,Key  Mhz MINI COOPER,N/A,Does not apply,https://www.ebay.co.uk/sch/2021newstart/m.html?_nkw=&_armrs=1&_ipg=&_from=&_udlo=16.89000000000011&_udhi=16.94000000000011&_sop=2&_ipg=200
Drivers Door Lock Cover with Key Hole For Nissan Juke & Micra 806441KK0D NS,16.99,154297853581,11 sold,NewStart,806441KK0D,N/A,N/A,https://www.ebay.co.uk/sch/2021newstart/m.html?_nkw=&_armrs=1&_ipg=&_from=&_udlo=16.89000000000011&_udhi=16.94000000000011&_sop=2&_ipg=200
For Ford Focus MK2 2004-2012 1355231 Bonnet Release Lock Latch 2 Key Compatible,16.99,154377048394,N/A,Newstart,1355231,N/A,N/A,https://www.ebay.co.uk/sch/2021newstart/m.html?_nkw=&_armrs=1&_ipg=&_from=&_udlo=16.89000000000011&_udhi=16.94000000000011&_sop=2&_ipg=200
FOR Ford S-Max 1.8 TDCi 2006-2014 Leak Off Fuel Pipe Hose with Sensor NS,16.99,154260062621,25 sold,NewStart,Does Not Apply,"4M5Q9K022AG,1521487, 4M5Q-9K022-AG, 4M5Q9K022AG, 1521487, 4M5Q-9K022-AG",N/A,https://www.ebay.co.uk/sch/2021newstart/m.html?_nkw=&_armrs=1&_ipg=&_from=&_udlo=16.94000000000011&_udhi=16.990000000000112&_sop=2&_ipg=200
Carry Case Scratch-proof Protection For Oculus Quest 2 VR Headset Storage Bag UK,16.88,154368667138,17 sold,Newstart,N/A,N/A,Does not apply,https://www.ebay.co.uk/sch/2021newstart/m.html?_nkw=&_armrs=1&_ipg=&_from=&_udlo=16.74000000000011&_udhi=16.79000000000011&_sop=2&_ipg=200
For Bosch-s Tassimo Tas Maker Reusable Coffee Capsule Filter Pod Cup 60ML /180ML,15.48 to 16.48,154319395941,2 sold,NewStart,N/A,N/A,Does Not Apply,https://www.ebay.co.uk/sch/2021newstart/m.html?_nkw=&_armrs=1&_ipg=&_from=&_udlo=16.390000000000104&_udhi=16.440000000000104&_sop=2&_ipg=200
Carry Case Scratch-proof Protection For Oculus Quest 2 VR Headset Storage Bag UK,16.88,154368667138,17 sold,Newstart,N/A,N/A,Does not apply,https://www.ebay.co.uk/sch/2021newstart/m.html?_nkw=&_armrs=1&_ipg=&_from=&_udlo=16.79000000000011&_udhi=16.84000000000011&_sop=2&_ipg=200
CRUISE CONTROL INDICATOR STALK FOR VAUXHALL ASTRA H MK5 ZAFIRA B 13129642 NS,16.88,154300313610,8 sold,NewStart,13129642,"13129642, 24445282, 1241231",N/A,https://www.ebay.co.uk/sch/2021newstart/m.html?_nkw=&_armrs=1&_ipg=&_from=&_udlo=16.74000000000011&_udhi=16.79000000000011&_sop=2&_ipg=200
CRUISE CONTROL INDICATOR STALK FOR VAUXHALL ASTRA H MK5 ZAFIRA B 13129642 NS,16.88,154300313610,8 sold,NewStart,13129642,"13129642, 24445282, 1241231",N/A,https://www.ebay.co.uk/sch/2021newstart/m.html?_nkw=&_armrs=1&_ipg=&_from=&_udlo=16.79000000000011&_udhi=16.84000000000011&_sop=2&_ipg=200
UK Drivers Side Door Double Window Switch For LHD Ford Transit MK8 2014+ NS,16.88,154221403260,5 sold,NewStart,"2029885, 1791339, GK2T 14A132 CA","2029885, 1791339, GK2T 14A132 CA",N/A,https://www.ebay.co.uk/sch/2021newstart/m.html?_nkw=&_armrs=1&_ipg=&_from=&_udlo=16.74000000000011&_udhi=16.79000000000011&_sop=2&_ipg=200
VW Golf MK4 Audi TT A3 S3 Seat Ibiza 1.8T Oil Pump Pickup Pipe Seal 06A115251 NS,16.59,154382469712,1 sold,NewStart,06A115251,N/A,N/A,https://www.ebay.co.uk/sch/2021newstart/m.html?_nkw=&_armrs=1&_ipg=&_from=&_udlo=16.490000000000105&_udhi=16.540000000000106&_sop=2&_ipg=200
UK Drivers Side Door Double Window Switch For LHD Ford Transit MK8 2014+ NS,16.88,154221403260,5 sold,NewStart,"2029885, 1791339, GK2T 14A132 CA","2029885, 1791339, GK2T 14A132 CA",N/A,https://www.ebay.co.uk/sch/2021newstart/m.html?_nkw=&_armrs=1&_ipg=&_from=&_udlo=16.79000000000011&_udhi=16.84000000000011&_sop=2&_ipg=200
2PC Motion Plus Accelerator Remote Controller Adapter Sensor For Nintendo Wii NS,16.29,154246739369,13 sold,NewStart,N/A,N/A,Does not apply,https://www.ebay.co.uk/sch/2021newstart/m.html?_nkw=&_armrs=1&_ipg=&_from=&_udlo=16.1900000000001&_udhi=16.2400000000001&_sop=2&_ipg=200
Complete Set Ignition Switch Door Lock Barrel For VW T4 TRANSPORTER 701837205 UK,16.45,154260077258,19 sold,Unbranded,Does Not Apply,701837205,N/A,https://www.ebay.co.uk/sch/2021newstart/m.html?_nkw=&_armrs=1&_ipg=&_from=&_udlo=16.340000000000103&_udhi=16.390000000000104&_sop=2&_ipg=200
UK Peugeot 107 Citroen C1 & Toyota Aygo Indicator Light Switch Stalk 6253A0 NS,16.29,154318029826,44 sold,NewStart,6253A0,"6253A0, 6253 A0, 6253.A0, 84140-0H010, 84140-0H020, 841400H020, 841400H010",N/A,https://www.ebay.co.uk/sch/2021newstart/m.html?_nkw=&_armrs=1&_ipg=&_from=&_udlo=16.1900000000001&_udhi=16.2400000000001&_sop=2&_ipg=200
For Citroen Berlingo Peugeot Partner Xsara Picasso  Rear Door Lock Barrel Set UK,16.43,154307996573,1 sold,Does not apply,252522,"252522 , 9170.G3 , 9170.CW",N/A,https://www.ebay.co.uk/sch/2021newstart/m.html?_nkw=&_armrs=1&_ipg=&_from=&_udlo=16.340000000000103&_udhi=16.390000000000104&_sop=2&_ipg=200
REPAIR KIT SWIRL FLAPS INLET MANIFOLD KIT 6*32 MM For BMW Diesel M57 X3 X5 3' 5',15.66,154314749658,8 sold,NewStart,11617790198,"Ansaugbrücke, Ansaugbrücken, Brücke, Brücken, Saugrohrklappe, Saugrohrklappen, Saugrohr, Saugrohre, Ansaugrohr, Ansaugkrümmer, Drosselklappe, Klappe, Klappen, Krümmer, Saugbrücke, Saugbrücken, Drallklappe, Drallklappen, Stellmotor, Stellmotoren, Luftklappensteller, Intake Manifold, MANIFOLD GASKETS SWIRL FLAP REPLACEMENT, Manifold Gaskets & Swirl Flap Kit, 11617790198, 11612246945, 11617800585, 11612245439",N/A,https://www.ebay.co.uk/sch/2021newstart/m.html?_nkw=&_armrs=1&_ipg=&_from=&_udlo=15.540000000000092&_udhi=15.590000000000092&_sop=2&_ipg=200
6554QC For Peugeot 207 Citroen C3 Right Driver Side Window Control Switch Button,15.66,154233523401,21 sold,Unbranded,6554.QC,6554QC 6554.QC,N/A,https://www.ebay.co.uk/sch/2021newstart/m.html?_nkw=&_armrs=1&_ipg=&_from=&_udlo=15.640000000000093&_udhi=15.690000000000094&_sop=2&_ipg=200
Oxygen O2 Sensor for Audi A3 A4 A6 A8 TT VW Polo Seat 1.6 1.8 T 2.0 Rear NS,15.88,154340917090,N/A,NewStart,258006422,"0258006422, 0258006460, 0258006423, 0258006489",N/A,https://www.ebay.co.uk/sch/2021newstart/m.html?_nkw=&_armrs=1&_ipg=&_from=&_udlo=15.790000000000095&_udhi=15.840000000000096&_sop=2&_ipg=200
For Range Rover Sport Freelander 2 FAM New Tailgate Boot Release Switch LR020997,15.88,154321891281,16 sold,NewStart,"LR020997,LR042648","LR020997, LR020997G, LR079909, LR002219, LR079909LR, LR042648",N/A,https://www.ebay.co.uk/sch/2021newstart/m.html?_nkw=&_armrs=1&_ipg=&_from=&_udlo=15.790000000000095&_udhi=15.840000000000096&_sop=2&_ipg=200
Electric Window Control Switch Console For Vauxhall ZAFIRA B Mk2 ASTRA H MK5 V A,15.95,154297863448,12 sold,Newstart,13228877,13228877,N/A,https://www.ebay.co.uk/sch/2021newstart/m.html?_nkw=&_armrs=1&_ipg=&_from=&_udlo=15.840000000000096&_udhi=15.890000000000096&_sop=2&_ipg=200
FOR FORD TRANSIT MK7 2.2 TDCi DIESEL INJECTOR SEAL KIT + INJECTOR CLAMP BOLTS NS,15.99,154268900389,36 sold,NewStart,Does Not Apply,"6C1Q-6K780-AB, 6C1Q-9M577-AB, 1372494, 1378433, 6C1Q-9T558-AA, 1795871, 1673999, 6C1Q9T506AC, 1372386",N/A,https://www.ebay.co.uk/sch/2021newstart/m.html?_nkw=&_armrs=1&_ipg=&_from=&_udlo=15.890000000000096&_udhi=15.940000000000097&_sop=2&_ipg=200
UK 433MHz ID83 Chip Replace Remote Fob Key For Ford Focus Mondeo Fiesta 3 Button,16.08,154299124787,7 sold,NewStart,Does Not Apply,N/A,N/A,https://www.ebay.co.uk/sch/2021newstart/m.html?_nkw=&_armrs=1&_ipg=&_from=&_udlo=15.990000000000098&_udhi=16.0400000000001&_sop=2&_ipg=200
NEAR SIDE DOOR LOWER LATCH LOCK CABLE FOR FORD TRANSIT REAR MK6 MK7 2000-2015 LH,15.99,154301670671,15 sold,Newstart,1494102,"YC15-V431A03-AM, 1494102",1494102,https://www.ebay.co.uk/sch/2021newstart/m.html?_nkw=&_armrs=1&_ipg=&_from=&_udlo=15.990000000000098&_udhi=16.0400000000001&_sop=2&_ipg=200
Camshaft Cam Position Solenoid Valve for Vauxhall Astra H J Insignia Vectra NS,15.59,154308098735,3 sold,NewStart,55567050 12992408 1235299,"55567050, 12992408, 1235299, 12992408 012992408 01235299 1235299 6235597, VARIABLE TIMING CONTROL SOLENOID VALVE TIMING, VANOS CAMSHAFT ADJUSTMENT VVT NEW OE OEM, VARIABLE TIMING CONTROL VALVE SOLENOID VVT OIL, TOP  VANOS CAMSHAFT CAM SHAFT VALVETRONIC, SOLV INLET INTAKE EXHAUST DEPHASER ADJUSTER, PHASER ELECTRIC HYDRAULIC, 71 744 383, 55 567 050, 12 992 408, 12 35 299,, 62 35 597, 71744383, 01235299, 012992408",N/A,https://www.ebay.co.uk/sch/2021newstart/m.html?_nkw=&_armrs=1&_ipg=&_from=&_udlo=15.540000000000092&_udhi=15.590000000000092&_sop=2&_ipg=200
New Windscreen Washer Pump For Saab 93 9-3 2004-12 12826943 12802440 12782867 UK,15.75,154340794145,N/A,Newstart,12826943 12802440 12782867,"12826943, 12802440, 12782867",N/A,https://www.ebay.co.uk/sch/2021newstart/m.html?_nkw=&_armrs=1&_ipg=&_from=&_udlo=15.640000000000093&_udhi=15.690000000000094&_sop=2&_ipg=200
For A3 8P ARM REST Armrest Lid Cover W/Latch Clip Catch Centre Console 8P0864245,15.75,154248582184,6 sold,Unbranded,8P0864245,"8P0864245P, 8P0864245",N/A,https://www.ebay.co.uk/sch/2021newstart/m.html?_nkw=&_armrs=1&_ipg=&_from=&_udlo=15.640000000000093&_udhi=15.690000000000094&_sop=2&_ipg=200
4 Wires Oxygen Lambda O2 Sensor Probe For Vauxhall Opel Corsa C D 1.0 1.2 1.4 NS,15.88,154246944167,37 sold,NewStart,Mml4256994,09199470,N/A,https://www.ebay.co.uk/sch/2021newstart/m.html?_nkw=&_armrs=1&_ipg=&_from=&_udlo=15.790000000000095&_udhi=15.840000000000096&_sop=2&_ipg=200
Barn Door High Level LED 3rd Rear Stop Brake Light For VW Transporter T5 T6 NS,15.88,154289975714,17 sold,NewStart,Does Not Apply,N/A,N/A,https://www.ebay.co.uk/sch/2021newstart/m.html?_nkw=&_armrs=1&_ipg=&_from=&_udlo=15.790000000000095&_udhi=15.840000000000096&_sop=2&_ipg=200
3 Button 433Mhz Remote Flip Key For Land Rover Discovery 3 Range Rover Sport Fob,15.99,154345042882,N/A,Newstart,Key MHZ Land Rover,N/A,Does not apply,https://www.ebay.co.uk/sch/2021newstart/m.html?_nkw=&_armrs=1&_ipg=&_from=&_udlo=15.890000000000096&_udhi=15.940000000000097&_sop=2&_ipg=200
For Nissan Qashqai 2006 Airbag Squib Clock Spring Sensor Spiral Cable 2 Plugs NS,15.99,154318398009,10 sold,Aftermarket Branded,25560-JD003,"25560-JD003, 25560JD003",N/A,https://www.ebay.co.uk/sch/2021newstart/m.html?_nkw=&_armrs=1&_ipg=&_from=&_udlo=15.890000000000096&_udhi=15.940000000000097&_sop=2&_ipg=200
For Bosch-s Tassimo Tas Maker Reusable Coffee Capsule Filter Pod Cup 60ML /180ML,15.48 to 16.48,154319395941,2 sold,NewStart,N/A,N/A,Does Not Apply,https://www.ebay.co.uk/sch/2021newstart/m.html?_nkw=&_armrs=1&_ipg=&_from=&_udlo=15.39000000000009&_udhi=15.44000000000009&_sop=2&_ipg=200
Air Heater Parking Controller Board Motherboard for 3-5KW 12V 24V Diesel,15.29,154287259122,3 sold,NewStart,Does Not Apply,N/A,does not apply,https://www.ebay.co.uk/sch/2021newstart/m.html?_nkw=&_armrs=1&_ipg=&_from=&_udlo=15.190000000000087&_udhi=15.240000000000087&_sop=2&_ipg=200
Electric Window Switch Console For Mercedes Benz Sprinter VW Crafter 2006-2015UK,15.35,154385397404,1 sold,NewStart,9065451513,9065451513,N/A,https://www.ebay.co.uk/sch/2021newstart/m.html?_nkw=&_armrs=1&_ipg=&_from=&_udlo=15.240000000000087&_udhi=15.290000000000088&_sop=2&_ipg=200
2x Dynamic Indicator LED Repeater Side Light For OPEL VAUXHALL Astra J Zafira NS,15.29,154265716191,19 sold,NewStart,"13491088, 13491089, 1713004, 1713005, 13273103, 13",N/A,N/A,https://www.ebay.co.uk/sch/2021newstart/m.html?_nkw=&_armrs=1&_ipg=&_from=&_udlo=15.190000000000087&_udhi=15.240000000000087&_sop=2&_ipg=200
For Vauxhall Adam Astra Corsa D Meriva Thermostat Housing With Sensor #25192985,15.35,154318384719,5 sold,NewStart,25192985,25192985 55562048,N/A,https://www.ebay.co.uk/sch/2021newstart/m.html?_nkw=&_armrs=1&_ipg=&_from=&_udlo=15.240000000000087&_udhi=15.290000000000088&_sop=2&_ipg=200
Right Electric Window For Iveco Daily IV/V Front Double Switch Buttons #69500480,15.46,154376972964,1 sold,Newstart,"5801304490,69500480","5801304490,69500480",N/A,https://www.ebay.co.uk/sch/2021newstart/m.html?_nkw=&_armrs=1&_ipg=&_from=&_udlo=15.340000000000089&_udhi=15.39000000000009&_sop=2&_ipg=200
For BMW 1 3 5 7 Series E46 E81 E87 E90 E91 Z4 Sump Pan Engine Oil Level Sensor A,15.45,154260012577,6 sold,Newstart,"12617508003,12611439810","12617508003, 12611439810, 12611433596, LSB102970, LSB102970L",N/A,https://www.ebay.co.uk/sch/2021newstart/m.html?_nkw=&_armrs=1&_ipg=&_from=&_udlo=15.340000000000089&_udhi=15.39000000000009&_sop=2&_ipg=200
Camshaft Cam Position Solenoid Valve for Vauxhall Astra H J Insignia Vectra NS,15.59,154308098735,3 sold,NewStart,55567050 12992408 1235299,"55567050, 12992408, 1235299, 12992408 012992408 01235299 1235299 6235597, VARIABLE TIMING CONTROL SOLENOID VALVE TIMING, VANOS CAMSHAFT ADJUSTMENT VVT NEW OE OEM, VARIABLE TIMING CONTROL VALVE SOLENOID VVT OIL, TOP  VANOS CAMSHAFT CAM SHAFT VALVETRONIC, SOLV INLET INTAKE EXHAUST DEPHASER ADJUSTER, PHASER ELECTRIC HYDRAULIC, 71 744 383, 55 567 050, 12 992 408, 12 35 299,, 62 35 597, 71744383, 01235299, 012992408",N/A,https://www.ebay.co.uk/sch/2021newstart/m.html?_nkw=&_armrs=1&_ipg=&_from=&_udlo=15.49000000000009&_udhi=15.540000000000092&_sop=2&_ipg=200
For Truck SUV 12V Recovery Wireless Winch Remote Control 2 Handset Switch UK,15.45,154310640079,N/A,NewStart,ALU1159721,N/A,ALU1159721,https://www.ebay.co.uk/sch/2021newstart/m.html?_nkw=&_armrs=1&_ipg=&_from=&_udlo=15.340000000000089&_udhi=15.39000000000009&_sop=2&_ipg=200
2pcs For Land Rover Defender 90 110 Smoked Side Indicator LED Repeater Light,15.48,154310670082,3 sold,NewStart,"XGB000030, XGB100310",N/A,N/A,https://www.ebay.co.uk/sch/2021newstart/m.html?_nkw=&_armrs=1&_ipg=&_from=&_udlo=15.39000000000009&_udhi=15.44000000000009&_sop=2&_ipg=200
IGNITION COIL FITS STIHL for MS171 MS181 MS211 CHAINSAWS 1139 400 1307,15.58,154363531594,N/A,NewStart,N/A,N/A,1139 400 1307,https://www.ebay.co.uk/sch/2021newstart/m.html?_nkw=&_armrs=1&_ipg=&_from=&_udlo=15.49000000000009&_udhi=15.540000000000092&_sop=2&_ipg=200
NS Focus RS MK2 style ABS plastic bonnet vents *FORD PROFILE* universal Exact OE,15.59,154373484379,3 sold,NewStart,Does Not Apply,N/A,N/A,https://www.ebay.co.uk/sch/2021newstart/m.html?_nkw=&_armrs=1&_ipg=&_from=&_udlo=15.49000000000009&_udhi=15.540000000000092&_sop=2&_ipg=200
Front Electric Window Mirror Switch 96351622XT Driver Side For Peugeot 307 00-05,14.99,154249981037,5 sold,Newstart,96351622XT,96351622XT,yro8377974,https://www.ebay.co.uk/sch/2021newstart/m.html?_nkw=&_armrs=1&_ipg=&_from=&_udlo=14.890000000000082&_udhi=14.940000000000083&_sop=2&_ipg=200
For MAZDA 323F & BONGO 94-98 Right Electric Power Window Switch Driver Side NS,14.99,154345020164,7 sold,NewStart,mbz2353746,"S09A-66-350A09,IWSMZ008,513782RD",N/A,https://www.ebay.co.uk/sch/2021newstart/m.html?_nkw=&_armrs=1&_ipg=&_from=&_udlo=14.940000000000083&_udhi=14.990000000000084&_sop=2&_ipg=200
For MAZDA 323F & BONGO 94-98 Right Electric Power Window Switch Driver Side NS,14.99,154345020164,7 sold,NewStart,mbz2353746,"S09A-66-350A09,IWSMZ008,513782RD",N/A,https://www.ebay.co.uk/sch/2021newstart/m.html?_nkw=&_armrs=1&_ipg=&_from=&_udlo=14.990000000000084&_udhi=15.040000000000084&_sop=2&_ipg=200
New For Ford Transit MK8 Wing Mirror Indicator Clear Lens Cover Left Right Pair,14.85,154248705557,37 sold,Unbranded,FH3321198,"BK31-13B382-AB, BK3113B382AB, 1847387, 1847389",N/A,https://www.ebay.co.uk/sch/2021newstart/m.html?_nkw=&_armrs=1&_ipg=&_from=&_udlo=14.74000000000008&_udhi=14.79000000000008&_sop=2&_ipg=200
Release Lock Actuator Motor Fuel Flap Door For Audi A3 A6 A7 C7 Q3 Q7 4L0862153D,14.88,154265601088,22 sold,NewStart,4L0 862 153 D / A / B / C,"4L0862153D , 4L0862153A , 4L0862153B, 4L0-862-153-D , 4L0-862-153-A , 4L0-862-153-B",N/A,https://www.ebay.co.uk/sch/2021newstart/m.html?_nkw=&_armrs=1&_ipg=&_from=&_udlo=14.79000000000008&_udhi=14.840000000000082&_sop=2&_ipg=200
