Item Title,Item Price,Item ID,Number Sold,Brand,Manufacturer Part Number,Reference OE/OEM Number,MPN,Reference
New For Audi A3 A4 Q7 Rear Wiper Washer Nozzle Spray Jet Black UK Ship 8E9955985,3.99,154367313731,36 sold,Newstart,"8E9955985, 8K9955985A","8E9955985, 8K9955985A",N/A,https://www.ebay.co.uk/sch/2021newstart/m.html?_nkw=&_armrs=1&_ipg=&_from=&_udlo=3.9399999999999995&_udhi=3.9899999999999993&_sop=2&_ipg=200
12 x Channel Windows Wind Rain Deflectors for Clip Replacement for Heko G3 NS,4.99,154246897133,105 sold,NewStart,Does Not Apply,N/A,N/A,https://www.ebay.co.uk/sch/2021newstart/m.html?_nkw=&_armrs=1&_ipg=&_from=&_udlo=4.939999999999996&_udhi=4.989999999999996&_sop=2&_ipg=200
8x For Heko G3 Clips Wind Rain Deflector Car Channel Metal Retaining Clip NS,3.88,154246878517,59 sold,NewStart,Does not apply,N/A,N/A,https://www.ebay.co.uk/sch/2021newstart/m.html?_nkw=&_armrs=1&_ipg=&_from=&_udlo=3.84&_udhi=3.8899999999999997&_sop=2&_ipg=200
12 x Channel Windows Wind Rain Deflectors for Clip Replacement for Heko G3 NS,4.99,154246897133,105 sold,NewStart,Does Not Apply,N/A,N/A,https://www.ebay.co.uk/sch/2021newstart/m.html?_nkw=&_armrs=1&_ipg=&_from=&_udlo=4.989999999999996&_udhi=5.039999999999996&_sop=2&_ipg=200
3rd Brake Coupe Convertible Rear Light For BMW E88 E82 1 Series 63257164978 NS,26.29,154296672164,28 sold,NewStart,Does Not Apply,63257164978,N/A,https://www.ebay.co.uk/sch/2021newstart/m.html?_nkw=&_armrs=1&_ipg=&_from=&_udlo=26.140000000000242&_udhi=26.190000000000243&_sop=2&_ipg=200
2pcs Variable Timing Control Solenoid valve For BMW 1 3 5 6 7 #11367560462 UK,26.48,154318375056,4 sold,Newstart,11367560462,"11367560462 , 11360410035, N40 N42 N45 N46 N62 engine",N/A,https://www.ebay.co.uk/sch/2021newstart/m.html?_nkw=&_armrs=1&_ipg=&_from=&_udlo=26.340000000000245&_udhi=26.390000000000246&_sop=2&_ipg=200
Hazard warning light switch lock button for Ford fiesta focus kuga NS,26.59,154301335595,10 sold,NewStart,1519127,1690881,N/A,https://www.ebay.co.uk/sch/2021newstart/m.html?_nkw=&_armrs=1&_ipg=&_from=&_udlo=26.440000000000246&_udhi=26.490000000000247&_sop=2&_ipg=200
Genuine Sony PlayStation 4 Pin PS4-ADP-240CR Power Supply Unit PSU UK Fast Ship,44.88,154357512504,N/A,Newstart,N/A,N/A,Does Not Apply,https://www.ebay.co.uk/sch/2021newstart/m.html?_nkw=&_armrs=1&_ipg=&_from=&_udlo=44.63999999999961&_udhi=44.68999999999961&_sop=2&_ipg=200
For Dewalt DCB102 10.8V~20V Lithium Battery Charging USB Phone Charger Tool UK A,49.66,154310623612,8 sold,Newstart,N/A,N/A,Does Not Apply,https://www.ebay.co.uk/sch/2021newstart/m.html?_nkw=&_armrs=1&_ipg=&_from=&_udlo=49.38999999999934&_udhi=49.43999999999934&_sop=2&_ipg=200
Green Laser Level Self Leveling Cross Measure Remote 16 Line 4D 360° Rotary NS,71.59,154318079958,10 sold,Newstart,N/A,N/A,N/A,https://www.ebay.co.uk/sch/2021newstart/m.html?_nkw=&_armrs=1&_ipg=&_from=&_udlo=71.18999999999811&_udhi=71.2399999999981&_sop=2&_ipg=200
NEW ELECTRONIC ACTUATOR FOR FORD TRANSIT 2.2 RWD G-88 FITS 787556 NS,57.99,154357402665,N/A,NewStart,G88,"767646, G88",G88,https://www.ebay.co.uk/sch/2021newstart/m.html?_nkw=&_armrs=1&_ipg=&_from=&_udlo=57.68999999999887&_udhi=57.739999999998865&_sop=2&_ipg=200
NEW ELECTRONIC ACTUATOR FOR FORD TRANSIT 2.2 RWD G-88 787556 *UK SELLER* NS,55.99,154364917514,N/A,NewStart,G88,"767646, G88",G88,https://www.ebay.co.uk/sch/2021newstart/m.html?_nkw=&_armrs=1&_ipg=&_from=&_udlo=55.68999999999898&_udhi=55.73999999999898&_sop=2&_ipg=200
UK Xenon Headlight Driver Module Adaptive For BMW 5 Series F10 520d 530d 525d NS,54.99,154321802197,12 sold,NewStart,7316217,"7329157, 7316217, 7316217, 7316217, 7279625, 7274400, 7267044, 63117329157, 63117316217, 63117305235, 63117304905, 63117279625, 63117274400, 63117267044, lear, ahl, 8995106, 5352118A7, 535211807, 63117304906, 7304906 , 636061807, 63117269531, 7269531, 63117316208, 532386807",N/A,https://www.ebay.co.uk/sch/2021newstart/m.html?_nkw=&_armrs=1&_ipg=&_from=&_udlo=54.68999999999904&_udhi=54.739999999999036&_sop=2&_ipg=200
A1647400635 Lock Actuator For Mercedes Benz 04-11 ML320 350 Tailgate UK FAST SHI,50.99,154319581082,N/A,Newstart,A1647400635,"A1647400635,A2117400136,2117400235",N/A,https://www.ebay.co.uk/sch/2021newstart/m.html?_nkw=&_armrs=1&_ipg=&_from=&_udlo=50.689999999999266&_udhi=50.73999999999926&_sop=2&_ipg=200
For BMW 5 Series F10 F10N 528i 550i 535i Pair Rear Trunk Shock Lid Return Spring,49.99,154243869779,8 sold,Unbranded,"51247204366, 51247204367","51247204366, 51247204367",N/A,https://www.ebay.co.uk/sch/2021newstart/m.html?_nkw=&_armrs=1&_ipg=&_from=&_udlo=49.68999999999932&_udhi=49.73999999999932&_sop=2&_ipg=200
For BMW 5 Series F10 F10N 528i 550i 535i Pair Rear Trunk Shock Lid Return Spring,49.99,154243869779,8 sold,Unbranded,"51247204366, 51247204367","51247204366, 51247204367",N/A,https://www.ebay.co.uk/sch/2021newstart/m.html?_nkw=&_armrs=1&_ipg=&_from=&_udlo=49.73999999999932&_udhi=49.78999999999932&_sop=2&_ipg=200
Right  Passenger Side Electric Complete Wing Mirror for Nissan NV200 2010 -2016,49.99,154265699554,3 sold,NewStart,Does Not Apply,N/A,N/A,https://www.ebay.co.uk/sch/2021newstart/m.html?_nkw=&_armrs=1&_ipg=&_from=&_udlo=49.68999999999932&_udhi=49.73999999999932&_sop=2&_ipg=200
Right  Passenger Side Electric Complete Wing Mirror for Nissan NV200 2010 -2016,49.99,154265699554,3 sold,NewStart,Does Not Apply,N/A,N/A,https://www.ebay.co.uk/sch/2021newstart/m.html?_nkw=&_armrs=1&_ipg=&_from=&_udlo=49.73999999999932&_udhi=49.78999999999932&_sop=2&_ipg=200
FOR Ford Transit 2.2 TDCi Turbocharger Electronic Turbo Actuator Wastegate G-59,47.99,154368530476,2 sold,NewStart,786880-0006,"Garrett, Hella, G-59, G-059, G59, G059, 786880-5006S, BK2Q6K682GA, BK2Q-6K682-CA, BK2Q6K682CA, 767649, 6NW009550",N/A,https://www.ebay.co.uk/sch/2021newstart/m.html?_nkw=&_armrs=1&_ipg=&_from=&_udlo=47.739999999999434&_udhi=47.78999999999943&_sop=2&_ipg=200
Voltage Converter Control Unit for Mercedes Benz W205 CLS350 A2054400073 NS,33.59,154310510480,7 sold,NewStart,Does Not Apply,"voltage transformer converter, FOR MERCEDES BENZ, W205 W253 C class E CLASS auxiliary battery, 2054400073, 2059052809, 2059053414, A2054400073, A2059052809, A2059053414, 205 905 28 09, 205 905 34 14, Voltage Converter Module, Transformer Control Unit",N/A,https://www.ebay.co.uk/sch/2021newstart/m.html?_nkw=&_armrs=1&_ipg=&_from=&_udlo=33.54000000000024&_udhi=33.59000000000024&_sop=2&_ipg=200
D2S/D2R Xenon Headlight Ballast For Ford Mondeo MK3 Mercedes-Benz #1307329082 NS,27.28,154327434571,2 sold,NewStart,"1307329082, 10053006","1307329074, 1307329066, 1307329082, 1307329072, 1307329060, 1307329088, 1307329068, 1307329064, 1307329096, 1307329086, 1307329090, 1307329073, 1307329053, balast, zenon, AL",N/A,https://www.ebay.co.uk/sch/2021newstart/m.html?_nkw=&_armrs=1&_ipg=&_from=&_udlo=27.090000000000256&_udhi=27.140000000000256&_sop=2&_ipg=200
Voltage Converter Control Unit for Mercedes Benz W205 CLS350 A2054400073 NS,33.59,154310510480,7 sold,NewStart,Does Not Apply,"voltage transformer converter, FOR MERCEDES BENZ, W205 W253 C class E CLASS auxiliary battery, 2054400073, 2059052809, 2059053414, A2054400073, A2059052809, A2059053414, 205 905 28 09, 205 905 34 14, Voltage Converter Module, Transformer Control Unit",N/A,https://www.ebay.co.uk/sch/2021newstart/m.html?_nkw=&_armrs=1&_ipg=&_from=&_udlo=33.39000000000025&_udhi=33.440000000000246&_sop=2&_ipg=200
2X Parcel Shelf Tray Cover string strap rope clips For FORD FOCUS MK3 2011-18 NS,4.99,154343488482,4 sold,NewStart,Does Not Apply,4M51A46538AB,N/A,https://www.ebay.co.uk/sch/2021newstart/m.html?_nkw=&_armrs=1&_ipg=&_from=&_udlo=4.939999999999996&_udhi=4.989999999999996&_sop=2&_ipg=200
For VW Audi Seat Skoda Diesel AZV BKD Injector Wiring Loom Harness 03G971033L UK,30.99,154375414698,N/A,Newstart,03G971033L,03G971033L,N/A,https://www.ebay.co.uk/sch/2021newstart/m.html?_nkw=&_armrs=1&_ipg=&_from=&_udlo=30.79000000000031&_udhi=30.84000000000031&_sop=2&_ipg=200
Xenon Headlight Ballast Control Unit Module 5DV009720-00 For Vauxhall 2013 CD UK,29.47,154314797366,10 sold,NewStart,5DV009720-00,"12 32 335, 13278005, 5DV00972000, 5DV009720001, 5DV009720",N/A,https://www.ebay.co.uk/sch/2021newstart/m.html?_nkw=&_armrs=1&_ipg=&_from=&_udlo=30.540000000000305&_udhi=30.590000000000305&_sop=2&_ipg=200
Xenon Headlight Ballast Control Unit Module 5DV009720-00 For Vauxhall 2013 CD UK,29.47,154314797366,10 sold,NewStart,5DV009720-00,"12 32 335, 13278005, 5DV00972000, 5DV009720001, 5DV009720",N/A,https://www.ebay.co.uk/sch/2021newstart/m.html?_nkw=&_armrs=1&_ipg=&_from=&_udlo=30.490000000000304&_udhi=30.540000000000305&_sop=2&_ipg=200
Dynamic Wing Mirror Indicator LED Turn Signal Light For Mercedes Benz W205 W213,29.88,154310629947,8 sold,NewStart,Does Not Apply,N/A,Does Not Apply,https://www.ebay.co.uk/sch/2021newstart/m.html?_nkw=&_armrs=1&_ipg=&_from=&_udlo=29.690000000000293&_udhi=29.740000000000293&_sop=2&_ipg=200
Lock & 2 Key Rear Tailgate Door Handle BarreL For VW T4 Transporter 1990-2003,29.99,154390300905,N/A,NewStart,703829239E,"703829239E, T4 DOOR HANDLE TAILGATE",N/A,https://www.ebay.co.uk/sch/2021newstart/m.html?_nkw=&_armrs=1&_ipg=&_from=&_udlo=29.790000000000294&_udhi=29.840000000000295&_sop=2&_ipg=200
Lock & 2 Key Rear Tailgate Door Handle BarreL For VW T4 Transporter 1990-2003,29.99,154390300905,N/A,NewStart,703829239E,"703829239E, T4 DOOR HANDLE TAILGATE",N/A,https://www.ebay.co.uk/sch/2021newstart/m.html?_nkw=&_armrs=1&_ipg=&_from=&_udlo=29.840000000000295&_udhi=29.890000000000295&_sop=2&_ipg=200
2x Dynamic Side Mirror Turn Signal LED Indicator Lights Fit For BMW F30 F31 NS,28.99,154243818652,36 sold,NewStart,60 Led Sequential Indicator,"X1 E84, technology, swiping, Smoked, Sequential Wing Mirror, Led, Indicator, GT, F36, F35, F34, F33, F32, F31, F22, F21, F20, Dynamic, Cree, Bmw, Amber, 4 Series, 3 Series, 2013, 2012, 2 Series, 1 Series",N/A,https://www.ebay.co.uk/sch/2021newstart/m.html?_nkw=&_armrs=1&_ipg=&_from=&_udlo=28.84000000000028&_udhi=28.89000000000028&_sop=2&_ipg=200
4Pcs TPMS Tyre Pressure Sensor For Ford Focus Fiesta EV6T-1A180-DB EV6T-1A180-DC,28.99,154342116948,5 sold,NewStart,Does Not Apply,"2036832 EV6T-1A150-DB EV6T-1A180-DB EV6T-1A180-DC, EV6T-1A180-DB, EV6T-1A180-DC",N/A,https://www.ebay.co.uk/sch/2021newstart/m.html?_nkw=&_armrs=1&_ipg=&_from=&_udlo=28.84000000000028&_udhi=28.89000000000028&_sop=2&_ipg=200
UPPER TAILGATE LATCH ACTUATOR w CABLE FOR LAND ROVER DISCOVERY 3/4 LR017470 NS,28.59,154300078643,3 sold,NewStart,/,"LR017470, FQR500080, FQR500220",N/A,https://www.ebay.co.uk/sch/2021newstart/m.html?_nkw=&_armrs=1&_ipg=&_from=&_udlo=28.440000000000275&_udhi=28.490000000000276&_sop=2&_ipg=200
LED Rear Boot Black Smoked Third Brake Stop Light For 07-13 BMW E82 E88 M Coupe,28.35,154296695598,8 sold,NewStart,"63257164978, 7164978","63257164978, 7164978",N/A,https://www.ebay.co.uk/sch/2021newstart/m.html?_nkw=&_armrs=1&_ipg=&_from=&_udlo=28.19000000000027&_udhi=28.240000000000272&_sop=2&_ipg=200
2 in 1 TS808 Tube Screamer TS9 Overdrive Distortion Handmade Guitar Effect Pedal,28.66,154297819042,8 sold,Newstart,N/A,N/A,Does Not Apply,https://www.ebay.co.uk/sch/2021newstart/m.html?_nkw=&_armrs=1&_ipg=&_from=&_udlo=28.490000000000276&_udhi=28.540000000000276&_sop=2&_ipg=200
Pair Gloss Black Wing Mirror Cover Replacement For BMW 1 2 3 4 Series F20 F21 NS,27.99,154336671203,2 sold,NewStart,Does Not Apply,N/A,N/A,https://www.ebay.co.uk/sch/2021newstart/m.html?_nkw=&_armrs=1&_ipg=&_from=&_udlo=27.840000000000266&_udhi=27.890000000000267&_sop=2&_ipg=200
Dynamic LED Rearview Mirror Indicator Turn Signal Lights For Audi A4 A5 B8.5 NS,28.29,154297650914,14 sold,NewStart,Does Not Apply,"8K0949102C,8K0949102D, 8K0949102",N/A,https://www.ebay.co.uk/sch/2021newstart/m.html?_nkw=&_armrs=1&_ipg=&_from=&_udlo=28.14000000000027&_udhi=28.19000000000027&_sop=2&_ipg=200
Bonnet Release Lock Latch 2 Key 1343577 Fit FORD FOCUS MK2 Repair Set Kit 04-12/,26.88,154255045891,40 sold,Unbranded,Does Not Apply,N/A,N/A,https://www.ebay.co.uk/sch/2021newstart/m.html?_nkw=&_armrs=1&_ipg=&_from=&_udlo=26.74000000000025&_udhi=26.79000000000025&_sop=2&_ipg=200
D2S/D2R Xenon Headlight Ballast For Ford Mondeo MK3 Mercedes-Benz #1307329082 NS,27.28,154327434571,2 sold,NewStart,"1307329082, 10053006","1307329074, 1307329066, 1307329082, 1307329072, 1307329060, 1307329088, 1307329068, 1307329064, 1307329096, 1307329086, 1307329090, 1307329073, 1307329053, balast, zenon, AL",N/A,https://www.ebay.co.uk/sch/2021newstart/m.html?_nkw=&_armrs=1&_ipg=&_from=&_udlo=27.140000000000256&_udhi=27.190000000000257&_sop=2&_ipg=200
Bonnet Release Lock Latch 2 Key 1343577 Fit FORD FOCUS MK2 Repair Set Kit 04-12/,26.88,154255045891,40 sold,Unbranded,Does Not Apply,N/A,N/A,https://www.ebay.co.uk/sch/2021newstart/m.html?_nkw=&_armrs=1&_ipg=&_from=&_udlo=26.69000000000025&_udhi=26.74000000000025&_sop=2&_ipg=200
For Volvo S80 2007-2013 Dynamic Turn Signal Lights Side Mirror Indicator Lamp NS,26.99,154268840977,7 sold,NewStart,Does Not Apply,N/A,Does Not Apply,https://www.ebay.co.uk/sch/2021newstart/m.html?_nkw=&_armrs=1&_ipg=&_from=&_udlo=26.840000000000252&_udhi=26.890000000000253&_sop=2&_ipg=200
Ignition Barrel Lock Switch & 2 Keys For Peugeot Boxer Citroen Relay Fiat Ducato,25.99,154310566032,10 sold,NewStart,1348421080,"1608501280, 1348421080 1361031080 1371429080, 4162SJ, 1371430080",HaQ1483692,https://www.ebay.co.uk/sch/2021newstart/m.html?_nkw=&_armrs=1&_ipg=&_from=&_udlo=25.840000000000238&_udhi=25.89000000000024&_sop=2&_ipg=200
LED High Level Brake Light Lamp Red Lens For BMW Z4 E85 2002-08 63256930246 NS,25.59,154297777883,2 sold,NewStart,"63256930246, 63256917378","63256930246, 63256917378",N/A,https://www.ebay.co.uk/sch/2021newstart/m.html?_nkw=&_armrs=1&_ipg=&_from=&_udlo=25.440000000000232&_udhi=25.490000000000233&_sop=2&_ipg=200
Left Sliding Door Handle&Handle Holder 806069981R LH Side For Renault Master MK3,25.45,154375406630,15 sold,NewStart,806069981R,806069981R 806067794R 806073022R 806075963R,N/A,https://www.ebay.co.uk/sch/2021newstart/m.html?_nkw=&_armrs=1&_ipg=&_from=&_udlo=25.29000000000023&_udhi=25.34000000000023&_sop=2&_ipg=200
55202704 EGR Cooler Elbow Pipe For Saab 9-3 9-5 Vauxhall Astra Zafira 1.9 NS,25.29,154372410728,3 sold,NewStart,55202704,55202704,N/A,https://www.ebay.co.uk/sch/2021newstart/m.html?_nkw=&_armrs=1&_ipg=&_from=&_udlo=25.140000000000228&_udhi=25.19000000000023&_sop=2&_ipg=200
Dynamic LED Side Repeater Indicator LIght Lamp For FORD FIESTA MK8 2019 2020+ NS,24.99,154322090957,1 sold,NewStart,Does Not Apply,N/A,YvU2895212,https://www.ebay.co.uk/sch/2021newstart/m.html?_nkw=&_armrs=1&_ipg=&_from=&_udlo=24.990000000000226&_udhi=25.040000000000227&_sop=2&_ipg=200
"Xiaomi M365 PRO motherboard, UK stock fast dispatch, no nonsence 48h service",24.99,154376838083,1 sold,Newstart,N/A,N/A,Does Not Apply,https://www.ebay.co.uk/sch/2021newstart/m.html?_nkw=&_armrs=1&_ipg=&_from=&_udlo=24.840000000000224&_udhi=24.890000000000224&_sop=2&_ipg=200
Side Mirror Dynamic LED Indicator Turn Signal Lights For Ford Everest Ranger T6,24.99,154268919559,9 sold,NewStart,Does Not Apply,N/A,Does Not Apply,https://www.ebay.co.uk/sch/2021newstart/m.html?_nkw=&_armrs=1&_ipg=&_from=&_udlo=24.840000000000224&_udhi=24.890000000000224&_sop=2&_ipg=200
For VW Golf 2.0T FSI GTI 2.0 FSI 2.0 TFSI Fuel Pump Cam Follower Tappet O-ring,24.99,154376615077,2 sold,NewStart,06D109309C / 06D 109 309 C,"WHT005184 / WHT 005 184 Elring, N91089601 / N 910 896 01 Audi",N/A,https://www.ebay.co.uk/sch/2021newstart/m.html?_nkw=&_armrs=1&_ipg=&_from=&_udlo=24.840000000000224&_udhi=24.890000000000224&_sop=2&_ipg=200
Dynamic LED Side Repeater Indicator LIght Lamp For FORD FIESTA MK8 2019 2020+ NS,24.99,154322090957,1 sold,NewStart,Does Not Apply,N/A,YvU2895212,https://www.ebay.co.uk/sch/2021newstart/m.html?_nkw=&_armrs=1&_ipg=&_from=&_udlo=24.840000000000224&_udhi=24.890000000000224&_sop=2&_ipg=200
INDICATOR STALK HEADLIGHT SWITCH HEADLAMP FOR RENAULT CLIO MK3 KANGOO MODUS NS,24.88,154256455842,2 sold,NewStart,"7701057088, 7701057089, 7701057090, 8201590638","7701057088, 7701057089, 7701057090, 8201590638",N/A,https://www.ebay.co.uk/sch/2021newstart/m.html?_nkw=&_armrs=1&_ipg=&_from=&_udlo=24.740000000000222&_udhi=24.790000000000223&_sop=2&_ipg=200
For Audi MK2 TT 2007-2014 Rear 3RD LED High Level Brake Light Lamp #8J0945097 UK,23.99,154221351249,13 sold,Unbranded/Generic,"8J0945097, 8J0 945 097","8J0945097, 8J0 945 097","8J0945097, 8J0 945 097",https://www.ebay.co.uk/sch/2021newstart/m.html?_nkw=&_armrs=1&_ipg=&_from=&_udlo=23.84000000000021&_udhi=23.89000000000021&_sop=2&_ipg=200
New Turn Indicator Light For Mercedes W204 C-Class 07-11 Driver Passenger Mirror,23.88,154265849240,5 sold,Unbranded,"A2048200721, A2048200821","A2048200721, A2048200821","A2048200721, A2048200821",https://www.ebay.co.uk/sch/2021newstart/m.html?_nkw=&_armrs=1&_ipg=&_from=&_udlo=23.740000000000208&_udhi=23.79000000000021&_sop=2&_ipg=200
01287358 7731000001 12V Universal Windscreen Wiper Motor fit Willys Jeep Tractor,23.35,154319424640,6 sold,NewStart,"01287358,7731000001,0390506510","01287358,7731000001,0390506510",N/A,https://www.ebay.co.uk/sch/2021newstart/m.html?_nkw=&_armrs=1&_ipg=&_from=&_udlo=23.1900000000002&_udhi=23.2400000000002&_sop=2&_ipg=200
BOOT TAILGATE OPENING SWITCH FOR NISSAN MICRA 02-10 K12 25380AX60B NS,23.88,154237069329,25 sold,NewStart,25380AX60B,25380-AX60B,N/A,https://www.ebay.co.uk/sch/2021newstart/m.html?_nkw=&_armrs=1&_ipg=&_from=&_udlo=23.84000000000021&_udhi=23.89000000000021&_sop=2&_ipg=200
Front Center Console Water Cup Holder Grey Color For BMW E46 3Series 1998-06 NS,23.59,154338186650,3 sold,NewStart,Does not apply,N/A,N/A,https://www.ebay.co.uk/sch/2021newstart/m.html?_nkw=&_armrs=1&_ipg=&_from=&_udlo=23.440000000000204&_udhi=23.490000000000204&_sop=2&_ipg=200
For bmw zf 6 speed 6hp26 6hp28 6hp32 6hp34 sleeve and adapter seal oe kit NS,23.99,154375418896,4 sold,NewStart,mechatronic sleeve zf genuine,adapter seal for bmw zf,N/A,https://www.ebay.co.uk/sch/2021newstart/m.html?_nkw=&_armrs=1&_ipg=&_from=&_udlo=23.84000000000021&_udhi=23.89000000000021&_sop=2&_ipg=200
2PCS Camshaft Cam Position Solenoid Valve for Astra H J Insignia Vectra Vauxhall,22.88,154366075136,4 sold,NewStart,55567050,"71744383, 1235299, 6235597, 12992408, 55567050, 012992408, 055567050, 12 35 299, 62 35 597, 12 992 408, 55 567 050, 46085, Vectra",N/A,https://www.ebay.co.uk/sch/2021newstart/m.html?_nkw=&_armrs=1&_ipg=&_from=&_udlo=22.840000000000195&_udhi=22.890000000000196&_sop=2&_ipg=200
IGNITION STARTER STEERING BARREL &6 PIN SOCKET FOR AUDI SEAT SKODA VW NS,22.88,154368593115,N/A,NewStart,"1K0 905 851 B, 1K0905851B, 1K0 905 851 A, 1K0905851A, 1K0 905 851","1K0 905 851 B, 1K0905851B, 1K0 905 851 A,, 1K0 905 851 B, 1K0905851B, 1K0 905 851 A, 1K0905851A, 1K0 905 851, 1K0905851A,  1K0 905 851, 1K0905851, 30936044, 2004, 2005, 2006, 2007, 2008, 2009, 2010, 2011, 2012, 2013, 2014, 2015, 2016, 2017,, ATECA, LEON, OCTAVIA, SUPERB, YETI, BEETLE, CADDY, BARREL, HOUSING, BARRLE, EOS, GOLF, PLUS, JETTA, PASSAT,, IGNITION, STARTER, SWITCH, STEERING, WHEEL, LOCK, SCIROCCO, SHARAN, TOURAN, TIGUAN, VW, AUDI. SEAT, SKODA, A1, A3, Q3, ALHAMBRA, ALTEA, 1K0905851B",N/A,https://www.ebay.co.uk/sch/2021newstart/m.html?_nkw=&_armrs=1&_ipg=&_from=&_udlo=22.740000000000194&_udhi=22.790000000000195&_sop=2&_ipg=200
4F9945097 REAR HIGH LEVEL BRAKE LIGHT FOR AUDI A6 C6 AVANT ESTATE 2005-11 NS,22.59,154289978090,5 sold,NewStart,72604,4F9945097,N/A,https://www.ebay.co.uk/sch/2021newstart/m.html?_nkw=&_armrs=1&_ipg=&_from=&_udlo=22.44000000000019&_udhi=22.49000000000019&_sop=2&_ipg=200
Wind Rain Deflector Metal Fitting Clips Replacements For Heko G3 SNED Clip X6 NS,3.79,154337056105,1 sold,NewStart,X8R0149,N/A,N/A,https://www.ebay.co.uk/sch/2021newstart/m.html?_nkw=&_armrs=1&_ipg=&_from=&_udlo=3.74&_udhi=3.79&_sop=2&_ipg=200
plastic bonnet vents Hood Trim Carbon Fiber For Ford Focus RS ST MK2 ABS NS,21.99,154299050990,8 sold,NewStart,Does Not Apply,N/A,N/A,https://www.ebay.co.uk/sch/2021newstart/m.html?_nkw=&_armrs=1&_ipg=&_from=&_udlo=21.84000000000018&_udhi=21.89000000000018&_sop=2&_ipg=200
COVER / CAP of Window Switch For Fiat Doblo Peugeot Boxer Citroen 735421419 NS,3.79,154366055528,3 sold,NewStart,/,735421419  6490X9,N/A,https://www.ebay.co.uk/sch/2021newstart/m.html?_nkw=&_armrs=1&_ipg=&_from=&_udlo=3.74&_udhi=3.79&_sop=2&_ipg=200
2x BMW E90 E92 E93 E89  E60 E70 HALO ANGEL EYES LIGHT H8 20W WHITE BULBS  LED UK,21.88,154301587811,1 sold,NewStart,63217760782,N/A,N/A,https://www.ebay.co.uk/sch/2021newstart/m.html?_nkw=&_armrs=1&_ipg=&_from=&_udlo=21.74000000000018&_udhi=21.79000000000018&_sop=2&_ipg=200
FOR BMW E36 E38 E39 E46 PROJECTOR CCFL WHITE ANGEL EYES HALO RING LIGHT 7000K,21.99,154305913538,5 sold,NewStart,BMW E36  CCFL Rings,N/A,N/A,https://www.ebay.co.uk/sch/2021newstart/m.html?_nkw=&_armrs=1&_ipg=&_from=&_udlo=21.84000000000018&_udhi=21.89000000000018&_sop=2&_ipg=200
Xenon Ballast HID Control Unit Computer Module ECU For Audi/VW 8K0941597 NS,21.99,154340926690,3 sold,NewStart,8K0941597C,N/A,Does Not Apply,https://www.ebay.co.uk/sch/2021newstart/m.html?_nkw=&_armrs=1&_ipg=&_from=&_udlo=21.84000000000018&_udhi=21.89000000000018&_sop=2&_ipg=200
Pair Fit VW Golf Jetta MK6 Front Bumper Fog Light Lamps Touran Beetle Eos Caddy,21.58,154376940472,3 sold,Newstart,"5KD941699, 5KD941700, 5K0941699, 5K0941700","5KD941699, 5KD941700, 5K0941699, 5K0941700",N/A,https://www.ebay.co.uk/sch/2021newstart/m.html?_nkw=&_armrs=1&_ipg=&_from=&_udlo=21.440000000000175&_udhi=21.490000000000176&_sop=2&_ipg=200
4 Set Injector Seal Clamp Bolts kit For VW Seat Skoda 1.9 2.0 Audi 038103385A NS,21.59,154248302097,21 sold,NewStart,"038103385A, 1417010997,38198051A,038198051A,38198051B","038103385A, 1417010997, 38198051A, 038198051A, 38198051B",N/A,https://www.ebay.co.uk/sch/2021newstart/m.html?_nkw=&_armrs=1&_ipg=&_from=&_udlo=21.440000000000175&_udhi=21.490000000000176&_sop=2&_ipg=200
LCD Screen Display Screen Replacement for Nintendo Switch Console NS,20.99,154315660553,1 sold,NewStart,N/A,N/A,/,https://www.ebay.co.uk/sch/2021newstart/m.html?_nkw=&_armrs=1&_ipg=&_from=&_udlo=20.840000000000167&_udhi=20.890000000000168&_sop=2&_ipg=200
6441CE  For Citroen C4 Peugeot Fiat Vauxhall Corsa Heater Blower Motor Resistor,20.88,154299050228,3 sold,Rich Car,6441.CE,"6441CE, 6845788",N/A,https://www.ebay.co.uk/sch/2021newstart/m.html?_nkw=&_armrs=1&_ipg=&_from=&_udlo=20.740000000000165&_udhi=20.790000000000166&_sop=2&_ipg=200
2x Rear Light Lamp Bulb Holder Socket For Ford Transit Mk6 MK7 2000-2014 1681537,20.99,154364646698,2 sold,NewStart,1681537,"6C1113N004AB,6C11 13N004 AB",N/A,https://www.ebay.co.uk/sch/2021newstart/m.html?_nkw=&_armrs=1&_ipg=&_from=&_udlo=20.840000000000167&_udhi=20.890000000000168&_sop=2&_ipg=200
NEW 55702917  For Tailgate Boot Lock Catch Fit Fiat 500 Grande Punto Evo & Bravo,20.55,154299052538,N/A,NewStart,55702917,55702917,N/A,https://www.ebay.co.uk/sch/2021newstart/m.html?_nkw=&_armrs=1&_ipg=&_from=&_udlo=20.44000000000016&_udhi=20.490000000000162&_sop=2&_ipg=200
4PCS Parking Sensor PDC Fit BMW E39 E46 E60 E61 E65 E83 X3 X5 3 5 #66206989069 A,20.48,154375470844,12 sold,Newstart,"Parking PDC Sensor, 4PCS BMW Parking Sensor",66206989069,N/A,https://www.ebay.co.uk/sch/2021newstart/m.html?_nkw=&_armrs=1&_ipg=&_from=&_udlo=20.34000000000016&_udhi=20.39000000000016&_sop=2&_ipg=200
8 in 1 For MacBook Pro Air Multiport USB-C HUB to 4K HDMI USB 3.0 Aux Adapter NS,19.99,154335773943,2 sold,Newstart,N/A,N/A,Does not apply,https://www.ebay.co.uk/sch/2021newstart/m.html?_nkw=&_armrs=1&_ipg=&_from=&_udlo=19.890000000000153&_udhi=19.940000000000154&_sop=2&_ipg=200
Engine Block Breather Valve Durable For Mercedes-Benz W204 W211 W221 W164 NS,19.88,154315749538,4 sold,NewStart,"6420102091, 6420100191, 6420100391, 6420100591","642 010 20 91, 642 010 01 91, 642 010 03 91, 57512, 642 010 05 91, 642 010 18 91, 642 010 2091, 642 010 0191, 642 010 0391, 642 010 0591, V302620, 642 010 1891, 6420102091, 6420100191, V30-2620, 6420100391, 6420100591, 6420101891, 2385075, A 642 010 20 91, A 642 010 01 91, A 642 010 03 91, A 642 010 05 91, A 642 010 18 91, A6420102091, A6420100191, A6420100391, A6420100591, A6420101891",N/A,https://www.ebay.co.uk/sch/2021newstart/m.html?_nkw=&_armrs=1&_ipg=&_from=&_udlo=19.74000000000015&_udhi=19.790000000000152&_sop=2&_ipg=200
Turbo Boost Valve Pressure Converter for Mercedes Sprinter W203 #A0005450527 UK,20.28,154305908655,6 sold,Newstart,"A0005450527, a0005450527, 0005450527","000545527,0005450527,A0005450527, Turbo Boost Valve Pressure Converter, Pressure Converter Sprinter, Turbo Boost Valve Pressure Converter Sprinter, For Mercedes Sprinter W203 S203, 901 902 903 904,A 000 545 04 27, CL203,C209,W210,S210, 2-T, 3-T, 4-T,, Vacuum Pressure Converter Turbo Boost Valve",N/A,https://www.ebay.co.uk/sch/2021newstart/m.html?_nkw=&_armrs=1&_ipg=&_from=&_udlo=20.140000000000157&_udhi=20.190000000000158&_sop=2&_ipg=200
8 in 1 For MacBook Pro Air Multiport USB-C HUB to 4K HDMI USB 3.0 Aux Adapter NS,19.99,154335773943,2 sold,Newstart,N/A,N/A,Does not apply,https://www.ebay.co.uk/sch/2021newstart/m.html?_nkw=&_armrs=1&_ipg=&_from=&_udlo=19.840000000000153&_udhi=19.890000000000153&_sop=2&_ipg=200
LOWER LEFT DOOR LATCH LOCK CABLE HANDLE FOR FORD TRANSIT MK6 MK7 2000 - 14 REAR,19.88,154300136479,3 sold,NewStart,1494102,"YC15-V431A03-AM, 1494102",1494102,https://www.ebay.co.uk/sch/2021newstart/m.html?_nkw=&_armrs=1&_ipg=&_from=&_udlo=19.74000000000015&_udhi=19.790000000000152&_sop=2&_ipg=200
2*Black Paddle Shift Extensions For Shifters VW Golf 7 MK7 MK7.5 VII GTI GTD TSI,19.66,154359074744,N/A,NewStart,Shifter  Paddle VW,N/A,N/A,https://www.ebay.co.uk/sch/2021newstart/m.html?_nkw=&_armrs=1&_ipg=&_from=&_udlo=19.54000000000015&_udhi=19.59000000000015&_sop=2&_ipg=200
