Item Title,Item Price,Item ID,Number Sold,Brand,Manufacturer Part Number,Reference OE/OEM Number,MPN,Reference
Tailgate Glass Release Micro Switch for BMW E46 E91 E61 & LCI 61319200673 NS,14.99,154306992038,21 sold,NewStart,61319200673,"61319218995, 9168129, 9218995, 61319168129, 9187013, 61318385694, 8385694, 61319200673, 9200673, 61319187013, 61319194825, 61318378939",N/A,https://www.ebay.co.uk/sch/2021newstart/m.html?_nkw=&_armrs=1&_ipg=&_from=&_udlo=14.890000000000082&_udhi=14.940000000000083&_sop=2&_ipg=200
For Nissan Navara Qashqai Electric Window Switch 2005-2017 Swich #25401EB30B UK,14.99,154259971636,27 sold,Unbranded,Does Not Apply,25401-EB30B,N/A,https://www.ebay.co.uk/sch/2021newstart/m.html?_nkw=&_armrs=1&_ipg=&_from=&_udlo=14.890000000000082&_udhi=14.940000000000083&_sop=2&_ipg=200
Control Solenoid Vanos Variable Valve for BMW R56 R57 R58 R59 R60 Mini Cooper NS,14.99,154259748591,13 sold,NewStart,Does Not Apply,"11368610388, 11367604292, 11367587760, 11367566652, 11367564734, 917-243, 1.4 & 1.6 Engines",N/A,https://www.ebay.co.uk/sch/2021newstart/m.html?_nkw=&_armrs=1&_ipg=&_from=&_udlo=14.890000000000082&_udhi=14.940000000000083&_sop=2&_ipg=200
"1/4"" High Pressure Washer Rotating Turbo Nozzle Spray Tip 2.5-4 GPM 3600PSI uk",14.68,154301644637,3 sold,NewStart,N/A,N/A,Does not apply,https://www.ebay.co.uk/sch/2021newstart/m.html?_nkw=&_armrs=1&_ipg=&_from=&_udlo=14.590000000000078&_udhi=14.640000000000079&_sop=2&_ipg=200
For Oculus Quest 2 Headset TPE Link Cable 5m VR Game USB Type C Extension Cord,14.69,154291777369,7 sold,Newstart,N/A,N/A,Does Not Apply,https://www.ebay.co.uk/sch/2021newstart/m.html?_nkw=&_armrs=1&_ipg=&_from=&_udlo=14.590000000000078&_udhi=14.640000000000079&_sop=2&_ipg=200
4 Button Car Remote Key FOB 433MHz & Uncut Blade For Jaguar X Type S Type XJ XJR,14.69,154383720460,9 sold,Feierc,Jaguar Remote Key MHz,N/A,Does not apply,https://www.ebay.co.uk/sch/2021newstart/m.html?_nkw=&_armrs=1&_ipg=&_from=&_udlo=14.590000000000078&_udhi=14.640000000000079&_sop=2&_ipg=200
New Vauxhall Meriva B 10- Tailgate Boot Release Opening Switch 13422271 NS,14.29,154264149518,15 sold,NewStart,13422271,N/A,N/A,https://www.ebay.co.uk/sch/2021newstart/m.html?_nkw=&_armrs=1&_ipg=&_from=&_udlo=14.290000000000074&_udhi=14.340000000000074&_sop=2&_ipg=200
REAR LOWER TAILGATE BOOT STRAPS CABLES For RANGE ROVER L322  02-2010 LR038051,14.48,154300389420,4 sold,NewStart,LR038051,N/A,N/A,https://www.ebay.co.uk/sch/2021newstart/m.html?_nkw=&_armrs=1&_ipg=&_from=&_udlo=14.390000000000075&_udhi=14.440000000000076&_sop=2&_ipg=200
Steering Column Indicator Stalk Switch For Dacia Sandero Logan Dokker 8201167988,14.59,154336975261,N/A,NewStart,Does Not Apply,8201167988,N/A,https://www.ebay.co.uk/sch/2021newstart/m.html?_nkw=&_armrs=1&_ipg=&_from=&_udlo=14.490000000000077&_udhi=14.540000000000077&_sop=2&_ipg=200
Useless Box Toy Interesting Gift Leave Me Alone Pastime Machine Turns Itself Off,14.66,154336956907,3 sold,NewStart,N/A,N/A,Does Not Apply,https://www.ebay.co.uk/sch/2021newstart/m.html?_nkw=&_armrs=1&_ipg=&_from=&_udlo=14.540000000000077&_udhi=14.590000000000078&_sop=2&_ipg=200
Useless Box Toy Interesting Gift Leave Me Alone Pastime Machine Turns Itself Off,14.66,154336956907,3 sold,NewStart,N/A,N/A,Does Not Apply,https://www.ebay.co.uk/sch/2021newstart/m.html?_nkw=&_armrs=1&_ipg=&_from=&_udlo=14.590000000000078&_udhi=14.640000000000079&_sop=2&_ipg=200
Left Side For Mercedes Benz W204 W212 Dynamic LED Mirror Indicator Signal Light,14.88,154372527486,9 sold,Newstart,bkE2153297,"A3159539A, A3159539C, 3159539C",N/A,https://www.ebay.co.uk/sch/2021newstart/m.html?_nkw=&_armrs=1&_ipg=&_from=&_udlo=14.79000000000008&_udhi=14.840000000000082&_sop=2&_ipg=200
6x 33mm for BMW Diesel Swirl Blank Flaps Repair & Del KIT w/ Intake Gasket NS,14.88,154315928309,8 sold,NewStart,Does Not Apply,N/A,N/A,https://www.ebay.co.uk/sch/2021newstart/m.html?_nkw=&_armrs=1&_ipg=&_from=&_udlo=14.79000000000008&_udhi=14.840000000000082&_sop=2&_ipg=200
Electronic HandBrake Switch Parking Brake For Peugeot 3008/5008 470706 470702 NS,13.99,154221389043,24 sold,NewStart,470706,"470706, 470702",does not apply,https://www.ebay.co.uk/sch/2021newstart/m.html?_nkw=&_armrs=1&_ipg=&_from=&_udlo=13.940000000000069&_udhi=13.99000000000007&_sop=2&_ipg=200
Vacuum Cleaner 34V 600mA Charger For Vax Blade TBT3V1B1 32V CordlessPro Stick UK,13.99,154338391819,9 sold,Newstart,N/A,N/A,Does not apply,https://www.ebay.co.uk/sch/2021newstart/m.html?_nkw=&_armrs=1&_ipg=&_from=&_udlo=13.890000000000068&_udhi=13.940000000000069&_sop=2&_ipg=200
940002904 For Ford Focus S-Max Galaxy Kuga I MondeoRadiator Control Fan Module,13.99,154383783072,N/A,NewStart,Does Not Apply,"940002904, 940.0029.04, 940002903, 940.0029.03, 940002906, 940.0029.06, 940004701, 940.0047.01, 940004702, 940.0047.02, 940007403, 940.0074.03, 940009301, 940.0093.01, 940009701,940.0097.01, 6W1Z8B658AC, 6W1Z-8B658-AC, M519A819AA,4M51-9A819-AA, 902-209,902209,94000970,132225, For FORD Focus, Galaxy, Kuga I,, Mondeo, S-Max  c-max, for volvo C30  C70 S40 V50  s80, XC60    XC90 control module, RADIATOR FAN MODULE CONTROL MODULE",N/A,https://www.ebay.co.uk/sch/2021newstart/m.html?_nkw=&_armrs=1&_ipg=&_from=&_udlo=13.890000000000068&_udhi=13.940000000000069&_sop=2&_ipg=200
Swirl Flaps Plug Remov Kit For BMW N57 N57S E90 E91 E92 E93 F07 F10 F11 NS,13.99,154318262038,2 sold,NewStart,Does Not Apply,"11618575534, 71-41231-00, 714123100, 11617807480, 11618511363, 11617811300",Does Not Apply,https://www.ebay.co.uk/sch/2021newstart/m.html?_nkw=&_armrs=1&_ipg=&_from=&_udlo=13.890000000000068&_udhi=13.940000000000069&_sop=2&_ipg=200
INTAKE INLET MANIFOLD GASKETS  FOR BMW M47 E87 E46 E90 E91 E92 E93 E39 UK STOCK,13.99,154315952690,9 sold,NewStart,11612246945,"11612246945, 11617790198, 11612245439, 11612246949",N/A,https://www.ebay.co.uk/sch/2021newstart/m.html?_nkw=&_armrs=1&_ipg=&_from=&_udlo=13.890000000000068&_udhi=13.940000000000069&_sop=2&_ipg=200
2X BLACK SMOKED DYNAMIC FLOWING SEQUENTIAL LED SIDE REPEATERS INDICATORS For VW,13.99,154297599183,109 sold,NewStart,14805294,"4M5A13K309AA YM2113K309AB YM2113K309AA 14805294, 1J5949117 1J0949117 1125197 1108914 95VW-13K309-BA, 99VW-13K309-AA ST0334041 ST0524141 ST5204141, SVW126000UE 95393158 F02244331 VW0204141 VW0214141, VW0214143 VW0344040 VG0214141 VG0214143 VG0534143, VG0814042 VW0344141 VG9174041 VW0524042 VW0534141, VW0534143 VW0814042 VW9174041 3B0949117 3B0949117C, 3B0949117A 3B0949117B 3A0949117 3A0949101A 1091798, 3A0949117A 3A0949117B 3A0949101B 6L0949117A 542005, 1M0949117B 7271695 7203380 4360568 1400780C, 14024657 180237059 180605112 2246078 25470120, 3094901171J0 3103127 3107127 3111127 3103802, 3411407 4012200 4053184062612 5410909202064, 5888913 66120600 715102120120 9549211 72656041, 8033533042881 8033533116858 8033533190940 95010620, 8717475062502 QF00200007, Dynamic Sweep Swipe Sequential Glow Flow Audi Fade, Black Tinted Smoked Orange Amber LED SMD Light, Repeater Side Marker Turn Signal Lense Flasher, T10 501 W5W 194 168 Wedge Canbus Error free OBC CE",N/A,https://www.ebay.co.uk/sch/2021newstart/m.html?_nkw=&_armrs=1&_ipg=&_from=&_udlo=13.890000000000068&_udhi=13.940000000000069&_sop=2&_ipg=200
Electronic HandBrake Switch Parking Brake For Peugeot 3008/5008 470706 470702 NS,13.99,154221389043,24 sold,NewStart,470706,"470706, 470702",does not apply,https://www.ebay.co.uk/sch/2021newstart/m.html?_nkw=&_armrs=1&_ipg=&_from=&_udlo=13.890000000000068&_udhi=13.940000000000069&_sop=2&_ipg=200
New For Vauxhall Vivaro Wire Harness 2001-14 Ignition Lock Barrel Contact Switch,13.98,154388681459,N/A,Newstart,7701038365,"OE Renault 7701038365 7701038364 7701203147, 7700765533 7701475696, VALEO 256419",N/A,https://www.ebay.co.uk/sch/2021newstart/m.html?_nkw=&_armrs=1&_ipg=&_from=&_udlo=13.890000000000068&_udhi=13.940000000000069&_sop=2&_ipg=200
#13228879 Front Door Electric Window Switch For Vauxhall Astra Astravan Zafira A,13.98,154297771078,10 sold,Newstart,13228879,13228879,N/A,https://www.ebay.co.uk/sch/2021newstart/m.html?_nkw=&_armrs=1&_ipg=&_from=&_udlo=13.890000000000068&_udhi=13.940000000000069&_sop=2&_ipg=200
2X BLACK SMOKED DYNAMIC FLOWING SEQUENTIAL LED SIDE REPEATERS INDICATORS For VW,13.99,154297599183,109 sold,NewStart,14805294,"4M5A13K309AA YM2113K309AB YM2113K309AA 14805294, 1J5949117 1J0949117 1125197 1108914 95VW-13K309-BA, 99VW-13K309-AA ST0334041 ST0524141 ST5204141, SVW126000UE 95393158 F02244331 VW0204141 VW0214141, VW0214143 VW0344040 VG0214141 VG0214143 VG0534143, VG0814042 VW0344141 VG9174041 VW0524042 VW0534141, VW0534143 VW0814042 VW9174041 3B0949117 3B0949117C, 3B0949117A 3B0949117B 3A0949117 3A0949101A 1091798, 3A0949117A 3A0949117B 3A0949101B 6L0949117A 542005, 1M0949117B 7271695 7203380 4360568 1400780C, 14024657 180237059 180605112 2246078 25470120, 3094901171J0 3103127 3107127 3111127 3103802, 3411407 4012200 4053184062612 5410909202064, 5888913 66120600 715102120120 9549211 72656041, 8033533042881 8033533116858 8033533190940 95010620, 8717475062502 QF00200007, Dynamic Sweep Swipe Sequential Glow Flow Audi Fade, Black Tinted Smoked Orange Amber LED SMD Light, Repeater Side Marker Turn Signal Lense Flasher, T10 501 W5W 194 168 Wedge Canbus Error free OBC CE",N/A,https://www.ebay.co.uk/sch/2021newstart/m.html?_nkw=&_armrs=1&_ipg=&_from=&_udlo=13.940000000000069&_udhi=13.99000000000007&_sop=2&_ipg=200
NEW FORD TRANSIT MK7 OE TYPE LOCKING FUEL CAP AND 2 KEYS DIESEL PETROL 2.2/2.4 A,13.66,154256678202,20 sold,Unbranded,1715043,1715043,N/A,https://www.ebay.co.uk/sch/2021newstart/m.html?_nkw=&_armrs=1&_ipg=&_from=&_udlo=13.590000000000064&_udhi=13.640000000000065&_sop=2&_ipg=200
Lithium-Ion Battery Charger For Black & Decker 9.6V-18V Ni-MH Ni-CD Battery UK A,13.85,154224852398,8 sold,Unbranded,N/A,N/A,Does Not Apply,https://www.ebay.co.uk/sch/2021newstart/m.html?_nkw=&_armrs=1&_ipg=&_from=&_udlo=13.740000000000066&_udhi=13.790000000000067&_sop=2&_ipg=200
Front/Rear Interior Inner 80671JD00E Door Handle For NISSAN QASHQAI Left+Right,13.88,154310574921,8 sold,NewStart,80670-JD00E/ 80670JD00E/ 80671-JD00E/ 80671-JD00E,80670-JD00E/ 80670JD00E/ 80671-JD00E/ 80671-JD00E,N/A,https://www.ebay.co.uk/sch/2021newstart/m.html?_nkw=&_armrs=1&_ipg=&_from=&_udlo=13.790000000000067&_udhi=13.840000000000067&_sop=2&_ipg=200
For Nissan Navara D40 Pathfinder R51 80670-4X02B Right Interior Door Handle NS,13.88,154368539579,N/A,NewStart,Does not apply,80670-4X02B 806704X02B,N/A,https://www.ebay.co.uk/sch/2021newstart/m.html?_nkw=&_armrs=1&_ipg=&_from=&_udlo=13.790000000000067&_udhi=13.840000000000067&_sop=2&_ipg=200
701051503B AERIAL ANTENNA 701 051 503B Replace FOR VW TRANSPORTER T4 (1990-2003),13.88,154322064705,9 sold,NewStart,701051503B,"701051503B , 701-051-503/B , 701 051 503B",N/A,https://www.ebay.co.uk/sch/2021newstart/m.html?_nkw=&_armrs=1&_ipg=&_from=&_udlo=13.790000000000067&_udhi=13.840000000000067&_sop=2&_ipg=200
10253021 HANDBRAKE SHOE ADJUSTER FITTING KIT FOR VOLVO XC90 BBA219K S60 MK1 V70,13.55,154314617654,7 sold,NewStart,BBA219K,10253021,N/A,https://www.ebay.co.uk/sch/2021newstart/m.html?_nkw=&_armrs=1&_ipg=&_from=&_udlo=13.440000000000062&_udhi=13.490000000000062&_sop=2&_ipg=200
6X 22MM FOR BMW DIESEL SWIRL FLAP BLANKS REPAIR KIT WITH MANIFOLD GASKETS NS,13.59,154368506928,8 sold,NewStart,Does Not Apply,"11612246949, 11612245439, 11617790198, 11612246945, 11617800585, LKJ101120L, 5850788, 93176515, 2246945, 2245439, 228690, 5850651",N/A,https://www.ebay.co.uk/sch/2021newstart/m.html?_nkw=&_armrs=1&_ipg=&_from=&_udlo=13.490000000000062&_udhi=13.540000000000063&_sop=2&_ipg=200
Generator Carburetor Carb Set For Honda GX120 GX160 GX168 GX200 5.5HP 6.5HP NS,13.48,154327438591,2 sold,Does Not Apply,N/A,N/A,Does not apply,https://www.ebay.co.uk/sch/2021newstart/m.html?_nkw=&_armrs=1&_ipg=&_from=&_udlo=13.390000000000061&_udhi=13.440000000000062&_sop=2&_ipg=200
NEW FORD TRANSIT MK7 OE TYPE LOCKING FUEL CAP AND 2 KEYS DIESEL PETROL 2.2/2.4 A,13.66,154256678202,20 sold,Unbranded,1715043,1715043,N/A,https://www.ebay.co.uk/sch/2021newstart/m.html?_nkw=&_armrs=1&_ipg=&_from=&_udlo=13.540000000000063&_udhi=13.590000000000064&_sop=2&_ipg=200
75x Wire Block Clamp Terminal Cable Reusable For 221 Electrical Connectors UK,13.28,154245401720,57 sold,Unbranded,N/A,N/A,Does Not Apply,https://www.ebay.co.uk/sch/2021newstart/m.html?_nkw=&_armrs=1&_ipg=&_from=&_udlo=13.190000000000058&_udhi=13.240000000000059&_sop=2&_ipg=200
75x Wire Block Clamp Terminal Cable Reusable For 221 Electrical Connectors UK,13.28,154245401720,57 sold,Unbranded,N/A,N/A,Does Not Apply,https://www.ebay.co.uk/sch/2021newstart/m.html?_nkw=&_armrs=1&_ipg=&_from=&_udlo=13.240000000000059&_udhi=13.29000000000006&_sop=2&_ipg=200
#5G0959857C Master Power Window Control Switch For VW Golf Passat Tiguan Arteon,13.32,154288724028,8 sold,Newstart,5G0959857C,5G0959857C,N/A,https://www.ebay.co.uk/sch/2021newstart/m.html?_nkw=&_armrs=1&_ipg=&_from=&_udlo=13.240000000000059&_udhi=13.29000000000006&_sop=2&_ipg=200
New Temic For Renault Megane  CC Window Regulator Motor Module 440726 UK SHIP FF,13.48,154254806435,19 sold,Unbranded,Does Not Apply,"440726, 440788, 440746, 288887, Fensterheber Komfort Elektrisch, renault window temic module, renault window module, temic window module",N/A,https://www.ebay.co.uk/sch/2021newstart/m.html?_nkw=&_armrs=1&_ipg=&_from=&_udlo=13.390000000000061&_udhi=13.440000000000062&_sop=2&_ipg=200
NEW FIR FOR VAUXHALL  PETROL EVAPORATION CONTROL PURGE SOLENOID VALVE 55566514,13.35,154237244681,10 sold,Unbranded,"55566514, 0280142486","55566514, 0280142487",N/A,https://www.ebay.co.uk/sch/2021newstart/m.html?_nkw=&_armrs=1&_ipg=&_from=&_udlo=13.240000000000059&_udhi=13.29000000000006&_sop=2&_ipg=200
Smoked LED Rear High Level Third Brake Stop Light Fit VW Caddy MK III 2004-15 NS,13.19,154248635064,35 sold,NewStart,"2K0945087A, 2K0945087B, 2K0945087C","2K0945087F, 2K0945087E, 2K0945087C, 2K0945087B, 2K0945087A, 2K0945087",N/A,https://www.ebay.co.uk/sch/2021newstart/m.html?_nkw=&_armrs=1&_ipg=&_from=&_udlo=13.090000000000057&_udhi=13.140000000000057&_sop=2&_ipg=200
Pregnancy Car Seat Belt Adjustable Maternity Belt Protect Pregnant Bump Belt NS,12.99,154319555330,5 sold,NewStart,N/A,N/A,N/A,https://www.ebay.co.uk/sch/2021newstart/m.html?_nkw=&_armrs=1&_ipg=&_from=&_udlo=12.890000000000054&_udhi=12.940000000000055&_sop=2&_ipg=200
Heater Blower Resistor for Vauxhall Vivaro 1.9 2.0 2.5 1.9 2.0 2.5 7701208226 NS,13.29,154382320953,5 sold,NewStart,HBR053-7001,7701208226 / 4413393 / 93161217 / 4409451 / 91158690,N/A,https://www.ebay.co.uk/sch/2021newstart/m.html?_nkw=&_armrs=1&_ipg=&_from=&_udlo=13.190000000000058&_udhi=13.240000000000059&_sop=2&_ipg=200
Sliding Door Handle Left Side N/S  For Mercedes W906 Sprinter VW Crafter 2006 On,12.95,154288758335,23 sold,NewStart,"9067600170,Outer Sliding Door Handle, w906",9067600170,N/A,https://www.ebay.co.uk/sch/2021newstart/m.html?_nkw=&_armrs=1&_ipg=&_from=&_udlo=12.840000000000053&_udhi=12.890000000000054&_sop=2&_ipg=200
6J0837114A Inner Interior Car Front Right Door Handle  For SEAT Ibiza 2009-2012,12.95,154296575062,9 sold,NewStart,6J0837114A,6J0837114A,N/A,https://www.ebay.co.uk/sch/2021newstart/m.html?_nkw=&_armrs=1&_ipg=&_from=&_udlo=12.840000000000053&_udhi=12.890000000000054&_sop=2&_ipg=200
RHD Glove Box Catch Lock Assembly Handle New for Ford Mondeo MK3 2000 2007 NS,12.99,154264110700,45 sold,NewStart,Does Not Apply,N/A,N/A,https://www.ebay.co.uk/sch/2021newstart/m.html?_nkw=&_armrs=1&_ipg=&_from=&_udlo=12.890000000000054&_udhi=12.940000000000055&_sop=2&_ipg=200
ABS SENSOR SPEED LEFT RIGHT WHEEL FOR VAUXHALL OPEL INSIGNIA 2008-2017 #1235053,12.88,154235502414,11 sold,Unbranded,Does Not Apply,N/A,N/A,https://www.ebay.co.uk/sch/2021newstart/m.html?_nkw=&_armrs=1&_ipg=&_from=&_udlo=12.790000000000052&_udhi=12.840000000000053&_sop=2&_ipg=200
Side Loading Sliding Door Handle For Renault Vauxhall Movano Nissan Master MK3,12.99,154261275986,23 sold,NewStart,"95518889,4423584","95518889, 4423584, 806067794R",N/A,https://www.ebay.co.uk/sch/2021newstart/m.html?_nkw=&_armrs=1&_ipg=&_from=&_udlo=12.890000000000054&_udhi=12.940000000000055&_sop=2&_ipg=200
Hand Parking Brake Lever Repair Cable Fit Ford S-Max Galaxy 2006-2015 #5900926,12.85,154321783359,3 sold,NewStart,5900926,5900926,N/A,https://www.ebay.co.uk/sch/2021newstart/m.html?_nkw=&_armrs=1&_ipg=&_from=&_udlo=12.740000000000052&_udhi=12.790000000000052&_sop=2&_ipg=200
UK 2X AN -10 AN10 STRAIGHT Hose 90 Degree Fitting Hose Ends  Fast Flow Stealth,12.85,154288847842,27 sold,NewStart,Does Not Apply,N/A,N/A,https://www.ebay.co.uk/sch/2021newstart/m.html?_nkw=&_armrs=1&_ipg=&_from=&_udlo=12.740000000000052&_udhi=12.790000000000052&_sop=2&_ipg=200
2X LED Pair Rear Stop Lights Tail 12V Indicator Lamp Trailer Truck Tipper Van NS,12.99,154258258491,11 sold,NewStart,Does Not Apply,N/A,N/A,https://www.ebay.co.uk/sch/2021newstart/m.html?_nkw=&_armrs=1&_ipg=&_from=&_udlo=12.890000000000054&_udhi=12.940000000000055&_sop=2&_ipg=200
For BMW Centre Armrest Storage Insert Tray 3 Series E90 E91 E92 E93 NS,12.79,154358752748,N/A,NewStart,51 16 7 118 064,51167118064,51 16 7 118 064,https://www.ebay.co.uk/sch/2021newstart/m.html?_nkw=&_armrs=1&_ipg=&_from=&_udlo=12.690000000000051&_udhi=12.740000000000052&_sop=2&_ipg=200
51247118158 Boot Lid Tailgate Push Button Release Switch fits BMW 1 3 5 series,13.29,154250286340,9 sold,NewStart,"51 24 7 118 158,51247118158,7118158",N/A,N/A,https://www.ebay.co.uk/sch/2021newstart/m.html?_nkw=&_armrs=1&_ipg=&_from=&_udlo=13.190000000000058&_udhi=13.240000000000059&_sop=2&_ipg=200
Car Boot/Tailgate Release Handle Switch For Land Rover Discovery 3 4 NS LR015457,12.88,154374996090,7 sold,NewStart,LR015457,N/A,N/A,https://www.ebay.co.uk/sch/2021newstart/m.html?_nkw=&_armrs=1&_ipg=&_from=&_udlo=12.790000000000052&_udhi=12.840000000000053&_sop=2&_ipg=200
12V Car Air Diesel Oil Fuel Pump Heater Set For 1 To 5KW Webasto Eberspacher NS,13.29,154354083778,1 sold,NewStart,Does Not Apply,N/A,N/A,https://www.ebay.co.uk/sch/2021newstart/m.html?_nkw=&_armrs=1&_ipg=&_from=&_udlo=13.190000000000058&_udhi=13.240000000000059&_sop=2&_ipg=200
Radiator Fan Motor Switch Resistor For MINI Cooper R50 R52 R53 NS 17117541092R,12.39,154275892760,10 sold,NewStart,Does Not Apply,N/A,N/A,https://www.ebay.co.uk/sch/2021newstart/m.html?_nkw=&_armrs=1&_ipg=&_from=&_udlo=12.290000000000045&_udhi=12.340000000000046&_sop=2&_ipg=200
For VW Jetta Golf GTI Passat Audi 2.0T 06E906517A Fuel Tank Breather Purge Valve,12.28,154319477330,1 sold,Newstart,06E906517A,06E906517A,N/A,https://www.ebay.co.uk/sch/2021newstart/m.html?_nkw=&_armrs=1&_ipg=&_from=&_udlo=12.190000000000044&_udhi=12.240000000000045&_sop=2&_ipg=200
Gear Shift Knob SPORT PU Leather 6 Speed For BMW X1 X3 E81 E87 E82 E46 E91 E92,12.48,154297802505,25 sold,NewStart,Gear Shift  BMW,N/A,N/A,https://www.ebay.co.uk/sch/2021newstart/m.html?_nkw=&_armrs=1&_ipg=&_from=&_udlo=12.390000000000047&_udhi=12.440000000000047&_sop=2&_ipg=200
Gear Shift Stick Repair Bush for Vauxhall Vectra Zafira Astra Combo Meriva NS,12.59,154357421766,5 sold,NewStart,S0652078,N/A,N/A,https://www.ebay.co.uk/sch/2021newstart/m.html?_nkw=&_armrs=1&_ipg=&_from=&_udlo=12.490000000000048&_udhi=12.540000000000049&_sop=2&_ipg=200
82PCS Cake Decorating Kit Tools Baking Supplies  Set Spatula DIY Tools NS,12.18,154338089357,3 sold,NewStart,N/A,N/A,Does not apply,https://www.ebay.co.uk/sch/2021newstart/m.html?_nkw=&_armrs=1&_ipg=&_from=&_udlo=12.090000000000042&_udhi=12.140000000000043&_sop=2&_ipg=200
Soldering Aid Pliers Laser Tools Pliers Hold 2 Wires Whilst Soldering NS,12.48,154342167726,1 sold,NewStart,N/A,N/A,Does Not Apply,https://www.ebay.co.uk/sch/2021newstart/m.html?_nkw=&_armrs=1&_ipg=&_from=&_udlo=12.390000000000047&_udhi=12.440000000000047&_sop=2&_ipg=200
Lens LED High Level Tailgate Third Brake Light Fit 03-15 VW Transporter T5 NEW,11.95,154390223672,N/A,NewStart,Does Not Apply,"7E0945097A, 7E0 945 097A",N/A,https://www.ebay.co.uk/sch/2021newstart/m.html?_nkw=&_armrs=1&_ipg=&_from=&_udlo=11.89000000000004&_udhi=11.94000000000004&_sop=2&_ipg=200
Lens LED High Level Tailgate Third Brake Light Fit 03-15 VW Transporter T5 NEW,11.95,154390223672,N/A,NewStart,Does Not Apply,"7E0945097A, 7E0 945 097A",N/A,https://www.ebay.co.uk/sch/2021newstart/m.html?_nkw=&_armrs=1&_ipg=&_from=&_udlo=11.840000000000039&_udhi=11.89000000000004&_sop=2&_ipg=200
RENAULT MASTER MOVANO MK2 REAR TAILGATE BACK DOOR HANDLE 1998-2010 7700352433 NS,12.59,154245325415,6 sold,NewStart,Does Not Apply,7700352433,N/A,https://www.ebay.co.uk/sch/2021newstart/m.html?_nkw=&_armrs=1&_ipg=&_from=&_udlo=12.490000000000048&_udhi=12.540000000000049&_sop=2&_ipg=200
2 For VW GOLF MK6 MK7 H15 100w DRL HIGH BEAM BULBS XENON WHITE CANBUS HEADLIGHTS,11.88,154359014848,3 sold,Lightec UK,Does Not Apply,"5000k 6000k 7500k 8500k Clear All Weather Power, Bi Zenon Zennon Front Fog Spot Headlight, Headlamps High Low Flash Main Beam, Head Light Hid Effect 3 Pin Drl Daytime, Running Lights Globes Dc, Dip Dipped Main Beam, cb1 Audi A5 Ford Fiesta Vw Golf Bmw Mercedes Skoda, Halogen Upgrade, Ice Cool Osram Intense Hella, 715 Pj26t-1 Deep Clear Glass Blue, Diamond Superwhite, Tint Smd Led Super New Bright, Xenon Parking Lights Car Van, Canbus, Error Free, High Power, Pure White",N/A,https://www.ebay.co.uk/sch/2021newstart/m.html?_nkw=&_armrs=1&_ipg=&_from=&_udlo=11.790000000000038&_udhi=11.840000000000039&_sop=2&_ipg=200
Ignition Switch & Barrel Cyclinder Lock Cylinder +2 Keys For Ford Transit MK7 NS,12.59,154383851587,N/A,NewStart,Does Not Apply,"4355452, 717444389, 1022461, 98AB11572BG, 2S61A3697AA, 1677531, AA6T11572AA, 1363940, keys, FORD Transit Focus Mondeo Fiesta, Cyclinder",N/A,https://www.ebay.co.uk/sch/2021newstart/m.html?_nkw=&_armrs=1&_ipg=&_from=&_udlo=12.490000000000048&_udhi=12.540000000000049&_sop=2&_ipg=200
2x Rear Light Lamp Bulb Holder Socket For Ford Transit Mk6 MK7 2000-2014 1681537,11.35,154343626598,26 sold,Newstart,1681537,"6C1113N004AB,6C11 13N004 AB",N/A,https://www.ebay.co.uk/sch/2021newstart/m.html?_nkw=&_armrs=1&_ipg=&_from=&_udlo=11.290000000000031&_udhi=11.340000000000032&_sop=2&_ipg=200
Windscreen Windshield Washer Pump w/ Grommet For Jaguar XF 2008-2018 NS,11.59,154338316285,10 sold,NewStart,Does Not Apply,N/A,N/A,https://www.ebay.co.uk/sch/2021newstart/m.html?_nkw=&_armrs=1&_ipg=&_from=&_udlo=11.490000000000034&_udhi=11.540000000000035&_sop=2&_ipg=200
12 LED Bubble Light Submersible Air Stone for Aquarium Fish Tank Pump Curtain UK,11.48,154297866630,17 sold,NewStart,N/A,N/A,N/A,https://www.ebay.co.uk/sch/2021newstart/m.html?_nkw=&_armrs=1&_ipg=&_from=&_udlo=11.390000000000033&_udhi=11.440000000000033&_sop=2&_ipg=200
NEW Heater Blower Fan Resistor Fits Mercedes Viano (2003-) Vito NS 18358706,11.59,154367339669,N/A,NewStart,HR78,"OE: 18358706, 18358706",N/A,https://www.ebay.co.uk/sch/2021newstart/m.html?_nkw=&_armrs=1&_ipg=&_from=&_udlo=11.490000000000034&_udhi=11.540000000000035&_sop=2&_ipg=200
3 Button Remote Key Card PCF7947 433Mhz For Renault Megane Scenic Clio 2003-2008,11.55,154367273546,N/A,Newstart,Key MHZ  Renault Megane,N/A,Does Not Apply,https://www.ebay.co.uk/sch/2021newstart/m.html?_nkw=&_armrs=1&_ipg=&_from=&_udlo=11.440000000000033&_udhi=11.490000000000034&_sop=2&_ipg=200
3 Button Remote Key Card PCF7947 433Mhz For Renault Megane Scenic Clio 2003-2008,11.55,154367273546,N/A,Newstart,Key MHZ  Renault Megane,N/A,Does Not Apply,https://www.ebay.co.uk/sch/2021newstart/m.html?_nkw=&_armrs=1&_ipg=&_from=&_udlo=11.490000000000034&_udhi=11.540000000000035&_sop=2&_ipg=200
THERMOSTAT HOSE FOR VAUXHALL OPEL ASTRA G H INSIGNIA A ZAFIRA B VECTRA C 1.8 1.6,11.75,154254799673,2 sold,Unbranded,"55101407, 25192904","5826484, 826001, 1338177, 55559352, 55574685, 5826481, 826004, 55577284, 96984103, 25192904",N/A,https://www.ebay.co.uk/sch/2021newstart/m.html?_nkw=&_armrs=1&_ipg=&_from=&_udlo=11.640000000000036&_udhi=11.690000000000037&_sop=2&_ipg=200
New Front Right Driver Door Lock Barrel & 2 Keys For VW Golf 4 Mk4 VW Bora 97-06,11.53,154322001079,7 sold,NewStart,Cylinder 1U0837168,1U0837168,N/A,https://www.ebay.co.uk/sch/2021newstart/m.html?_nkw=&_armrs=1&_ipg=&_from=&_udlo=11.440000000000033&_udhi=11.490000000000034&_sop=2&_ipg=200
UK Universal Manual Car Gear Shift Knob Shifter 6 Speed  Lever Black PU Leather,11.48,154297875017,11 sold,NewStart,Does Not Apply,N/A,N/A,https://www.ebay.co.uk/sch/2021newstart/m.html?_nkw=&_armrs=1&_ipg=&_from=&_udlo=11.390000000000033&_udhi=11.440000000000033&_sop=2&_ipg=200
THERMOSTAT HOSE FOR VAUXHALL OPEL ASTRA G H INSIGNIA A ZAFIRA B VECTRA C 1.8 1.6,11.75,154254799673,2 sold,Unbranded,"55101407, 25192904","5826484, 826001, 1338177, 55559352, 55574685, 5826481, 826004, 55577284, 96984103, 25192904",N/A,https://www.ebay.co.uk/sch/2021newstart/m.html?_nkw=&_armrs=1&_ipg=&_from=&_udlo=11.690000000000037&_udhi=11.740000000000038&_sop=2&_ipg=200
For VW Golf MK5 Audi A3 Engine Breather PCV Valve Vent Hose Pipe 06F103221E NS,11.99,154263991030,5 sold,NewStart,06F103221E,06F103221E,N/A,https://www.ebay.co.uk/sch/2021newstart/m.html?_nkw=&_armrs=1&_ipg=&_from=&_udlo=11.89000000000004&_udhi=11.94000000000004&_sop=2&_ipg=200
FOR VW T5 T5.1 T6 Transporter Door Seal 16 x 17mm OEM Sounds like a Golf NS,11.88,154254924253,19 sold,NewStart,YTWT51617,N/A,N/A,https://www.ebay.co.uk/sch/2021newstart/m.html?_nkw=&_armrs=1&_ipg=&_from=&_udlo=11.790000000000038&_udhi=11.840000000000039&_sop=2&_ipg=200
FOR FORD TRANSIT MK6 7 FRONT DOOR LOCK BARREL RIGHT 2 KEYS DRIVER SIDE LATCH NS,11.99,154300341232,13 sold,NewStart,4060638,4060638,N/A,https://www.ebay.co.uk/sch/2021newstart/m.html?_nkw=&_armrs=1&_ipg=&_from=&_udlo=11.89000000000004&_udhi=11.94000000000004&_sop=2&_ipg=200
TAILGATE BOOT SWITCH FOR RENAULT CLIO MK3 MK4 MEGANE MK2 MK3 LAGUNA 3 8200076256,11.29,154298822689,38 sold,NewStart,8200076256,8200076256,N/A,https://www.ebay.co.uk/sch/2021newstart/m.html?_nkw=&_armrs=1&_ipg=&_from=&_udlo=11.19000000000003&_udhi=11.24000000000003&_sop=2&_ipg=200
