Item Title,Item Price,Item ID,Number Sold,Brand,Manufacturer Part Number,Reference OE/OEM Number,MPN,Reference
2x LED Mirror Puddle Light Side Under Fit VW Scirocco 3 Jetta Eos Passat B7 CC,11.99,154322104221,19 sold,NewStart,Does Not Apply,3C8949101，3C8949101D，3C8949101A，3C8949101E,N/A,https://www.ebay.co.uk/sch/2021newstart/m.html?_nkw=&_armrs=1&_ipg=&_from=&_udlo=11.89000000000004&_udhi=11.94000000000004&_sop=2&_ipg=200
BRAND NEW 1.9 tdi 4 bar map sensor 0281006059 for VW AUDI SKODA SEAT NS,11.99,154322039258,3 sold,NewStart,0281006059 03K906051,"0 281 006 059 0281006059, 038906051 0281006060, 281006059, 0 281 006 059, 0281006059, 038906051, 0281006060, 03K906051",N/A,https://www.ebay.co.uk/sch/2021newstart/m.html?_nkw=&_armrs=1&_ipg=&_from=&_udlo=11.89000000000004&_udhi=11.94000000000004&_sop=2&_ipg=200
For 12V 4CH Channel 433Mhz Wireless Remote Control Switch With 2 Transmitter NS,11.99,154319446651,4 sold,/,N/A,N/A,Does Not Apply,https://www.ebay.co.uk/sch/2021newstart/m.html?_nkw=&_armrs=1&_ipg=&_from=&_udlo=11.89000000000004&_udhi=11.94000000000004&_sop=2&_ipg=200
#93179055 Bar for Vauxhall Opel Saab CDTI Manifold Swirl Flap Rod Repair Kit 1.9,11.99,154318125591,3 sold,Newstart,93179055,"93179055, 55206459, 55182684, 55210201",QRr6215123,https://www.ebay.co.uk/sch/2021newstart/m.html?_nkw=&_armrs=1&_ipg=&_from=&_udlo=11.89000000000004&_udhi=11.94000000000004&_sop=2&_ipg=200
Wing Mirror Indicator Lens Light Lamp For Volvo S40 V50 C30 S60 V70 Left Side UK,11.99,154317110273,1 sold,NewStart,Mirror Indicator  VOLVO S40,"30716696, 31111090,, 31111090",N/A,https://www.ebay.co.uk/sch/2021newstart/m.html?_nkw=&_armrs=1&_ipg=&_from=&_udlo=11.89000000000004&_udhi=11.94000000000004&_sop=2&_ipg=200
FOR Land Rover Discovery 3 4 LR3 4 tailgate boot trunk handle switch repair kit,11.99,154308813262,20 sold,NewStart,Does Not Apply,N/A,N/A,https://www.ebay.co.uk/sch/2021newstart/m.html?_nkw=&_armrs=1&_ipg=&_from=&_udlo=11.89000000000004&_udhi=11.94000000000004&_sop=2&_ipg=200
NEW FOR FORD TRANSIT MK7 UPPER HIGH MOUNTED THIRD BRAKE LIGHT LAMP 5128002 - OEM,11.08,154305814206,11 sold,Newstart,"7C16-13N408-AC , 5128002","7C16-13N408-AC, 5128002, 7C1613N408AC, 5 128 002, 1383588 , 1418383 , 1519539 , 4888990 , 5089490, 6C11-13N408-AB , 6C11-13N408-AC , 6C11-13N408-AD, 7C16-13N408-AA , 7C16-13N408-AB , 7C16-13N408-AC, 6C1113N408AB , 6C1113N408AC , 6C1113N408AD, 7C1613N408AA , 7C1613N408AB , 7C1613N408AC",N/A,https://www.ebay.co.uk/sch/2021newstart/m.html?_nkw=&_armrs=1&_ipg=&_from=&_udlo=10.990000000000027&_udhi=11.040000000000028&_sop=2&_ipg=200
FUEL INJECTOR SEAL WASHER ORING KIT SET FOR PEUGEOT CITROEN 1.4 HDI 1148106 NS,10.66,154382388456,N/A,NewStart,"0249.C1 , 0348.R2 , 1982.F7 , 1981.96 , 1574.Q1","1148106, 2S6Q-6L004-AA, 1148101, 2S6Q-6P038-AA, Y401-10-235, 0249.C1, SU001-00611, 2S6Q6L004AA, 2S6Q6P038AA, 0249C1, Y401-13-113, 0348.R2, SU001-00825, 0348R2, 2S6Q-9A510-AA, 1204698, 2S6Q-9E568-AB, 1348625, 2S6Q9A510AA, 2S6Q9E568AB, 2S6Q-9F593-AC, 1348623, 2S6Q9F593AC",N/A,https://www.ebay.co.uk/sch/2021newstart/m.html?_nkw=&_armrs=1&_ipg=&_from=&_udlo=11.040000000000028&_udhi=11.090000000000028&_sop=2&_ipg=200
UK 3 Button Remote Key Fob 433MHZ Chip For Ford MONDEO FOCUS CMAX GALAXY FIESTA,10.85,154300288794,15 sold,NewStart,Does not apply,N/A,Does not apply,https://www.ebay.co.uk/sch/2021newstart/m.html?_nkw=&_armrs=1&_ipg=&_from=&_udlo=10.790000000000024&_udhi=10.840000000000025&_sop=2&_ipg=200
New For Mercedes-Benz OM642 Red Turbo & Breather Intake Seal Kit #A6420940080 UK,10.95,154235489975,30 sold,Unbranded,"A6420940080, A6420940580",A6420940080 A6420940580,GGi2847783,https://www.ebay.co.uk/sch/2021newstart/m.html?_nkw=&_armrs=1&_ipg=&_from=&_udlo=10.890000000000025&_udhi=10.940000000000026&_sop=2&_ipg=200
For Renault Kadjar Megane Koleos Carbon Fiber Car Key Cover Fob Case UK Stock,11.12,154343525675,3 sold,Newstart,Does Not Apply,N/A,N/A,https://www.ebay.co.uk/sch/2021newstart/m.html?_nkw=&_armrs=1&_ipg=&_from=&_udlo=11.040000000000028&_udhi=11.090000000000028&_sop=2&_ipg=200
For DIY Projects Easy Use Fine Tip Chemical Woodburning Pen Safe Scorch Marker,10.68,154301569624,6 sold,NewStart,N/A,N/A,Does not apply,https://www.ebay.co.uk/sch/2021newstart/m.html?_nkw=&_armrs=1&_ipg=&_from=&_udlo=10.590000000000021&_udhi=10.640000000000022&_sop=2&_ipg=200
LAND ROVER DISCOVERY 3 & 4 NEW BRAKE LIGHT SENSOR SWITCH OE (2004-11) #XKB500110,10.55,154300357770,2 sold,Newstart,XKB500110,XKB500110 / XKB500110G,N/A,https://www.ebay.co.uk/sch/2021newstart/m.html?_nkw=&_armrs=1&_ipg=&_from=&_udlo=10.49000000000002&_udhi=10.54000000000002&_sop=2&_ipg=200
NEW FOR BMW LICENSE NUMBER PLATE UPGRADE MODULES 24 LED CANBUS ERROR FREE LIGHTS,10.39,154245291328,62 sold,Unbranded,Does Not Apply,N/A,N/A,https://www.ebay.co.uk/sch/2021newstart/m.html?_nkw=&_armrs=1&_ipg=&_from=&_udlo=10.290000000000017&_udhi=10.340000000000018&_sop=2&_ipg=200
433MHz Remote Key Flip Fob Chip ID46 2 Button For Opel Vauxhall Astra Insignia A,10.55,154300290987,18 sold,NewStart,Does Not Apply,N/A,N/A,https://www.ebay.co.uk/sch/2021newstart/m.html?_nkw=&_armrs=1&_ipg=&_from=&_udlo=10.49000000000002&_udhi=10.54000000000002&_sop=2&_ipg=200
MIRROR ARM STEM COVER STEM CAP RIGHT UK DRIVER SIDE OFF SIDE FOR FIAT 500 NS,10.59,154299006609,6 sold,NewStart,735450654,N/A,N/A,https://www.ebay.co.uk/sch/2021newstart/m.html?_nkw=&_armrs=1&_ipg=&_from=&_udlo=10.49000000000002&_udhi=10.54000000000002&_sop=2&_ipg=200
NEW FOR BMW LICENSE NUMBER PLATE UPGRADE MODULES 24 LED CANBUS ERROR FREE LIGHTS,10.39,154245291328,62 sold,Unbranded,Does Not Apply,N/A,N/A,https://www.ebay.co.uk/sch/2021newstart/m.html?_nkw=&_armrs=1&_ipg=&_from=&_udlo=10.340000000000018&_udhi=10.390000000000018&_sop=2&_ipg=200
FOR ABS WHEEL SPEED SENSOR REAR RIGHT AUDI VW SEAT SKODA 1K0927808 NS,10.59,154296510960,19 sold,NewStart,WHT003858,"1K0927808, WHT003858, 6PU010039-141, 0986594507, 24.0711-6232.3, 1K0927808A, WHT003858B, WHT003858A",N/A,https://www.ebay.co.uk/sch/2021newstart/m.html?_nkw=&_armrs=1&_ipg=&_from=&_udlo=10.49000000000002&_udhi=10.54000000000002&_sop=2&_ipg=200
Heater Blower Fan Resistor For Nissan Micra (2003-2010 Note (2008-2012 UK STOCK,10.48,154317103788,1 sold,NewStart,HR74,"OE: 27150-AX115, OE: 27150AX115",N/A,https://www.ebay.co.uk/sch/2021newstart/m.html?_nkw=&_armrs=1&_ipg=&_from=&_udlo=10.390000000000018&_udhi=10.440000000000019&_sop=2&_ipg=200
BLOW TORCH BUTANE FLAMETHROWER BURNER WELDING AUTO IGNITION SOLDERING STRAIGHT A,10.45,154264201658,12 sold,Unbranded,N/A,N/A,68511c,https://www.ebay.co.uk/sch/2021newstart/m.html?_nkw=&_armrs=1&_ipg=&_from=&_udlo=10.390000000000018&_udhi=10.440000000000019&_sop=2&_ipg=200
"For DYSON V6 DC58,DC59,DC62 Vacuum Cleaner 185mm/225mm Roll Brush Bar 963830-01",9.48 to 10.55,154367049609,6 sold,For Dyson,N/A,N/A,Does Not Apply,https://www.ebay.co.uk/sch/2021newstart/m.html?_nkw=&_armrs=1&_ipg=&_from=&_udlo=10.49000000000002&_udhi=10.54000000000002&_sop=2&_ipg=200
1Pair Hand Front Seat Tilt Handles For Ford Fiesta MK6 2002-2008 1417520+1417521,10.29,154254798609,20 sold,Unbranded,Does Not Apply,"1417520, 1417521",N/A,https://www.ebay.co.uk/sch/2021newstart/m.html?_nkw=&_armrs=1&_ipg=&_from=&_udlo=10.190000000000015&_udhi=10.240000000000016&_sop=2&_ipg=200
Engine Valve Rocker Cover Gasket Bolt Seals For BMW E36 E46 E39 E83 E53 E85 SPR,10.29,154382456381,N/A,NewStart,Does Not Apply,"AJUSA: 56027600, ASHUKI: 142878A, BMW: 11129070990, CORTECO: 026178P, ELRING: 326560, ELWIS ROYAL: 9115412, FEBI: 12175, FEBI BILSTEIN: 12175, GLASER: V3601200, GOETZE: 2429076000, HANSPRIES: 500942016, OPEL: 1118985Z00, PATRON: PG16016, REINZ: 153307701, STELLOX: 1128032SX, SUZUKI: 1118985Z00, SWAG: 20912175, TOPRAN: 500942, 11121437395",N/A,https://www.ebay.co.uk/sch/2021newstart/m.html?_nkw=&_armrs=1&_ipg=&_from=&_udlo=10.240000000000016&_udhi=10.290000000000017&_sop=2&_ipg=200
1Pair Hand Front Seat Tilt Handles For Ford Fiesta MK6 2002-2008 1417520+1417521,10.29,154254798609,20 sold,Unbranded,Does Not Apply,"1417520, 1417521",N/A,https://www.ebay.co.uk/sch/2021newstart/m.html?_nkw=&_armrs=1&_ipg=&_from=&_udlo=10.240000000000016&_udhi=10.290000000000017&_sop=2&_ipg=200
1 pair Headlight Washer Jet Nozzle Cover Cap For BMW 3 Series E92 E93 2PCS NS,10.79,154352359964,8 sold,NewStart,61677171659 61677171660,6167-7171-659 6167-7171-660,N/A,https://www.ebay.co.uk/sch/2021newstart/m.html?_nkw=&_armrs=1&_ipg=&_from=&_udlo=10.690000000000023&_udhi=10.740000000000023&_sop=2&_ipg=200
For Renault Megane Clio Twingo Trafic 12V 18 SMD LED Number License Plate Lights,10.28,154296662052,3 sold,Newstart,8200480127,Renault Clio Vel Satis Laguna Logan Master Megane,ERG220863,https://www.ebay.co.uk/sch/2021newstart/m.html?_nkw=&_armrs=1&_ipg=&_from=&_udlo=10.190000000000015&_udhi=10.240000000000016&_sop=2&_ipg=200
Engine Valve Rocker Cover Gasket Bolt Seals For BMW E36 E46 E39 E83 E53 E85 SPR,10.29,154382456381,N/A,NewStart,Does Not Apply,"AJUSA: 56027600, ASHUKI: 142878A, BMW: 11129070990, CORTECO: 026178P, ELRING: 326560, ELWIS ROYAL: 9115412, FEBI: 12175, FEBI BILSTEIN: 12175, GLASER: V3601200, GOETZE: 2429076000, HANSPRIES: 500942016, OPEL: 1118985Z00, PATRON: PG16016, REINZ: 153307701, STELLOX: 1128032SX, SUZUKI: 1118985Z00, SWAG: 20912175, TOPRAN: 500942, 11121437395",N/A,https://www.ebay.co.uk/sch/2021newstart/m.html?_nkw=&_armrs=1&_ipg=&_from=&_udlo=10.190000000000015&_udhi=10.240000000000016&_sop=2&_ipg=200
TAILGATE BOOT HANDLE OPENING RELEASE MICRO SWITCH FOR CITROEN C2 C4 C5 C6 6490R3,9.99,154373849515,1 sold,NewStart,"6490.R3 , 6490R3","6490.R3 , 6490R3, 6490.R3, 6490R3",N/A,https://www.ebay.co.uk/sch/2021newstart/m.html?_nkw=&_armrs=1&_ipg=&_from=&_udlo=9.890000000000011&_udhi=9.940000000000012&_sop=2&_ipg=200
Air Filter Inlet Breather Hose Pipe For BMW Rocker Cam Cover N47 N57 13717803842,9.99,154365963922,1 sold,NewsStart,Does Not Apply,13717803842,N/A,https://www.ebay.co.uk/sch/2021newstart/m.html?_nkw=&_armrs=1&_ipg=&_from=&_udlo=9.890000000000011&_udhi=9.940000000000012&_sop=2&_ipg=200
ALFA ROMEO VAUXHALL SAAB 1.9 TiD JTD CDTi INLET MANIFOLD SWIRL FLAP BLANK DELETE,10.08,154296708781,3 sold,NewStart,55206459,"55190238, 55194739, 55206460",N/A,https://www.ebay.co.uk/sch/2021newstart/m.html?_nkw=&_armrs=1&_ipg=&_from=&_udlo=9.990000000000013&_udhi=10.040000000000013&_sop=2&_ipg=200
Licence Number Plate LED Light For Ford Fiesta Focus Mondeo C-Max Jaguar XJ XF,9.98,154254898102,43 sold,NewStart,542119,"6M2Z13550A, 6M2A13550AA, 6M2A13550AB, 6M2A13550AC, C2D16179, 5105886, 1423046, 1504964",N/A,https://www.ebay.co.uk/sch/2021newstart/m.html?_nkw=&_armrs=1&_ipg=&_from=&_udlo=9.890000000000011&_udhi=9.940000000000012&_sop=2&_ipg=200
RH & LH FOR FORD TRANSIT Mk8 TRANSIT CUSTOM 2012 SLIDING DOOR HANDLE 1769292 NS,9.99,154263957513,4 sold,NewStart,"1769292, BK21-V26600-AA, BK21V26600AA","1769292, BK21-V26600-AA, BK21V26600AA",N/A,https://www.ebay.co.uk/sch/2021newstart/m.html?_nkw=&_armrs=1&_ipg=&_from=&_udlo=9.890000000000011&_udhi=9.940000000000012&_sop=2&_ipg=200
3 Button 433Mhz For Ford Fiesta Fusion Transit Connect Remote Key Fob 4D63 Chip,10.66,154299160125,7 sold,NewStart,Does not apply,N/A,N/A,https://www.ebay.co.uk/sch/2021newstart/m.html?_nkw=&_armrs=1&_ipg=&_from=&_udlo=10.590000000000021&_udhi=10.640000000000022&_sop=2&_ipg=200
For VW Passat Golf MK5 MK6 Jetta Polo Chrome Electric Master Window Panel Switch,9.99,154307154139,35 sold,NewStart,GOLF5WP VW switch,5ND959857,N/A,https://www.ebay.co.uk/sch/2021newstart/m.html?_nkw=&_armrs=1&_ipg=&_from=&_udlo=9.890000000000011&_udhi=9.940000000000012&_sop=2&_ipg=200
2x LED Number License Plate Light Lamp For VW GOLF MK4 MK5 MK6 MK7 Seat UK SHIP,10.75,154291792582,83 sold,Newstart,Plate Light Lamp GOLF,N/A,Does Not Apply,https://www.ebay.co.uk/sch/2021newstart/m.html?_nkw=&_armrs=1&_ipg=&_from=&_udlo=10.690000000000023&_udhi=10.740000000000023&_sop=2&_ipg=200
IC Replacement Chip #MN864729 PS4 Pro/Slim Console HDMI Display - NEW & SEALED,10.99,154375370246,N/A,Newstart,N/A,N/A,MN864729,https://www.ebay.co.uk/sch/2021newstart/m.html?_nkw=&_armrs=1&_ipg=&_from=&_udlo=10.890000000000025&_udhi=10.940000000000026&_sop=2&_ipg=200
1 pair Headlight Washer Jet Nozzle Cover Cap For BMW 3 Series E92 E93 2PCS NS,10.79,154352359964,8 sold,NewStart,61677171659 61677171660,6167-7171-659 6167-7171-660,N/A,https://www.ebay.co.uk/sch/2021newstart/m.html?_nkw=&_armrs=1&_ipg=&_from=&_udlo=10.740000000000023&_udhi=10.790000000000024&_sop=2&_ipg=200
NEW VW Golf mk7 2013-2020 Heated  wing mirror glass for Right Driver Side UK,10.88,154305780658,1 sold,NewStart,Golf  WING MIRROR GLASS heated,N/A,N/A,https://www.ebay.co.uk/sch/2021newstart/m.html?_nkw=&_armrs=1&_ipg=&_from=&_udlo=10.790000000000024&_udhi=10.840000000000025&_sop=2&_ipg=200
TOUAREG BATTERY CUT OFF FUSE PROTECTION NS FOR AUDI A1 A3 A4 A5 A6 A8 Q5 Q7 VW,10.88,154382413912,N/A,NewStart,EBP-AU-000,4F0915519,N/A,https://www.ebay.co.uk/sch/2021newstart/m.html?_nkw=&_armrs=1&_ipg=&_from=&_udlo=10.790000000000024&_udhi=10.840000000000025&_sop=2&_ipg=200
Remote Key Fob For Renault Traffic Master Kangoo Vauxhall Vivaro Movano #433MHz,10.88,154225044186,14 sold,Unbranded,Does Not Apply,N/A,Does not apply,https://www.ebay.co.uk/sch/2021newstart/m.html?_nkw=&_armrs=1&_ipg=&_from=&_udlo=10.790000000000024&_udhi=10.840000000000025&_sop=2&_ipg=200
For VW T5 Caddy Golf Jetta Passat Skoda Touran 2x LED License Number Plate Light,10.99,154249962190,54 sold,Newstart,Does Not Apply,N/A,N/A,https://www.ebay.co.uk/sch/2021newstart/m.html?_nkw=&_armrs=1&_ipg=&_from=&_udlo=10.890000000000025&_udhi=10.940000000000026&_sop=2&_ipg=200
DOOR CHECK STRAP HINGE STOPPER FOR VAUXHALL ASTRA J FRONT 160010 13270665 NS,10.99,154372553528,1 sold,NewStart,160010,"160010 / 13270665, 160010, 13270665",N/A,https://www.ebay.co.uk/sch/2021newstart/m.html?_nkw=&_armrs=1&_ipg=&_from=&_udlo=10.890000000000025&_udhi=10.940000000000026&_sop=2&_ipg=200
ABS Wheel Speed Sensor Front Fits Mini Hatchback 2001-06 Convertible 2004-07 NS,10.99,154367283399,N/A,NewStart,Does Not Apply,"OE: 34526756384, BLUE PRINT: ADB117103, DELPHI: SS20123, FEBI BILSTEIN: 34262, FUELPARTS: AB1245, HELLA: 6PU009106-311, INTERMOTOR: 60645, SIEMENS: S107611001Z, TRW: GBS1032, 34526756384",N/A,https://www.ebay.co.uk/sch/2021newstart/m.html?_nkw=&_armrs=1&_ipg=&_from=&_udlo=10.890000000000025&_udhi=10.940000000000026&_sop=2&_ipg=200
For Xiaomi M365/M365 Pro Electric Scooter Fender Mudguard Rear Support Tools Kit,7.98 to 10.98,154367381859,N/A,Newstart,N/A,N/A,m365 mudguar,https://www.ebay.co.uk/sch/2021newstart/m.html?_nkw=&_armrs=1&_ipg=&_from=&_udlo=10.890000000000025&_udhi=10.940000000000026&_sop=2&_ipg=200
GLOSS BLACK FOR VW TRANSPORTER T5 T6 DOOR HANDLE COVER CARAVELLE CADDY VAN NS,10.99,154353795232,1 sold,NewStart,Does Not Apply,ASW938245,N/A,https://www.ebay.co.uk/sch/2021newstart/m.html?_nkw=&_armrs=1&_ipg=&_from=&_udlo=10.890000000000025&_udhi=10.940000000000026&_sop=2&_ipg=200
Carbon Fiber Door Handle Covers For VW TRANSPORTER T5 T6 CADDY VAN CARAVELLE NS,10.99,154265664264,10 sold,NewStart,Does Not Apply,DSN914194,N/A,https://www.ebay.co.uk/sch/2021newstart/m.html?_nkw=&_armrs=1&_ipg=&_from=&_udlo=10.890000000000025&_udhi=10.940000000000026&_sop=2&_ipg=200
1 Pair Number Plate Lamp For Ford Transit LED License Plate Light Rear MK6 MK7,10.95,154373833608,21 sold,Newstart,Number Plate Light TRANSIT,"4388111, 6161387",N/A,https://www.ebay.co.uk/sch/2021newstart/m.html?_nkw=&_armrs=1&_ipg=&_from=&_udlo=10.890000000000025&_udhi=10.940000000000026&_sop=2&_ipg=200
NEW For FORD FIESTA / FOCUS / C MAX 5 SPEED IB5 GEARBOX SELECTOR OIL SEAL NS,10.99,154357448883,5 sold,NewStart,1321128,N/A,Does not apply,https://www.ebay.co.uk/sch/2021newstart/m.html?_nkw=&_armrs=1&_ipg=&_from=&_udlo=10.890000000000025&_udhi=10.940000000000026&_sop=2&_ipg=200
Rear Door Hinge Check Strap Crafter Locator Guide For Mercedes Benz Sprinter VW,9.75,154296608597,16 sold,NewStart,Does Not Apply,"A9067600428, 9067600428",N/A,https://www.ebay.co.uk/sch/2021newstart/m.html?_nkw=&_armrs=1&_ipg=&_from=&_udlo=9.690000000000008&_udhi=9.740000000000009&_sop=2&_ipg=200
Fit Audi Seat Skoda VW 2.7 3.0 TDI p2015 Manifold Actuator Repair Kit Bracket NS,9.88,154322123407,4 sold,NewStart,Does Not Apply,"059129711 059129712, 059129711CK, 059129712BQ, 059129711DC, 059129712BT, 059198212, 059 129 711, 059 129 712, 059129717J, 059129086",N/A,https://www.ebay.co.uk/sch/2021newstart/m.html?_nkw=&_armrs=1&_ipg=&_from=&_udlo=9.79000000000001&_udhi=9.84000000000001&_sop=2&_ipg=200
12V Car Charger Lighter Magnetic Power Adapter For Microsoft Surface PRO 4 /3 NS,9.66,154390362138,N/A,Newstart,W003-A052-Black,N/A,Does Not Apply,https://www.ebay.co.uk/sch/2021newstart/m.html?_nkw=&_armrs=1&_ipg=&_from=&_udlo=9.590000000000007&_udhi=9.640000000000008&_sop=2&_ipg=200
Gear Shift Knob w/ Gaitor Gaiter Boot Cover For vw transporter t5 t5.1 6 Speed*,9.75,154305923752,N/A,NewStart,rhD1738654,N/A,Does Not Apply,https://www.ebay.co.uk/sch/2021newstart/m.html?_nkw=&_armrs=1&_ipg=&_from=&_udlo=9.690000000000008&_udhi=9.740000000000009&_sop=2&_ipg=200
FOR FIAT 500 MIRROR ARM STEM COVER STEM CAP LEFT PASSENGER SIDE NEW UK NewStart,9.88,154243559325,13 sold,NewStart,Does Not Apply,0735642839,N/A,https://www.ebay.co.uk/sch/2021newstart/m.html?_nkw=&_armrs=1&_ipg=&_from=&_udlo=9.79000000000001&_udhi=9.84000000000001&_sop=2&_ipg=200
Right Outer Rear Door Handle For Ford Transit and Transit #1494080 UK FAST SHIP,9.39,154306849504,1 sold,Newstart,AW00071,"4069910, 1494080",N/A,https://www.ebay.co.uk/sch/2021newstart/m.html?_nkw=&_armrs=1&_ipg=&_from=&_udlo=9.290000000000003&_udhi=9.340000000000003&_sop=2&_ipg=200
Gas Cap Fuel Tank Cover Lid Threaded Style for 06-15 Honda Civic #17670-T3W-A01,9.28,154248622465,1 sold,Unbranded,17670-T3W-A01,17670-T3W-A01,N/A,https://www.ebay.co.uk/sch/2021newstart/m.html?_nkw=&_armrs=1&_ipg=&_from=&_udlo=9.190000000000001&_udhi=9.240000000000002&_sop=2&_ipg=200
FOR FORD TRANSIT REAR DOOR HANDLE INNER LH NO CABLE OR LOCK CATCH MK6 MK7 TRA665,9.28,154322037974,3 sold,Newstart,"1494098, 1494102, HANDLE MK inner","1494102H, 1494098	1494102	HANDLE MK inner",1494102H,https://www.ebay.co.uk/sch/2021newstart/m.html?_nkw=&_armrs=1&_ipg=&_from=&_udlo=9.190000000000001&_udhi=9.240000000000002&_sop=2&_ipg=200
Intake Swirl Flap For BMW N47 Delete Blank Plug Bung Metal w Manifold Gasket NS,9.29,154280332192,9 sold,NewStart,Does Not Apply,N/A,N/A,https://www.ebay.co.uk/sch/2021newstart/m.html?_nkw=&_armrs=1&_ipg=&_from=&_udlo=9.240000000000002&_udhi=9.290000000000003&_sop=2&_ipg=200
CUP Holder With Fitting Tape For BMW 1 SERIES  HOLDER BLACK E87 E81 E82 E88 UK,9.35,154296666283,18 sold,NewStart,BMW 1 SERIES CUP HOLDER,"CUP HOLDER, BMW CUP HOLDER, 1 SERIES CUP HOLDER, BMW 1 SERIES",N/A,https://www.ebay.co.uk/sch/2021newstart/m.html?_nkw=&_armrs=1&_ipg=&_from=&_udlo=9.290000000000003&_udhi=9.340000000000003&_sop=2&_ipg=200
Front Door Left Right Side Stop Check Strap 3DR 5DR For Peugeot 206 9181C8 NS,9.59,154372528111,N/A,NewStart,9181C8,9181C8,N/A,https://www.ebay.co.uk/sch/2021newstart/m.html?_nkw=&_armrs=1&_ipg=&_from=&_udlo=9.490000000000006&_udhi=9.540000000000006&_sop=2&_ipg=200
UK 2PCS LED Motorcycle Turn Signal Light For Indicator Handle Bar End Handlebar,9.08,154306860092,3 sold,NewStart,Motorcycle Turn Signal  Light,N/A,N/A,https://www.ebay.co.uk/sch/2021newstart/m.html?_nkw=&_armrs=1&_ipg=&_from=&_udlo=8.989999999999998&_udhi=9.04&_sop=2&_ipg=200
New Knock Sensor 30530PRC003 HONDA Civic TYPE-R EP3 FN2 K20A K20A2 S2000 UK SHIP,9.15,154342186800,N/A,Newstart,30530PRC003,"30530PRC003, 30530PRC-003, 30530-PRC-003, 30530PRBA01",N/A,https://www.ebay.co.uk/sch/2021newstart/m.html?_nkw=&_armrs=1&_ipg=&_from=&_udlo=9.09&_udhi=9.14&_sop=2&_ipg=200
20x Marine Quality Connector Compatible with Anderson Powerpole 30 Amp 30A 600V,8.89,154235419536,7 sold,Unbranded,N/A,N/A,Does Not Apply,https://www.ebay.co.uk/sch/2021newstart/m.html?_nkw=&_armrs=1&_ipg=&_from=&_udlo=8.839999999999996&_udhi=8.889999999999997&_sop=2&_ipg=200
2Pcs For Audi A4 A6 A8 2004-2012 Xenon White LED License Number Plate Light Lamp,8.99,154245441862,28 sold,Unbranded,VP020,N/A,N/A,https://www.ebay.co.uk/sch/2021newstart/m.html?_nkw=&_armrs=1&_ipg=&_from=&_udlo=8.939999999999998&_udhi=8.989999999999998&_sop=2&_ipg=200
UK ELECTRIC DOUBLE WINDOW CONTROL SWITCH FRONT RIGHT FOR SEAT IBIZA 2K0959857,8.88,154301620479,15 sold,Newstart,"2K0959857, 1K3959857A","2K0 959 857A, 2K0 959 857 A, 2K0959857A, 1K3959857A",N/A,https://www.ebay.co.uk/sch/2021newstart/m.html?_nkw=&_armrs=1&_ipg=&_from=&_udlo=8.789999999999996&_udhi=8.839999999999996&_sop=2&_ipg=200
UK ELECTRIC DOUBLE WINDOW CONTROL SWITCH FRONT RIGHT FOR SEAT IBIZA 2K0959857,8.88,154301620479,15 sold,Newstart,"2K0959857, 1K3959857A","2K0 959 857A, 2K0 959 857 A, 2K0959857A, 1K3959857A",N/A,https://www.ebay.co.uk/sch/2021newstart/m.html?_nkw=&_armrs=1&_ipg=&_from=&_udlo=8.839999999999996&_udhi=8.889999999999997&_sop=2&_ipg=200
UK For Vauxhall Corsa D Heater Blower Resistor Cabin Fan Resister OEM 13248240,8.88,154255079560,15 sold,Unbranded,Does Not Apply,13248240,N/A,https://www.ebay.co.uk/sch/2021newstart/m.html?_nkw=&_armrs=1&_ipg=&_from=&_udlo=8.839999999999996&_udhi=8.889999999999997&_sop=2&_ipg=200
UK For BMW F10 F20 F30 IDrive Car Multimedia Big Knob Covers Button Trim Control,8.88,154300315302,7 sold,NewStart,Does Not Apply,Button Trim  BMW F10,N/A,https://www.ebay.co.uk/sch/2021newstart/m.html?_nkw=&_armrs=1&_ipg=&_from=&_udlo=8.839999999999996&_udhi=8.889999999999997&_sop=2&_ipg=200
ELECTRIC POWER FRONT RIGHT WINDOW SWITCH FOR RENAULT TRAFIC 2 II 8200108269 NS,8.79,154237260019,23 sold,NewStart,8200108269,"93858938, 8200108269, 8200476806, 4417286",N/A,https://www.ebay.co.uk/sch/2021newstart/m.html?_nkw=&_armrs=1&_ipg=&_from=&_udlo=8.739999999999995&_udhi=8.789999999999996&_sop=2&_ipg=200
2PCS Retaining Ring Lugs Gear Stick Lever Gaiter Boot For Fiat 500 c NS 55344016,8.79,154258240033,6 sold,NewStart,/,N/A,N/A,https://www.ebay.co.uk/sch/2021newstart/m.html?_nkw=&_armrs=1&_ipg=&_from=&_udlo=8.739999999999995&_udhi=8.789999999999996&_sop=2&_ipg=200
Bicycle Cycling MTB V Brake Full Set Front/Rear Mountain Aluminum Alloy Hot UK,8.66,154322009722,8 sold,Newstart,N/A,N/A,Does Not Apply,https://www.ebay.co.uk/sch/2021newstart/m.html?_nkw=&_armrs=1&_ipg=&_from=&_udlo=8.589999999999993&_udhi=8.639999999999993&_sop=2&_ipg=200
Electric Power Window Switch For V-W Eos G-olf MK5 MK6 GTI 5K3959857 Driver Side,8.66,154366107483,4 sold,Newstart,5K3959857,N/A,N/A,https://www.ebay.co.uk/sch/2021newstart/m.html?_nkw=&_armrs=1&_ipg=&_from=&_udlo=8.589999999999993&_udhi=8.639999999999993&_sop=2&_ipg=200
UK For Vauxhall Corsa D Heater Blower Resistor Cabin Fan Resister OEM 13248240,8.88,154255079560,15 sold,Unbranded,Does Not Apply,13248240,N/A,https://www.ebay.co.uk/sch/2021newstart/m.html?_nkw=&_armrs=1&_ipg=&_from=&_udlo=8.789999999999996&_udhi=8.839999999999996&_sop=2&_ipg=200
UK For BMW F10 F20 F30 IDrive Car Multimedia Big Knob Covers Button Trim Control,8.88,154300315302,7 sold,NewStart,Does Not Apply,Button Trim  BMW F10,N/A,https://www.ebay.co.uk/sch/2021newstart/m.html?_nkw=&_armrs=1&_ipg=&_from=&_udlo=8.789999999999996&_udhi=8.839999999999996&_sop=2&_ipg=200
2Pcs WING MIRROR INTERIOR ADJUSTMENT RUBBER KNOB HANDLE FOR FORD FIESTA 4 IV 5 V,8.88,154308797870,10 sold,Newstart,1507431,"6S61 17B718 AA, 1507431",N/A,https://www.ebay.co.uk/sch/2021newstart/m.html?_nkw=&_armrs=1&_ipg=&_from=&_udlo=8.789999999999996&_udhi=8.839999999999996&_sop=2&_ipg=200
FOR NISSAN NOTE 2005-12 TAILGATE BOOT HANDLE RELEASE SWITCH 90602-JD00B NS,8.99,154288787987,6 sold,NewStart,"90602-JD00B, 90602-JD004","90602-JD00B, 90602-JD004",N/A,https://www.ebay.co.uk/sch/2021newstart/m.html?_nkw=&_armrs=1&_ipg=&_from=&_udlo=8.939999999999998&_udhi=8.989999999999998&_sop=2&_ipg=200
2Pcs WING MIRROR INTERIOR ADJUSTMENT RUBBER KNOB HANDLE FOR FORD FIESTA 4 IV 5 V,8.88,154308797870,10 sold,Newstart,1507431,"6S61 17B718 AA, 1507431",N/A,https://www.ebay.co.uk/sch/2021newstart/m.html?_nkw=&_armrs=1&_ipg=&_from=&_udlo=8.839999999999996&_udhi=8.889999999999997&_sop=2&_ipg=200
For BMW 3 Series E46 1998-2006 Ultrasonic PDC Parking Reverse Sensor 66206989069,8.99,154318237333,5 sold,NewStart,Does Not Apply,"66206989067, 66206989069, 66206989069, 66206989067",N/A,https://www.ebay.co.uk/sch/2021newstart/m.html?_nkw=&_armrs=1&_ipg=&_from=&_udlo=8.939999999999998&_udhi=8.989999999999998&_sop=2&_ipg=200
Makita Brush Holder x CB-430 Brushes & x2 Caps for BGA450 BGA452 DGA452 UK STOCK,9.48,154308020255,9 sold,Newstart,N/A,N/A,638921-2,https://www.ebay.co.uk/sch/2021newstart/m.html?_nkw=&_armrs=1&_ipg=&_from=&_udlo=9.390000000000004&_udhi=9.440000000000005&_sop=2&_ipg=200
LED Licence Number Plate Light For Focus Ford Fiesta MK C-Max Kuga Mondeo Jaguar,9.59,154279239036,37 sold,NewStart,Does Not Apply,6M2A-13550-AA,N/A,https://www.ebay.co.uk/sch/2021newstart/m.html?_nkw=&_armrs=1&_ipg=&_from=&_udlo=9.490000000000006&_udhi=9.540000000000006&_sop=2&_ipg=200
BOOT REAR TAILGATE LOCK ACTUATOR FOR RENAULT CLIO MK2 MEGANE TWINGO SOLENOID,9.19,154357568203,4 sold,NewStart,011GCS69169,7700435694,N/A,https://www.ebay.co.uk/sch/2021newstart/m.html?_nkw=&_armrs=1&_ipg=&_from=&_udlo=9.09&_udhi=9.14&_sop=2&_ipg=200
Heater Blower Fan Switch FOR Fiat Ducato Peugeot Boxer Citroen Relay 77362439 NS,9.59,154315784290,7 sold,NewStart,1614183080,"1614183080, 1607508680, 160929980, 1609029980, 77362439, 77366210, 77367027",PEUG - 1614183080,https://www.ebay.co.uk/sch/2021newstart/m.html?_nkw=&_armrs=1&_ipg=&_from=&_udlo=9.490000000000006&_udhi=9.540000000000006&_sop=2&_ipg=200
For Land Rover Discovery Defender TD5 2.5 Diesel Starter Motor Repair Fix Kit UK,9.48,154367287405,7 sold,Newstart,228000-7220,228000-7220,Does Not Apply,https://www.ebay.co.uk/sch/2021newstart/m.html?_nkw=&_armrs=1&_ipg=&_from=&_udlo=9.390000000000004&_udhi=9.440000000000005&_sop=2&_ipg=200
